book_isbn,book_title,book_image,book_author,book_translator,book_category,book_publisher,book_summary,create_time,update_time
,毛泽东选集（第一卷）,https://img2.doubanio.com/view/subject/l/public/s24511492.jpg,毛泽东,,哲学,人民出版社,69年横排大字版第一卷http://book.douban.com/subject/20277858/第二卷http://book.douban.com/subject/20444994/第三卷http://book.douban.com/subject/20445009/第四卷http://book.douban.com/subject/20445024/,2021-12-20 23:30:05,2021-12-20 23:30:05
9787508089119,论僭政,https://img1.doubanio.com/view/subject/l/public/s33316938.jpg,[美]施特劳斯,彭磊,哲学,华夏出版社,《论僭政》中文版曾在2006年出版，此次全部重新翻译，并依照英文新版（芝加哥大学2013年版）做了增补。《论僭政》包含施特劳斯对色诺芬《希耶罗》做的义疏《希耶罗与僭主》以及施特劳斯在法国的老友科耶夫的评论《僭政与智慧》，还有两人的部分通信。由于触发了与科耶夫的争论，《论僭政》也极其有助于理解施特劳斯的古典立场何以与现代立场对立，揭示了古今政治科学的根本差异，振聋发聩。因此《论僭政》不再只是施特劳斯对一部古典作品的解读，还展现了施特劳斯与科耶夫之间深刻的思想争论，也记录了两人由年轻到年老的友谊。凡此种种，使得《论僭政》当之无愧地成为二十世纪的经典。,2021-12-20 23:30:11,2021-12-20 23:30:11
9787532769896,当代政治哲学,https://img1.doubanio.com/view/subject/l/public/s28317639.jpg,[加拿大]威尔·金里卡,刘莘,哲学,上海译文出版社,“历经一百多年而尚在进行之中的中国社会巨变依然保持其前景不明朗的特点，这自然无法满足人们对良序而稳定社会的要求，而政治哲学的正义目标的预期后果却正在于这样一种社会”，这为政治哲学在中国的发展提供了适宜的土壤。可以说，正义的问题是政治哲学家关注的核心问题，围绕对这一问题的不同理解和回答，政治哲学史呈现为异彩纷呈的图景。然而，自功利主义出现以来，各派理论不管沿着何种路径展开其自身的逻辑，都不可能绕过对功利主义的回应、批判。罗尔斯的《正义论》出版后，当代政治哲学的版图重组，不仅历史上既已形成的功利主义、自由主义等各派理论的坐标发生了根本性的变化，而且伴随着人们围绕《正义论》一书所展开的理论论辩，公民资格理论、社群主义、多元文化主义和女权主义等理论派别异军突起，从根本上改变了功利主义占主导地位的格局。《当代政治哲学》一书正是对这种理论场景的呈现。作者威...,2021-12-20 23:30:18,2021-12-20 23:30:18
9789900121121,美学,https://img1.doubanio.com/view/subject/l/public/s29555829.jpg,黑格尔,,哲学,商务印书馆,本书是德国古典哲学家黑格尔（1770—1831）的重要著作，首次出版于1835年。黑格尔在书中全面联系人类艺术发展的历史，建立了完整的唯心主义美学理论体系。本书提出美学研究的范围是美的艺术或艺术的美，美学实质上是“艺术哲学”，主张美是主观与客观、形式与内容、理想与现实、自由与必然的辩证统一，强调艺术是绝对观念在感觉经验上的体现，艺术的发展是精神克服物质局限性而达到“主观性”的过程。本书讲述了美学的范围和地位、艺术美的概念，以及美和艺术的科学研究方式等，反映了黑格尔的主要美学思想，是他客观唯心主义哲学体系的一个组成部分，也是他的哲学体系在美学和艺术领域的具体表现，集西方美学理论之大成，把德国古典美学推向顶峰。,2021-12-20 23:30:25,2021-12-20 23:30:25
9787101116779,四书章句集注,https://img9.doubanio.com/view/subject/l/public/s29112036.jpg,[南宋]朱熹集注,,哲学,中华书局,此书为朱熹最有代表性的著作之一。该书文字洗练，对《四书》训诂文字，疏通文理，注重义理阐发，从整体上探求与把握儒学精义，堪称解读《四书》的经典之作。此次整理以清嘉庆十六年吴县吴氏父子校刻本为底本，用清康熙内府仿刻的宋淳祐二年大字本校勘。 此次推出的精装典藏本，开本大小由140毫米*203毫米，调整为150毫米*220毫米，各级字号随之有所加大，每面四周留白也增加不少，从而在方便读者研读的同时，也便于做随文笔记。,2021-12-20 23:30:33,2021-12-20 23:30:33
9787108070753,什么是教育,https://img9.doubanio.com/view/subject/l/public/s33864786.jpg,[德]卡尔·雅斯贝尔斯,童可依,哲学,生活·读书·新知三联书店,德国哲学家雅斯贝尔斯关于教育的思想汇编，涉及了教育的本质、类型、任务、方式、可能性与边界，特别是大学教育的理念和任务，等等。书中充盈着雅氏关于教育的洞见，如真正的教育不是知识的堆集和智识的训练，而是人的教育，灵魂的教育，整全的教育；他提倡苏格拉底式的教育方式，强调师生间的平等尊重、互相照亮；他强调教育的目的是保持独立自由的个人意志以及对真理的不懈追求，并提出了本真的教育的方法。,2021-12-20 23:30:40,2021-12-20 23:30:40
9780415378475,The Conquest of Happiness,https://img1.doubanio.com/view/subject/l/public/s3498799.jpg,BertrandRussell,,哲学,Routledge,"Bertrand Russell describes the purpose of this book as the putting together of some remarks on the state of happiness which are inspired by common sense, rather than any profound philosophy or deep erudition. It is based on the belief that many people who are unhappy could become happy by well-directed effort.   --This text refers to an out of print or unavailable edition of th...",2021-12-20 23:30:50,2021-12-20 23:30:50
9787544784382,局外人 西绪福斯神话,https://img2.doubanio.com/view/subject/l/public/s33791192.jpg,［法国］阿尔贝·加缪,郭宏安,哲学,译林出版社,加缪代表性中篇小说+哲学随笔加缪研究专家郭宏安据“七星文库”版翻译翻译“傅雷翻译出版奖”获奖译本特别附赠法语引文书签和封面同款纪念卡片---------------------------《局外人》是加缪思想的出发点，以阿尔及尔一家船运公司的职员默而索的自述形 式写成。小说以简练得近乎枯涩的笔调，冷静得近乎淡漠的口吻，震惊读书界。《西绪福斯神话》以哲学的语言论证了《局外人》的基本思想。加缪在书中论述了“荒诞哲学”，这是一个从觉醒到行动的完整哲学体系。,2021-12-20 23:30:57,2021-12-20 23:30:57
9787101107784,论语译注（典藏版）,https://img1.doubanio.com/view/subject/l/public/s28277438.jpg,杨伯峻,,哲学,中华书局,《论语》记载了孔子和弟子们的问答，凡20篇，是儒家基本经典，影响极大。古往今来，注家众多，其中以今人杨伯峻先生的译注最为脍炙人口。《论语译注（典藏版）》是杨伯峻先生《论语译注》（简体字本）的一个扩充版，增加了原来简体字本没有排而原来繁体字本有的《试论孔子》、导言、例言、《论语词典》等，使读者得见简体字本杨伯峻《论语译注》的全貌。同时在纸张材料和装帧方式上更考究，具有典藏价值。,2021-12-20 23:31:04,2021-12-20 23:31:04
9787560443966,论再生产,https://img1.doubanio.com/view/subject/l/public/s33948068.jpg,[法]路易·阿尔都塞,吴子枫,哲学,西北大学出版社,阿尔都塞在五月风暴后撰写的重要手稿，其最有影响力的论文《意识形态和意识形态国家机器》即由从中抽取的片段合成。本书在作者去世后出版，被认为是其最具体系性的文本，也是当代西方马克思主义政治哲学的代表作之一。本书探讨了马克思主义历史科学关于社会形态理论和国家理论的一系列经典主题，最核心的是探讨了资本主义社会形态中的生产关系的再生产如何得到保障的问题，阿尔都塞在此基础上对马克思主义意识形态理论做出的论述，已被公认为当代最重要的理论成就之一。我认为可以说，这个文本已经成了、并将继续是阿尔都塞最重要的文本之一：是要描绘他的思想特征就必须参考的文本之一；是使用了烙有他自己名字的“印记”因而可被直接辨认出来的那些概念的文本之一；最后，它铭刻进了马克思主义、结构主义和后结构主义的后继传统中，成为当代哲学仍在继续研究的文本之一。——巴利巴尔这部书稿首先是一份战斗性的...,2021-12-20 23:31:12,2021-12-20 23:31:12
9780786747818,Book,https://img1.doubanio.com/view/subject/l/public/s4420537.jpg,ClivePriddle,,哲学,PublicAffairs,"After the last page is turned and the cover closed on a great book, is it really over? Ever wonder what happens to Harry Potter after, say, twenty years of marriage and a steady government gig? Or what Karl Marx would say about today's financial crisis? What did Scarlett O'Hara really think about tomorrow? What comes after ''ever after?'' BOOK: The Sequel dares to answer these ...",2021-12-20 23:31:20,2021-12-20 23:31:20
9787010123561,道德形而上学奠基,https://img2.doubanio.com/view/subject/l/public/s28305971.jpg,[德]伊曼努尔·康德,杨云飞译,哲学,人民出版社,《道德形而上学基础》出版于1785年，是康德道德哲学最重要的著作之一，是在完成《纯粹理性批判》和《实践理性批判》之间写成的小册子。这部著作系统地展示了康德如何从一般道德理性知识中挖掘出道德性的最高原则，并对道德法则与自由的关系作了一个初步的清理。康德正是在本书中提出了“人是目的”这一命题，本书采取一种从下而上逐步提升的方式，或者说从分析上升到综合、从具体提高到抽象的方式，从日常现实的道德经验出发，是最通俗的一部。不仅展示了康德道德哲学的整个逻辑体系，而且揭示了这个道德体系的发生学，表明它的那些原理是怎么建立起来的。包含了康德道德哲学中许多难解之谜的谜底。本书由杨云飞译，邓晓芒校订。,2021-12-20 23:31:28,2021-12-20 23:31:28
9787010167350,纯粹理性批判,https://img9.doubanio.com/view/subject/l/public/s29420655.jpg,[德]康德,邓晓芒译,哲学,人民出版社,本书是康德三大批判著作、也是其全部哲学著述中意义最为特殊和重大的巨著，它改变了整个西方哲学前进发展的方向和进程。康德花了11年的时间完成，1781年初版，1787年再版。 贯彻始终的根本指导思想就是：通过对理性本身、即人类先天认识能力的批判考察，确定它有哪些先天的、即具有普遍性和必然性的要素，以及这些要素的来源、功能、条件、范围和界限，从而确定它能认识什么和不能认识什么，在这基础上对形而上学的命运和前途作出最终的判决和规定，其使命是为真正的、作为科学的形而上学提供坚实可靠的基础。全书约有45万字，除了序言和一个总的导言外，分为“先验要素论”和“先验方法论” 。中译本是直接从德文原本由邓晓芒翻译、杨祖陶校订，其译文精良，堪称佳作。书后还附有德汉术语索引、汉德术语对照以及人名索引，方便使用。,2021-12-20 23:31:37,2021-12-20 23:31:37
9787518412600,哲学的历程,https://img3.doubanio.com/view/subject/l/public/s33750290.jpg,[美]威廉·F.劳黑德,郭立东,哲学,中国轻工业出版社,哲学史不是一座布满灰尘的博物馆，它的呈现远比我们认为的更加富于生气。好的哲学史书也不是包含密集而扼要事实信息的百科全书，而是一场对话与发现之旅。本书产生于作者几十年的哲学史教学经历，一再修订再版。它致力于厘清长达若干世纪的哲学对话，介绍了古代、中世纪、近代和现代四个时期的主要哲学家，并把他们置于具体的文化背景中，梳理了他们试图完成的哲学任务、对前人思想的继承与发展。使用本书的教师与学生也是这场对话的积极参与者。本书每章都有其独立性，教师可以根据课时安排任选章节开展教学。分布于书中各处的“想一想”以及每章末尾的“当代联系”、理解题、思考题将让学生充分参与到这场哲学对话中来，与伟大的哲学家同行，培养思维技能，扩展好奇心，进而以新的眼光看待世界。由此，在哲学这场庞大的聚会中，新的对话不断开启，随着新的参与者的加入，之前对话的主题被重新拾起并沿不同方向...,2021-12-20 23:31:44,2021-12-20 23:31:44
9787010167282,判断力批判,https://img9.doubanio.com/view/subject/l/public/s29414764.jpg,[德]伊曼努尔·康德,邓晓芒译,哲学,人民出版社,本书是德国古典哲学家康德的三大批判之第三批判，出版于1790年。这是康德具有里程碑意义的三部著作，他从构思到写就这三部著作花了二十多年的时间，是其批判时期哲学思想的集中表述。从内容上来看，“纯粹理性批判”的任务是要确定人类认识能力的先天要素及其先天要素的若干规定；“实践理性批判”的任务是理性的实践使用的先天原理的可能性、范围和界限：“判断力批判”是要消除前两个批判所造成的自然和自由、现象和本体、知识和道德的分裂与对立。全书除了序言和一个完整的导言外，分为“审美判断力批判”和“目的论判断力批判”两部分。本书的翻译主要依据《哲学丛书》第39a卷，是卡尔·弗兰德尔编，费利克斯·迈纳出版社于汉堡1924年的第六版，1974年重印本。,2021-12-20 23:31:52,2021-12-20 23:31:52
9787516124512,畏惧与颤栗 恐惧的概念 致死的疾病,https://img3.doubanio.com/view/subject/l/public/s26592020.jpg,[丹]克尔凯郭尔,京不特,哲学,中国社会科学出版社,《畏惧与颤栗 恐惧的概念 致死的疾病》是索伦·奥碧·克尔凯郭尔著作汉语翻译包括了《畏惧与颤栗》、《恐惧的概念》和《致死的疾病》。其中《畏惧与颤栗》、《恐惧的概念》是出自索伦·克尔凯郭尔研究中心的《索伦·克尔凯郭尔文集》第四卷（1997年版），而《畏惧与颤栗 恐惧的概念 致死的疾病》则是出自中心的《索伦·克尔凯郭尔文集》第十一卷（2006年版）。,2021-12-20 23:31:59,2021-12-20 23:31:59
9787010106861,马克思恩格斯选集,https://img1.doubanio.com/view/subject/l/public/s26032279.jpg,[德]卡尔·马克思,中央编译局,哲学,人民出版社,中文第三版，根据十卷本《马克思恩格斯文集》修订，选文篇目经典、篇幅适宜、译文准确、格式考究。,2021-12-20 23:32:06,2021-12-20 23:32:06
9787010166834,实践理性批判,https://img9.doubanio.com/view/subject/l/public/s29165014.jpg,[德国]伊曼努尔·康德,邓晓芒译,哲学,人民出版社,本书是康德批判哲学体系的三大批判著作之一，康德的第二批判《实践理性批判》出版于1788年。从内容上来看，如果说“纯粹理性批判”的任务是要确定人类认识能力的先天要素及其先天要素的若干规定，那么，“实践理性批判”的任务就是研究理性的实践使用的先天原理的可能性、范围和界限。康德立足于无人可以怀疑的“纯粹实践理性”去批判理性的“全部实践能力”，从人的纯粹理性现实具有的实践能力出发并以之为标准，批评和评价一般的理性在实践活动中的种种表现，从中确认纯粹理性的先天普遍规律，即道德律，道德律使人认识到人在实践中事实上是自由的。康德在本书中提出的自由概念成为“纯粹理性批判”和“实践理性批判”结合的基石。特别是在本书中提出了他的脍炙人口的两大崇高原则：“头上的星空”和“心中的道德律”。全书除序言和导言外，有纯粹实践理性要素论和纯粹实践理性方法论两部分，外加一个结论。在...,2021-12-20 23:32:14,2021-12-20 23:32:14
9787544780254,自由及其背叛,https://img2.doubanio.com/view/subject/l/public/s33592432.jpg,[英]以赛亚·伯林,赵国新,哲学,译林出版社,伯林教会我们，如何看穿以自由之名伤害自由的人。本书根据1952年伯林在BBC第三套节目所做的系列演讲整理而成，囊括了伯林关于自由与观念史的原创洞见。伯林向我们表明，正是爱尔维修、卢梭、费希特等哲人对自由观念的滥用和误读，妨碍了自由观念的发展，也阻碍了个体自由的实现。要真正理解自由，就必须从这些自由卫士的错误中吸取教训，避免赋予自由过多的王冠和权柄。,2021-12-20 23:32:21,2021-12-20 23:32:21
9787100164221,泰阿泰德,https://img1.doubanio.com/view/subject/l/public/s33756378.jpg,[古希腊]柏拉图,詹文杰,哲学,商务印书馆,柏拉图（约前427—前347），古希腊哲学家，也是西方最伟大的哲学家和思想家之一。本书是柏拉图关于知识论的最重要作品。这篇对话记录了苏格拉底、塞奥多洛和泰阿泰德之间的一场哲学谈话，其主题是探究“知识”的本性。苏格拉底提出“知识是什么”的问题，泰阿泰德先后提供了三种知识的定义：知识是感觉；知识是正确信念；知识是带有逻各斯的正确信念。苏格拉底对这三个定义一一进行了辨析。,2021-12-20 23:32:28,2021-12-20 23:32:28
9787569704518,拉康精神分析介绍性辞典,https://img9.doubanio.com/view/subject/l/public/s33887206.jpg,[英]迪伦·埃文斯,李新雨,哲学,拜德雅|西南师范大学出版社,-编辑推荐-● 中国人民大学吴琼教授、拉康派精神分析师潘恒博士作序推荐○ 出版近三十年来，最具经典性和实用性的拉康精神分析辞典● 理论研究者和精神分析家案头必备工具书○ 熟识拉康复杂、晦涩术语，推开拉康精神分析理论大门的入门级读物● 超200个术语的详细定义，既展示拉康的用法及其演变，也追溯其在弗洛伊德、索绪尔、黑格尔等人著作中的起源○ 提供一份详尽的拉康生平与著作年表-学者推荐-……本书令人惊叹地以一种清晰易懂的方式去处理这些复杂的概念与问题。对于真正想要理解拉康的读者而言，这是一部必备的参考性著作。——斯拉沃热•齐泽克……对于任何对拉康和精神分析感兴趣的读者，本书都是一部重要的参考性著作。——大卫•梅西……这是一部重要的参考性著作，能给予新手和专家指引与激励。——马尔科姆•鲍伊-内容简介-雅克•拉康可以说是自弗洛伊德...,2021-12-20 23:32:36,2021-12-20 23:32:36
9780521657297,Critique of Pure Reason,https://img1.doubanio.com/view/subject/l/public/s4368677.jpg,ImmanuelKant,AllenW.Wood,哲学,CambridgeUniversityPress,"This entirely new translation of Critique of Pure Reason is the most accurate and informative English translation ever produced of this epochal philosophical text. Though its simple and direct style will make it suitable for all new readers of Kant, the translation displays an unprecedented philosophical and textual sophistication that will enlighten Kant scholars as well. This...",2021-12-20 23:32:45,2021-12-20 23:32:45
9787100116381,尼各马可伦理学,https://img1.doubanio.com/view/subject/l/public/s29444178.jpg,(古希腊)亚里士多德,廖申白,哲学,商务印书馆,《尼各马可伦理学》（《伦理学》），13世纪被译成拉丁文后遂传遍西欧。全书共10卷，132章，探讨了道德行为发展的各个环节和道德关系的各种规定等问题。该书是西方历史上第一部伦理学专著，书中系统阐述了德性在于合乎理性的活动，至善就是幸福等观点，成为西方近现代伦理学思想的主要渊源之一。,2021-12-20 23:32:52,2021-12-20 23:32:52
9787100128872,悲剧的诞生,https://img2.doubanio.com/view/subject/l/public/s29448401.jpg,[德]弗里德里希•尼采,孙周兴,哲学,商务印书馆,尼采在本书中秉承瓦格纳“通过艺术重建神话”的理想，构造了一个文化哲学理想，撇开以早期希腊神话和英雄传说为内容的艺术文化，批判后起的科学-理论文化（发端于苏格拉底的科学乐观主义传统），而推崇具有形而上学性的悲剧艺术。为了解说希腊悲剧艺术的高妙，尼采动用了阿波罗和狄奥尼索斯两个神话形象，认为“阿波罗元素”与“狄奥尼索斯元素”之二元性交合，正是伟大的希腊悲剧的诞生。就此而言，《悲剧的诞生》首先是一本文化哲学著作，然后是一本美学或艺术哲学著作。正是通过尼采的《悲剧的诞生》，酒神狄奥尼索斯成了欧洲文化名神，阿波罗-狄奥尼索斯关系成了现代美学的基本关系。,2021-12-20 23:33:01,2021-12-20 23:33:01
9787229101220,自然哲学的数学原理,https://img2.doubanio.com/view/subject/l/public/s28650352.jpg,艾萨克·牛顿,任海洋,哲学,"重庆出版社,重庆出版集团",《自然哲学的数学原理》是牛顿的科学才华处于巅峰时期所写的旷世巨著，是他“个人智慧的伟大结晶”。牛顿不但总结出了力学的基本定律，而且还发现了证明这些定律的数学方法，奠定了数学成为描述宇宙运动的语言的基础。在《自然哲学的数学原理》之后，人类在自然科学中的伟大成就层出不穷，但这些成就无一不与这部非凡的著作息息相关。牛顿提供了科学思维体系的样板。《自然哲学的数学原理》标志着经典力学体系的建立，是人类科学史乃至整个人类文明史中的不朽巨著。《自然哲学的数学原理》不仅影响着自它面世后的300年里的自然科学领域，而且对人类的宇宙观也产生了深刻的影响。,2021-12-20 23:33:09,2021-12-20 23:33:09
9780872203495,Plato,https://img1.doubanio.com/view/subject/l/public/s28009918.jpg,Plato,PlatoandJ.M.Cooper,哲学,HackettPublishingCo.,,2021-12-20 23:33:16,2021-12-20 23:33:16
9787100116534,海德格尔文集：林中路,https://img9.doubanio.com/view/subject/l/public/s28620265.jpg,[德]马丁·海德格尔,孙周兴,哲学,商务印书馆,《林中路》是20世纪德国伟大的思想家马丁·海德格尔的后期代表作品之一。它在当代学术界享誉甚高，业已被视为本世纪西方思想的一部经典著作。如其中的第一篇《艺术作品的本源》，原为海德格尔在1935年至1936年间所做的几次演讲，当时即激起了听众的狂热的兴趣——此事后被德国当代解释学哲学大师伽达默尔描写为“轰动一时的哲学事件”。书中斯诸篇也各有特色，均为厚重之作。若要了解后期海德格尔的思想，这本《林中路》是不可不读的。,2021-12-20 23:33:25,2021-12-20 23:33:25
9787208107359,道德形而上学原理,https://img2.doubanio.com/view/subject/l/public/s24223822.jpg,[德国]伊曼努尔·康德,苗力田,哲学,上海人民出版社,本书是康德关于伦理道德方面的经典著作。该书集中论述了德性是人的意志的道德力量而具有自主性的思想，是康德德性论点代表作，对西方的伦理思想产生过极其深刻的影响。,2021-12-20 23:33:33,2021-12-20 23:33:33
9787108065841,规训与惩罚,https://img1.doubanio.com/view/subject/l/public/s33491948.jpg,[法]米歇尔·福柯,刘北成,哲学,生活·读书·新知三联书店,本书旨在论述关于现代灵魂与一种新的审判权力之间相互关系的历史，论述现行的科学—法律综合体的系谱。在这种综合体中，惩罚权力获得了自身的基础、证明和规则，扩大了自己的效应，并且用这种综合体掩饰自己超常的独特性。福柯称此书为“我的第一部著作”，历史学家彼得·盖伊则将《规训与惩罚》描述为福柯的关键文本，认为它影响了19世纪监狱理论与实践的学术研究。事实上，该书自出版以来，在哲学、政治、历史乃至建筑、艺术等诸多领域都产生了深刻的影响，成为诸多理论家和艺术家灵感的源泉。,2021-12-20 23:33:41,2021-12-20 23:33:41
