book_isbn,book_title,book_image,book_author,book_translator,book_category,book_publisher,book_summary,create_time,update_time
9787100027649,游叙弗伦 苏格拉底的申辩 克力同,https://img3.doubanio.com/view/subject/l/public/s9016670.jpg,柏拉图(古希腊),严群,哲学,商务印书馆,柏拉图（约前426—前347），古希腊伟大的哲学家、思想家，西方文明最有影响的哲学家和思想家之一。该书收录了柏拉图的三部作品。《游叙弗伦》是柏拉图最早的作品之一，以苏格拉底因“慢神”之罪状而成为被告为背景。柏拉图在本对话中，特意隐隐约约地描写当时所谓宗教家对敬神和慢神的问题多么隔阂，这方面的知识多么简陋，藉此反应当时希腊的一般社会，并证明雅典人控告苏格拉底甚至判他死刑，都是无理性的举动。《苏格拉底的申辩》分为三部分：第一，真正所谓辩护；第二，关于减轻刑罚较短的呈辞；第三，最后之预言性的责备与忠告。《克力同》也是柏拉图对话录最早的作品之一，记述了苏格拉底被判处死刑后其老友克力同劝说他越狱时二人的对话，反映了苏格拉底的法律思想、道德思想。,2021-12-21 00:01:37,2021-12-21 00:01:37
9780374180652,Justice,https://img2.doubanio.com/view/subject/l/public/s4222801.jpg,[美国]迈克尔·桑德尔,,哲学,"Farrar,StrausandGiroux","What are our obligations to others as people in a free society? Should government tax the rich to help the poor? Is the free market fair? Is it sometimes wrong to tell the truth? Is killing sometimes morally required? Is it possible, or desirable, to legislate morality? Do individual rights and the common good conflict?Michael J. Sandel’s “Justice” course is one of the most po...",2021-12-21 00:01:46,2021-12-21 00:01:46
9780679721109,Madness and Civilization,https://img2.doubanio.com/view/subject/l/public/s24927731.jpg,MichelFoucault,RichardHoward,哲学,Vintage,"This was Michel Foucault's first major book, written while he was the Director of the Maison de France in Sweden. It examines ideas, practices, institutions, art and literature relating to madness in Western history.Foucault begins his history in the Middle Ages, noting the social and physical exclusion of lepers. He argues that with the gradual disappearance of leprosy, madne...",2021-12-21 00:01:53,2021-12-21 00:01:53
9780394739540,Power/Knowledge,https://img3.doubanio.com/view/subject/l/public/s27072080.jpg,MichelFoucault,ColinGordon,哲学,Vintage,Michel Foucault has become famous for a series of books that have permanently altered our understanding of many institutions of Western society. He analyzed mental institutions in the remarkable Madness and Civilization; hospitals in The Birth of the Clinic; prisons in Discipline and Punish; and schools and families in The History of Sexuality. But the general reader as well as...,2021-12-21 00:02:00,2021-12-21 00:02:00
9787108033253,魏晋玄学论稿,https://img9.doubanio.com/view/subject/l/public/s6132714.jpg,汤用彤,,哲学,生活·读书·新知三联书店,对“魏晋玄学”的现代研究，汤用彤是开创者。他首先提出以“自然名教”之争、“言意之辩”、“有无、本末之辩”来概括魏晋时期的主要思想论争。由此出发，历史地考察各派思想的演变，从而揭示出发展的主线。这是他对中国现代学术的一个重要贡献。本书是作者有关魏晋玄学的主要著述。除去《魏晋玄学论稿》，还收有《魏晋玄学讲课提纲》和《魏晋玄学听课笔记》，这些著述多产生在20世纪三四十年代，正值抗日战争的艰难岁月，生活颠沛流离，原计划中的《魏晋玄学》专著终未能成书。但是这些陆续刊发的论文和讲课提纲、听课笔记，可以清楚看出他的魏晋玄学研究已经有了一个基本的体系框架，形成鲜明的学术特色，为后学的研究开创了新的方向。,2021-12-21 00:02:07,2021-12-21 00:02:07
9787300088907,哥德尔证明,https://img2.doubanio.com/view/subject/l/public/s24550652.jpg,欧内斯特·内格尔（ErnestNagel）,陈东威,哲学,中国人民大学出版社,《哥德尔证明》是第一本既面向学者又面向非专业人士，对哥德尔证明的主要思路和广泛含义作了易读的解释的书。对任何具有逻辑和哲学品味的受过教育的人士来说，它提供了一个深入了解先前无法企及的论题的机会。在此书的新版中，普利策奖的获奖作者道格拉斯•R·霍夫斯塔特对这一经典著作的原文进行了重新斟酌和更新，澄清了模糊之处，使论述更为清晰，并使行文更具可读性。,2021-12-21 00:02:15,2021-12-21 00:02:15
9787100122511,论道德的谱系,https://img2.doubanio.com/view/subject/l/public/s29091531.jpg,[德国]弗里德里希·尼采,赵千帆,哲学,商务印书馆,本书与《善恶的彼岸》并称，为尼采晚期著作，是其思想发展至最成熟阶段的文字。为回应评论家对其作品《善恶的彼岸》的批评，尼采以15天时间起草了三篇文章，合集为《论道德的谱系》。尼采说此书是“一个心理学家为重估一切价值而做的三篇关键性的预备之作。,2021-12-21 00:02:23,2021-12-21 00:02:23
9787305236563,伦理与无限,https://img2.doubanio.com/view/subject/l/public/s33765983.jpg,[法]伊曼努尔·列维纳斯,王士盛译,哲学,南京大学出版社,本书收录了列维纳斯思想成熟时期的十次访谈，它们于1981年由法国文化广播电台播出。在这里，列维纳斯亲口讲述其现象学致思之路，由《从存在到存在者》和《时间与他者》，到《总体与无限》，再到《异于存在或本质之外》，并梳理了其伦理现象学的核心概念：“il y a”、实显、秘密、自由、脸、责任、替代、见证、荣耀……这些访谈也被认为是对列维纳斯思想的忠实导读。===============֎☆一本列维纳斯自述！₱★★☆成熟时期列维纳斯思想的忠实导读₱★֎₱致思之路的自我陈述：《从存在到存在者》&《时间与他者》&《总体与无限》&《异于存在或在本质之外》₱★֎☆核心概念的自我梳理：“il y a”、秘密、自由、脸、责任、替代、见证、荣耀……₾★★₾注释翔实，串连列维纳斯著作֎★===============这本书很好读。不光因为简短，更因为其中的论证...,2021-12-21 00:02:31,2021-12-21 00:02:31
9787532738885,逻辑研究（第二卷 第一部分）,https://img9.doubanio.com/view/subject/l/public/s1743454.jpg,[德国]埃德蒙德·胡塞尔,倪梁康,哲学,上海译文出版社,《逻辑研究》被公为当代哲学最重要“突性”著作。它的影响不仅规定了当代许多著名学的思维向，而且远远超出了哲学领域。    两卷本的《逻辑研究》在总体上展示出胡塞尔在意识现象学领域两方面兴趣：在客体（意相关项）方向上的逻辑学以及在主体（意向活动）方向上的现象。前一个兴趣主要集中在第一卷中，后一个兴趣则要体现在第二卷中。因而真正的现象学描述分析可以在第二卷的各项研究找。“现象学的分析便超始于此”（胡塞尔）    第二卷由六项研究组成。前五项研究构成该卷第一部分。前四项研究为后面关键性的第五研究和第六研究（作为第二第二部分）的现象学分析及其结论做了理论上的铺垫。　　《二十世纪西方哲学译丛》选收二十世纪西方哲学界各主要流派影响较大的著作。通过有选择的译介，旨在增进文化积累，拓展学术视野，丰富研究课题，为了解和研讨现代西方哲学提供系统而完整的第一手资料，以...,2021-12-21 00:02:38,2021-12-21 00:02:38
9787801430311,弗洛姆文集：我相信人有实现自己的权利,https://img1.doubanio.com/view/subject/l/public/s26377729.jpg,[美]弗罗姆,冯川等,哲学,改革出版社,本书内容包括：逃避自由；自为的人；健全的社会；爱的艺术；精神分析与禅宗；超越幻相之锁链；病人是最健康的人。,2021-12-21 00:02:45,2021-12-21 00:02:45
9787100022972,哲学史教程（上卷）,https://img9.doubanio.com/view/subject/l/public/s5649685.jpg,（德）文德尔班,罗达仁,哲学,商务印书馆,《哲学史教程》(上)的开头篇章在两年前就发表了。经过多次令人不快的延误和干扰之后，此书终于完成，与读者见面了。读者不可将此书和纲要之类混淆起来。纲要之类的书有时很可能就是从一般哲学史的讲稿中整理出来的。我现在献给读者的是一部严肃的教科书。在这《哲学史教程》(上)里，我打算全面而精炼地描述欧洲哲学种种观念的演变，其目的在于表明：我们现在对宇宙和人生作科学的理解和判断所依据的原理原则，在历史发展过程中，由于什么动机，为人们所领悟并发展起来。这个目的决定了这《哲学史教程》(上)的整个形式。据此，我们研究的文史依据和传记、文献资料都必然地限制在最小范围，选材也只限于能为进一步钻研的读者获得最丰富的原始资料而开辟道路。哲学家本人的论述，也只有在那些论述能提供在思想上有持久价值的论证或基本原理时，才扼要地加以引证。除此之外，作者为了支持某一种与众不同的见解，也偶...,2021-12-21 00:02:54,2021-12-21 00:02:54
9787101003888,庄子今注今译（全三册）,https://img2.doubanio.com/view/subject/l/public/s6286352.jpg,陈鼓应注译,陈鼓应,哲学,中华书局,《庄子》是中国古代哲学名著，又是优秀文学作品，几千年来流传甚广，影响极大。这本《庄子今注今译》参考了古今中外各种校注本，择善而从，对《庄子》全书作了详细而全面的注释和今译，是一部较好的《庄子》通俗读本。,2021-12-21 00:03:03,2021-12-21 00:03:03
9787567550711,善恶的彼岸,https://img9.doubanio.com/view/subject/l/public/s29101314.jpg,[德国]弗里德里希·尼采,魏育青,哲学,华东师范大学出版社,《善恶的彼岸》是《道德的谱系》的姊妹篇，本书由一个序言、九大章节和一个终曲组成，包括哲学论说、格言、短评、诗歌等多种话语风格，牵涉到了西方哲学传统中各个经典问题，比如：什么是自我？什么是知识？为何要求知？什么是宗教的本质？宗教与哲学的关系为何？堪称尼采心目中的未来哲学之宏大序曲。尼采在本作中一如既往地“用锤子从事哲学”，对西方形而上学传统，尤其是“柏拉图主义”进行猛烈敲打，而尼采晚期思想中最重要的“权力意志”，其地位也在本作得到突出，成为帮助破除人们头脑里种种偏见、站在“善恶彼岸”进行真诚思考的关键概念。,2021-12-21 00:03:11,2021-12-21 00:03:11
9787100017985,任何一种能够作为科学出现的未来形而上学导论,https://img1.doubanio.com/view/subject/l/public/s23127299.jpg,[德国]伊曼努尔·康德,庞景仁,哲学,商务印书馆,康德（1724—1804），德国古典哲学的创始人，其思想深深影响了其后的西方哲学。本书是康德《纯粹理性批判》的缩写本，以相对通俗的语言对《纯粹理性批判》的主要思想予以阐释。康德认为我们应该在哲学中停止传统的构造形而上学体系的做法，而首先了解理性认识的性质和范围；要考察形而上学是否可能，必须根据形而上学知识的特点，即它不同于自然科学，不是经验的，只能是先天的出于纯粹理性的知识，但它又不同于同样出于纯粹理性的纯粹数学知识。康德以后天的经验材料和先天的理性能力之分，感性能力、知性能力、理性之分等，构造哲学体系解答了这一系列问题。,2021-12-21 00:03:19,2021-12-21 00:03:19
9787208150195,悲剧的诞生,https://img2.doubanio.com/view/subject/l/public/s33955402.jpg,[德]弗里德里希·尼采著,孙周兴等译,哲学,上海人民出版社,《悲剧的诞生》是德国哲学家尼采第一部较为系统的美学和哲学著作，写于1870-1871年间。尼采在对希腊艺术进行美学讨论的同时，阐述了自己的许多哲学思想完成了他对生命意义的思考，并对以苏格拉底科学乐观主义为特征的现代文化做出了批判。,2021-12-21 00:03:29,2021-12-21 00:03:29
9787553519609,论自由,https://img1.doubanio.com/view/subject/l/public/s33661159.jpg,[英]约翰·穆勒,欧阳瑾,哲学,上海文化出版社,本文的目标，就在于彰显一条极其简单的原则；无论个人还是集体，人类只有出于自卫这一目的，才能去干涉他人的行动自由。违背文明社会中任何一个人的意志，并且正当地对此人行使权力的唯一目的，也只能是为了阻止他危害他人。任何一个人唯一应对社会负责的，就是涉及他人的那一部分行为。对于只涉及自身的那一部分，个人依法具有绝对的自主权。                                               对于自己，对于自己的身心这两个方面，个人都具有独立的支配权。,2021-12-21 00:03:38,2021-12-21 00:03:38
9787516811023,人生的智慧,https://img1.doubanio.com/view/subject/l/public/s29487869.jpg,[德]亚瑟·叔本华,张红玉,哲学,台海出版社,《人生的智慧》取自叔本华的《附录和补遗》，它实际上是独立成书的。这本书以简洁优雅的文笔，从世俗的角度探讨了人生应遵循的原则，阐述了生活的本质并教导人们如何在生活中获得幸福。叔本华认为人类主体的美好素质对于人的幸福起着关键作用，这些美好素质包括高贵的品格、良好的智力、愉快的性情和健康良好的体魄。,2021-12-21 00:03:49,2021-12-21 00:03:49
9780415325059,History of Western Philosophy,https://img1.doubanio.com/view/subject/l/public/s1796649.jpg,BertrandRussell,,哲学,Routledge,在线阅读本书,2021-12-21 00:03:58,2021-12-21 00:03:58
9787010189819,1844年经济学哲学手稿,https://img9.doubanio.com/view/subject/l/public/s29983494.jpg,[德]卡尔·马克思,中共中央马克思恩格斯列宁斯大林著作编译局,哲学,人民出版社,《1844年经济学哲学手稿》是马克思思想发展史上的一部重要著作，手稿写于1844年，此期间，正如列宁所说，马克思刚刚成为科学社会主义的创始人。手稿是马克思对涉及哲学、政治经济学和共产主义理论的各种历史文献和思想观点进行系统研究和批判的最初成果。在手稿中，他论述了劳动对人类文明和历史进步的意义，指出资本主义私有制必然造成劳动的异化，给工人阶级和整个人类带来灾难性后果。因此工人阶级必须打碎私有制的桎梏，使本阶级和整个社会获得解放。手稿围绕这一基本思想，提出了一些列新的经济学观点、哲学观点和共产主义观点。,2021-12-21 00:04:05,2021-12-21 00:04:05
9787532738052,欧洲科学危机和超验现象学,https://img2.doubanio.com/view/subject/l/public/s1505782.jpg,[德国]埃德蒙德·胡塞尔,张庆熊,哲学,上海译文出版社,《欧洲科学危机和超验现象学》系德国著名哲学家、现象学创始人埃德蒙德·胡塞尔生前出版的最后一部带有总结性的著作，是艰涩难懂的现象学中最为易懂的一部专著。胡塞尔在书中阐述了欧洲科学危机的现实表现及其历史根源；同时批判了实证主义的科学观，批判了存在主义和非理性主义的哲学思想，力图建立一种全新的、绝对真的严科学——现象学、为解决其他科学的危机提供坚实的基础。,2021-12-21 00:04:12,2021-12-21 00:04:12
9787108040466,启迪,https://img9.doubanio.com/view/subject/l/public/s11106515.jpg,[德]瓦尔特·本雅明,张旭东,哲学,生活·读书·新知三联书店,本雅明是德国著名哲学家、文艺理论家。本书精选了本雅明最精彩的文章.,2021-12-21 00:04:20,2021-12-21 00:04:20
9780241292525,The Order of Time,https://img1.doubanio.com/view/subject/l/public/s29940649.jpg,CarloRovelli,,哲学,AllenLane,"The bestselling author of Seven Brief Lessons on Physics takes us on an enchanting, consoling journey to discover the meaning of time'We are time. We are this space, this clearing opened by the traces of memory inside the connections between our neurons. We are memory. We are nostalgia. We are longing for a future that will not come.'Time is a mystery that does not cease to p...",2021-12-21 00:04:28,2021-12-21 00:04:28
9787512614277,宽容的不宽容,https://img2.doubanio.com/view/subject/l/public/s24942081.jpg,（美）卡森（D.A.Carson）,李晋,哲学,团结出版社,“宽容”正在西方社会占据至高地：如果有人胆敢挑战“宽容”，会被认为是野蛮和愚蠢的。但是，在《宽容的不宽容》一书中，卡森所要做的正是在质疑“宽容”（或者说至少是西方人当下所理解的“宽容”）。卡森追溯了近些年我们所理解的“宽容”经历了怎样一种微妙但却剧烈的转变——从为维护持不同信仰者之权利而提出的一种“旧宽容观”，到认为所有信仰都是同样合理正确的另一种“新宽容观”。他回顾这一转变的历史，并讨论了此变化对今日文化的意义，特别是对民主、善与恶之讨论和基督教真理宣称的意义。据此，卡森提出了自己的观点：“新宽容观”对社会具有危险性，也会让人的知性衰弱；不仅如此，这种“新宽容观”实际上将人引向一种对所有持守自己信仰者的真正的不宽容。在本书中他引用了很多现实生活中的实例来论证这一观点，这些例子有时会让人发笑，有时却也让人热血沸腾。,2021-12-21 00:04:35,2021-12-21 00:04:35
9787101073720,坛经,https://img1.doubanio.com/view/subject/l/public/s4371928.jpg,尚荣译注,尚荣,哲学,中华书局,《坛经》是中国僧人撰写的著述中唯一被冠以“经”的一部佛教典籍，其核心思想是“即心即佛”、“顿悟成佛”。《坛经》在把佛性归诸心性、把人变成佛的同时，倡导“即世间求解脱”，主张把入世与出世统一起来。,2021-12-21 00:04:43,2021-12-21 00:04:43
9780226458083,The Structure of Scientific Revolutions,https://img9.doubanio.com/view/subject/l/public/s4393194.jpg,ThomasS.Kuhn,,哲学,UniversityOfChicagoPress,"Since the publication of this book in 1962, Kuhn's writings (and many of his ideas, such as ""paradigm shift"") have been highly influential in academic and popular discourse. This book is must-reading for anyone studying the history and philosophy of science specifically, or cultural or technological change generally.Since Kuhn does not permit truth to be a criterion of scienti...",2021-12-21 00:04:51,2021-12-21 00:04:51
9787100026994,实践理性批判,https://img2.doubanio.com/view/subject/l/public/s33654433.jpg,[德国]伊曼努尔·康德,韩水法,哲学,商务印书馆,本书是著名的德国古典哲学家伊曼努尔·康德（1724—1804）三大批判的第二部，为西方伦理思想史上最重要的哲学著作之一。全书分两个部分。第一部分为纯粹实践理性要素论，第二部分为纯粹实践理性方法论。在本书中，康德主要论述了理性在实践中的行使，他认为，道德律要求正义，也就是要求与德性成比例的幸福。这只有在设定精神的永存和上帝的存在的情况下才有可能。康德在本书中提出了人应服从绝对道德律令，不能把人仅仅当作手段，而应永远将之当作目的的观点。他的这种道德思想对后世产生了极为重要的影响。,2021-12-21 00:05:01,2021-12-21 00:05:01
9787010082837,康德三大批判合集（上下）,https://img2.doubanio.com/view/subject/l/public/s4114393.jpg,康德,邓晓芒,哲学,人民出版社,我与杨祖陶老师通力合作七年译出的康德三大批判于2004年出齐，至今又有五年了。在这五年中，我听到了不少赞誉，也收到了很多有益的意见。对于赞誉，我将它们视为对我们工作的一种鼓励，实际上我知道这个译本还远不是那么完善，有很多需要修改的地方。而对于各方面来的意见，我在这里要表示由衷的感谢。这些意见，有些是来自素不相识的读者，通过来信或发电子邮件向我表达了他们在阅读过程中发现的问题；另外还有大量的意见是在我讲解康德哲学原著的研究生课堂上由研究生们提出来的。多年来，由于我逐字逐句地解读康德的著作，并要求研究生们对照德文和英文原版对我们的翻译进行字斟句酌，我在课堂上收获了数以百计的修改意见。这些意见经过我的再思考，大部分都被我采纳并反映在后来的多次重印中了（因此，越是读到后面批次印本的读者，所读的文本就越精确）。例如这次将三大批判集结为《合集》再版，我所提供的再...,2021-12-21 00:05:08,2021-12-21 00:05:08
9787534828379,传习录,https://img3.doubanio.com/view/subject/l/public/s3451090.jpg,王阳明,于自力,哲学,中州古籍出版社,《传习录》是王阳明的问答语录和论学书信集。是一部儒家简明而有代表性的哲学著作。包含了王阳明的主要哲学思想，是研究王阳明思想及心学发展的重要资料。《传习录》不但全面阐述了王阳明的思想，同时还体现了他辩证的授课方法，以及生动活泼、善于用譬、常带机锋的语言艺术。因此该书一经问世，便受到士人的推崇。,2021-12-21 00:05:17,2021-12-21 00:05:17
9787208094291,叔本华论道德与自由,https://img9.doubanio.com/view/subject/l/public/s4620805.jpg,[德国]阿图尔·叔本华,韦启昌,哲学,上海人民出版社,本书所收录的是德国著名哲学家叔本华（1788－1860）讨论人的道德、自由的5篇文章。道德或者不道德在叔本华的哲学中有着精确的含意界定，道德关乎人的意欲（本性），与智力、认知没有直接的关联。探究的就是人的本性及其发挥的规律，还有就是道德在人生中的含意。人的总体命运却是沉重残酷的，那是挣扎、受苦和死亡的命运。一个人受的苦越多，就越早达到生活的真正目的；而一个人生活得越幸福，就越发延迟达到这一目的。事实上，痛苦是一个净化的过程。在大多数情况下，人只有经过这一净化过程才会神圣化，亦即从生存意欲的苦海中回头。,2021-12-21 00:05:26,2021-12-21 00:05:26
9787532176472,后现代性下的生命与多重时间,https://img2.doubanio.com/view/subject/l/public/s33642422.jpg,[英]基思·特斯特,李康,哲学,上海文艺出版社,《后现代性下的生命与多重时间》是社会学家基思·特斯特反思后现代性、后现代性研究的一部力作。他在其中关注的是一些境况，是后现代性得以存在的利害关键和可能条件，而他主要取材于“世界的写作”，关注有关我们世界的神话/迷思，去探寻人们都靠着哪些故事，来做出妥协，为实际活动提供理据，并使挫败可以接受。或许可以把后现代性看作是人类历史的巅峰，不仅如此，还像是自哲学诞生以来被人们不顾一切、满怀期冀地表达的所有那些希望和雄心的终极实现。只要毫不理会前历史性人群和历史性人群破败不堪的残余，任他们隐约闪现着后现代性金碧辉煌的拱廊街外，这时候，仿佛这个世界已经最终获得了完满清晰 的呈现。人们不再有需要，不再有不适，但同时那也意味着，不再有希望。过一种后现代的日子，就是要活在一种无视之中，无视现代性的教益，尤其是卡夫卡的教益：希望的前提条件就在于，所希望的东西必然是无...,2021-12-21 00:05:34,2021-12-21 00:05:34
9787221078100,货币哲学,https://img2.doubanio.com/view/subject/l/public/s24438042.jpg,齐美尔,许泽民,哲学,贵州人民出版社,在本书中，作者以其敏锐的洞察力，试图通过货币这单独一个例证而深入到生活的“每一个细节”中，把生活最表层的现象与生活内部最底层的深邃之流和历史潮流联系起来，“在历史唯物主义底下构建一个基础，以便维持经济生活构成思想文化的起因这一解释的价值”，并张扬他所坚持的相对主义世界观。,2021-12-21 00:05:43,2021-12-21 00:05:43
9780140432077,On Liberty,https://img2.doubanio.com/view/subject/l/public/s1484833.jpg,JohnStuartMill,,哲学,Penguin,"This volume includes the complete essay in five chapters: Introductory; Of the Liberty of Thought and Discussion; Of Individuality, as One of the Elements of Well-being; Of the Limits to the Authority of Society over the Individual; and Applications. With a fine introduction by editor Alburey Castell, this edition also includes line numbers for easy reference, a list of princip...",2021-12-21 00:05:52,2021-12-21 00:05:52
