book_isbn,book_title,book_image,book_author,book_translator,book_category,book_publisher,book_summary,create_time,update_time
9787805276700,老子,https://img3.doubanio.com/view/subject/l/public/s2810850.jpg,老聃,梁海明,哲学,辽宁民族出版社,黄裳，字元吉，江西丰城人，生卒年不详，元代或清代道士。根据《乐育堂语录》的序文，黄元吉先生是元代人，平时遁形隐迹，直到清朝道光、咸丰年间，才聚徒讲学。然以此言之，黄元吉在世之寿几近千岁，并不合理。《乐育堂语录》序文所提到的元代黄元吉与清代黄元吉应非同一人。《新译乐育堂语录》的作者戈国龙所持的态度是“从学术的立场上说，则凡无有确切证据的事，都要存疑，也许两人同名纯属巧合吧！”黄元吉于清咸丰年间（1851年－1862年）在四川富顺设“乐育堂”讲课传授道学十余年。于清光绪年间讲解《道德经》，后经整理成《道德经讲义》，于光绪十年（1884年）刊刻发行。关于黄元吉的辞世，比较详细的叙述在李乐俅的《访道语录》：“黄元吉祖师清光绪十年丙戌，在四川自流井讲道，最后解馆，弟子恭送馆外，黄当下飞升，徒众见之，皆痛哭流涕，始后悔往日蹉跎，未尝从师勇猛学道也。”另外，...,2021-12-21 00:37:58,2021-12-21 00:37:58
9787561766286,王阳明《传习录》详注集评,https://img2.doubanio.com/view/subject/l/public/s4139462.jpg,陈荣捷,,哲学,华东师范大学出版社,本书是王阳明传习录详注集评，书中具体包括了：徐爱录（第一至十四条）、又（第一五五至一六七条）、答罗整庵少宰书（第一七二至一七七条）、黄修易录（第二三七至二四七条）、传习录拾遗（第一至五一条）等内容。   　　本书适合从事相关研究工作的人员参考阅读。,2021-12-21 00:38:05,2021-12-21 00:38:05
9787540762278,潜能,https://img1.doubanio.com/view/subject/l/public/s27189189.jpg,[意大利]吉奥乔·阿甘本,王立秋,哲学,漓江出版社,本书是意大利当代著名哲学家乔吉奥·阿甘本的代表作之一，以语言、历史和潜能为专题，收录了作者三十年来的重要论文共22篇，集中体现了阿甘本的哲学论题、基本概念、关注领域和著述风格，涵括了阿甘本最关键也是最著名的思想成果，例如他对亚里士多德“潜能”概念的当代诠释。这些论文涉及哲学、语言学、古典学、文学、宗教、艺术史及历史等多个领域，虽各自独立，相互间又有着紧密的逻辑关联。,2021-12-21 00:38:12,2021-12-21 00:38:12
9787100129855,伦理学与哲学的限度,https://img3.doubanio.com/view/subject/l/public/s29544410.jpg,[英]B.威廉斯,陈嘉映,哲学,商务印书馆,《伦理学与哲学的限度》是当代英国著名伦理学B.威廉斯的代表作，初版于1985年。在本书中，威廉斯检讨了伦理学理论的几种代表性理论如亚里士多德传统和康德传统，指出伦理学理论反思的对象应该是人的伦理生活，而不应该是人的伦理反思。如果把伦理学定位为后者，并且一味地要在一定的理论起点上为人的伦理活动寻找解释，就会实际地破坏了我们的真实伦理生活面貌。因此，伦理理论的问题，在于其不知反思的节制。威廉斯因此提出，反思有可能破坏人们的伦理生活。尽管现代社会已经不可避免地进入到了全面反思的阶段，我们仍然有必要对于反思在伦理理论中，以及反思在一般的哲学思考中的作用保持警惕。,2021-12-21 00:38:20,2021-12-21 00:38:20
9789869274173,法國高中生哲學讀本 I 政府是人民的主人還是僕人？,https://img2.doubanio.com/view/subject/l/public/s33557453.jpg,侯貝(BlancheRobert)等,廖健苡,哲学,大家,本書帶領你發現問題，提出政治哲學的各種命題；從一般看法開始，陪伴讀者逐步反思。看不同時代的哲學家，如何回應相同問題，由現實生活中的事件或作品（時事、文學、戲劇、電影、藝術等），進一步反思政治帶給人民的正反效益。從「社會」的定義和功能、從人類社會中「交換」的本質和優劣、從「國家」的目的和運作、從「正義與法律」的攻防，全面了解政治的本質。我們需要這本書，將這塊土地上簡化、情緒化、挑起對立的政治意見，導入具備思辨和對話能力的政治素養。這是一套連結哲學思考與現實處境的哲學思想讀本，讓你全面了解法國人探討政治、道德、主體、文化和真實的哲學之路！【看歷代哲學家如何回應相同問題】◆政治必然涉及權力鬥爭嗎？若然，權力的競爭是否應有更高目的？馬基維利認為，作為政治，只要目的正確，可以不擇手段。盧梭認為，政治行動必須以公共普遍利益為目標。柏拉圖認為，政治必須經...,2021-12-21 00:38:29,2021-12-21 00:38:29
9787100042710,庄子今注今译,https://img9.doubanio.com/view/subject/l/public/s2697824.jpg,陈鼓应,陈鼓应,哲学,商务印书馆,该书是对《庄子》的白话文翻译和注释。初版于1974年，由台湾商务印书馆印行。此次修订再版，采用横排简体字，并吸收了有关庄子研究的最新成果。一、本书所用《庄子》原文，为根据王孝鱼点校的郭庆藩《庄子集释》本。郭庆藩《集释》收录了郭象《注》、成玄英《疏》和陆德明《音义》三书的全文，摘引了清代王念孙、俞樾等人的训诂考证，并附有郭嵩焘和他自己的意见。《集释》原根据黎庶昌《古逸丛书》覆宋本，王校又根据《续古逸丛书》影宋本、明世德堂本、《道藏》成玄英《疏》本以及《四部丛刊》所附孙毓修《宋赵谏议本校记》、近人王叔岷《校释》、刘文典《庄子补正》等书加以校正。本书凡有增补或删改原文时，均于“注释”中说明。二、本书的“今译”依据“注释”，并参考目前已译成之中英文译本，为使译文畅晓与切近原意，别人译得好的语句我尽量采用。有许多地方与别人的译法不同，乃是出于我个人对《庄》...,2021-12-21 00:38:37,2021-12-21 00:38:37
9787208054356,道德形而上学原理,https://img1.doubanio.com/view/subject/l/public/s1323409.jpg,[德国]伊曼努尔·康德,苗力田,哲学,上海人民出版社,《道德形而上学原理》是康德关于伦理道德方面的一本经典。虽然它的篇幅不长，但集中论述了德性是人的意志的道德力量而具有自主性的思想，是康德德性论的代表作，对西方的伦理思想产生过极其深刻的影响。此书由苗力田教授从德文原本译出，现被选为《袖珍经典》的一种。全书包括译者的一篇长序，可作为康德原著的导读，同时还选了英国著名康德研究专家H.J.帕通的“论证分析”作为附录，逐段解释、分析，大大降低了阅读康德原著的难度。,2021-12-21 00:38:47,2021-12-21 00:38:47
9787108029201,启迪,https://img3.doubanio.com/view/subject/l/public/s3450900.jpg,[德国]汉娜·阿伦特,张旭东,哲学,生活·读书·新知三联书店,本书是《现代西方学术文库》系列之一的《启迪(本雅明文选》分册，书中具体收录了：《从“资产阶级世纪”中苏醒张旭东》、《瓦尔特·本雅明：1892-1940汉娜阿伦特》、《论尼古拉·列斯克夫》、《论波德莱尔的几个母题》等文章。,2021-12-21 00:38:55,2021-12-21 00:38:55
,马克思恩格斯选集 第四卷,https://img2.doubanio.com/view/subject/l/public/s28332693.jpg,中共中央马克思恩格斯列宁斯大林著作编译局编,,哲学,人民出版社,这个书号应该是 第四卷,2021-12-21 00:39:02,2021-12-21 00:39:02
9787100000505,苏鲁支语录,https://img2.doubanio.com/view/subject/l/public/s2260811.jpg,尼采,徐梵澄,哲学,商务印书馆,该书是德国哲学家尼采（1844—1900）的散文诗体哲学著作。尼采假托拜火教先知苏鲁支的口气，宣扬自己的“超人哲学”和“权力意志”思想。全书共分四个部分，由一篇序言和苏鲁支的一些演讲组成。在书中，尼采否定以信仰和服从为准则的旧价值体系，肯定以生命和人的意志为准则的新价值体系。他认为前者是基于上帝，后者则基于大地。因此尼采宣称上帝已经死了，传统的哲学、宗教和道德已不合时宜，应该由“超人”把人们从旧文化中拯救出来。,2021-12-21 00:39:15,2021-12-21 00:39:15
9787100071949,哲学作为严格的科学,https://img2.doubanio.com/view/subject/l/public/s6472672.jpg,(德)胡塞尔,倪梁康,哲学,商务印书馆,埃德蒙德·胡塞尔（1859—1938），德国著名哲学家，现象学的创始人。本书是胡塞尔于1911年发表于德国哲学杂志《逻格斯》上的一篇长文，因此也被称为“逻格斯文”，被看作是一份“带有胡塞尔签名的‘现象学宣言’”。书中批判了当时盛行的实验心理学的各种学说和狄尔泰等人所主导的历史学派，对后人理解现象学与解释学之间的关系也不无启迪作用。,2021-12-21 00:39:22,2021-12-21 00:39:22
9787100091190,智者,https://img3.doubanio.com/view/subject/l/public/s33944020.jpg,[古希腊]柏拉图,詹文杰,哲学,商务印书馆,柏拉图（约前427—前347），古希腊哲学家，西方最伟大的哲学家和思想家之一。本书是柏拉图后期的一篇重要对话录，反映了柏拉图存在论、知识论和语言哲学方面的核心思想，在希腊哲学发展史上占有重要的地位。对话名义上的主题是由爱利亚异乡人通过划分法来寻找“智者”定义，随着讨论的深入，对话重心转向对“存在”和“非存在”问题的探讨。在本篇对话中，柏拉图重新思考了“存在”与“非存在”的关系问题，提出了“通种论”，并在此基础上对“非存在”的内涵进行了重新界定。,2021-12-21 00:39:29,2021-12-21 00:39:29
9787508043111,巨人与侏儒,https://img1.doubanio.com/view/subject/l/public/s4594368.jpg,[美]阿兰·布鲁姆,,哲学,华夏出版社,本书的题目并不特别与一个老说法相关：“我们都是矮子，但是我们站在巨人的肩膀上”。这谦卑的姿态，表达了太多的自我满足。巨人是那么容易让我们爬上去的吗？巨人的功能就是把侏儒扛上他们的肩膀吗?或许他们曾经是亲切和蔼的，但是现在他们却把我们摔在了地下，偷偷走了，只留给我们一个视界更宽一些的幻觉。毫无理由地假设我们和伟大者的亲密关系，很快就会使年轻一代人否认有什么巨人，并断定这整个说法不过是一个谎言，是由教师们编造来抬高自己的。我想，巨人会鄙视这小小的喜剧和玩笑。解读伟大作品，已经不仅仅是个人或某个学派的为学旨趣，而是与生存选择紧密相关。关键在于，伟大作品给出了关于什么是美好生活、什么是美好德行等紧要问题的深刻思考与解答。即使我们要寻求只属于自己的答案，也无论如何必须首先面对那些伟大的书。在订正旧版的基础上，新增两篇文章：《理查二世》和《文本的研习》。,2021-12-21 00:39:38,2021-12-21 00:39:38
9787806882214,中国哲学简史,https://img9.doubanio.com/view/subject/l/public/s1914405.jpg,冯友兰,赵复三,哲学,天津社会科学院出版社,当代大哲学家冯友兰先生干1947年在美国宾夕法尼亚大学受聘担任讲座教授，讲授中国哲学史，其英文讲稿后经整理写成《中国哲学简史》，于1948年由美冈茗名出版公司麦克米兰出版。此书一出，立即成为西方入户解和学习中国哲学的超级人门书。其后又有法文、意大利文、西班牙文、南斯拉夫文、日文等译本出版，五十多年来，一直是世界各大学中国哲学的通用教材，在西方影响很大。在很长的一段时间里，此书没有中文本。直到20世纪8O年代，本书才由冯友兰先生的学生第一次根据英文本译成中文，由北京大学出版社于1985年出版，首版印刷十万册，很快售罄，成为当时学术界的人畅销书。可以说，本书是了解中国哲学的首选读本。本书是冯友兰先生哲学与思想融铸的结晶。以一本篇幅有限的哲学生专著，打通古今中外的相关知识，其中充满睿智与哲人洞见。特别是作者对现实问题的关怀，颇具“读书不忘救国，救国不忘读...,2021-12-21 00:39:48,2021-12-21 00:39:48
9787300067971,艺术与归家,https://img1.doubanio.com/view/subject/l/public/s1517908.jpg,余虹,,哲学,中国人民大学出版社,本书比较研究在20世纪影响深远的三位思想家的后形而上学思想。作者以“归家”的隐喻概括尼采、海德格尔和福柯“逃离”现代世界、“回归”本真世界的基本思路与旨趣，考究三位思想家借助古代希腊的想像和艺术的启示而在“现代性批判”、“思想史反思”以及“本真家园之构想”上的异同。作者提出以权力关系和自由关系为核心的“生存关系论”，并以此为坐标辨析三位思想家之思想的意义、价值与疑难，强调关注“生存关系之正当性”的问题对克服现代性危机的重要性。本书的论域和方法突破了哲学、美学和艺术学的学科界限，其思其说别有新意。,2021-12-21 00:39:55,2021-12-21 00:39:55
9787305034206,庄子评传,https://img1.doubanio.com/view/subject/l/public/s2772728.jpg,颜世安,,哲学,南京大学出版社,《庄子评传》内容简介：伟大的中华民族在长达五千年连绵不断的曲折发展过程中，像滚滚东流的长江那样，以磅礴之势，冲破了重重险阻，奔腾向前，现在更以崭新面貌，雄姿英发，屹立于世界民族之林。这是人类历史上的一个奇迹。产生这一奇迹有诸多原因，其中十分重要的一点，就是我们勤劳、勇敢、智慧的各族人民，在长期的生产活动、社会活动、思维活动和对外交往以及抗击外来侵略过程中，逐渐创造、积累、发展了具有以生生不息的内在思想活力为核心的优秀传统思想文化。这是一种伟大、坚强的精神支柱，是我们民族凝聚力和生命力之所在，是历史留给我们所有海内外炎黄子孙引以自豪的无价之宝。当然，和各国各种不同传统思想文化一样，在中华民族的思想文化传统中，也是既有精华，又有糟粕，因而全盘肯定或全盘否定，不对；一知半解、信口开河或囊足不前、漠然置之，也不对。,2021-12-21 00:40:03,2021-12-21 00:40:03
9787561799932,重估一切价值,https://img9.doubanio.com/view/subject/l/public/s26039205.jpg,[德]尼采,林笳,哲学,华东师范大学出版社,《重估一切价值》是为尼采未刊文稿的独具匠心的编撰。尼采曾将《扎拉图斯特拉如是说》视为其哲学的前厅，将“重估一切价值”的文稿比作未竣工的主体建筑。前者在我国已有各种不同的译本，至于后者，也已先后出版了几种汉译：最早的有《权力意志——重估一切价值的尝试》（张念东、凌素心译，商务印书馆1991年出版）。尽管这本书依据的版本因尼采胞妹的作伪行径在德国备受争议，但并不影响汉译本在向中国读者介绍尼采遗稿方面具有的开拓意义。接着有贺骥翻译的《权力意志》（漓江出版社，2000年）。这是一个选译本，译自意大利学者Giorgio Colli 和Mazzino Montinari编订的《考订版尼采文集》（KSA）的第13卷，该卷收入1887年至1889年的遗稿，格言按写作时间顺序编排。随后有《尼采遗稿选》（上海译文出版社，2005年），虞龙法译，依据的是德国乌帕塔尔大学哲...,2021-12-21 00:40:11,2021-12-21 00:40:11
9787806263938,道德经,https://img9.doubanio.com/view/subject/l/public/s2352505.jpg,陈忠译评,,哲学,吉林文史出版社,《道德经》分为《道经》和《德经》两大部分，《道经》讲述了宇宙的根本，道出了天地万物变化的玄机。《德经》说的是处世方略。《道德经》不仅是一部哲学经典，而且它的文字简洁、辙韵强劲，因此，还被称作是一种特殊形式的诗。《道德经》之学旨在宣化自然无为听天由命，是以要求人们无欲、少智、守柔、退让。,2021-12-21 00:40:20,2021-12-21 00:40:20
9787100048361,罗素自选文集,https://img2.doubanio.com/view/subject/l/public/s25138783.jpg,伯特兰·罗素,戴玉庆,哲学,商务印书馆,伯特兰·罗素是20世纪最伟大的哲学家之一，同时又是著名的数学家、散文作家和社会活动家。与通常的隐居书斋脱离世事的纯学者不同，罗素是一个具有强烈社会关怀的人道主义者、和平主义者，他终其一生热衷于政治活动和社会事物、并且撰写了大量关于政治和社会方向的著作。他的胸怀充满正义、良知、睿智、温情，多姿多彩，博大精深。罗素自选文集有选自《神秘主义与逻辑》、《人类为何战斗》和《自由之路》等最能体现他风格的作品。值得每一位善良、正义、向往美好人生的青年去阅读，去品味。,2021-12-21 00:40:27,2021-12-21 00:40:27
9780061122415,The Alchemist,https://img9.doubanio.com/view/subject/l/public/s6811626.jpg,[巴西]保罗·柯艾略,AlanR.Clarke,哲学,HarperCollins,"Every few decades a book is published that changes the lives of its readers forever. The Alchemist is such a book. With over a million and a half copies sold around the world, The Alchemist has already established itself as a modern classic, universally admired. Paulo Coelho's charming fable, now available in English for the first time, will enchant and inspire an even wider au...",2021-12-21 00:40:38,2021-12-21 00:40:38
9787532743414,胡塞尔现象学,https://img9.doubanio.com/view/subject/l/public/s2913026.jpg,D·扎哈维,李忠伟,哲学,上海译文出版社,本书作者陈述分为三个主要部分，在很大程度上结合了系统的和编年的视角。这个陈述大概遵循了胡塞尔思想的发展秩序，从早期对逻辑和意向性的分析开始，经过其成熟时期对还原和构成的先验哲学分析，到晚期对主体间性和生活世界的分析。第一部分集中关注胡塞尔早期的意向性理论。第二部分，说明了胡塞尔先验哲学里的主要元素。最后也是最长的部分，转向一些胡塞尔更加具体的现象学分析。,2021-12-21 00:40:48,2021-12-21 00:40:48
9787801087119,先知,https://img1.doubanio.com/view/subject/l/public/s1153709.jpg,[黎巴嫩]纪伯伦,冰心,哲学,西苑出版社,无论是哲学还是文学上，东方比西方都晚了许多世纪，这是学界所公认的。然而，在东方文学史上，纪伯伦的创作风格却以独树一帜著称。他的作品既有理性思考的严肃与冷峻，又有咏叹调式的浪漫与抒情。他善于在平易中发掘隽永，在美妙的比喻中启示深刻的哲理。另一方面，纪伯伦风格还见诸于他极有个性的语言。他是一个能用阿拉伯文和英文的双语作家，而且每种语言都运用得清丽流畅，其作品的语言风格征服了一代又一代的东西方读者。所以,2021-12-21 00:40:56,2021-12-21 00:40:56
9787100045018,弗雷格哲学论著选辑,https://img9.doubanio.com/view/subject/l/public/s1759695.jpg,[德]弗雷格,王路,哲学,商务印书馆,弗雷格是现代逻辑的创始人，也是分析哲学的奠基人，他的思想对罗素和维特根斯坦有直接的影响。本书收录了他关于哲学和逻辑学的文章共14篇。,2021-12-21 00:41:03,2021-12-21 00:41:03
9787807293293,六祖坛经,https://img9.doubanio.com/view/subject/l/public/s6130524.jpg,惠能,,哲学,凤凰出版社,六祖坛经（图文本），ISBN：9787807293293，作者：（唐）惠能 著，王月清 注译,2021-12-21 00:41:09,2021-12-21 00:41:09
9787214072481,美学,https://img2.doubanio.com/view/subject/l/public/s8889742.jpg,弗里德里希·黑格尔,,哲学,江苏人民出版社,凝练阐述现代社会严重缺失的美学的传统意义。    天生深邃的黑格尔以文化深度潜水的姿态。探索生命、宇宙、人的行为的基本面目。他构建的哲学体系似乎可以用一句话概括：人是由一切有生命的和无生命的物质进化而来的除上帝以外的宇宙的最高形式。用他自己的术语说。就是具有了“绝对精神”。《美学》是他探索人类的艺术行为的精妙经典，其中分析了从文学、诗、音乐、绘画到建筑、雕刻的众艺术门类。其讲述，字字重锤。句句如刀锋。《美学》以令人惊叹的黑格尔式才智，结合叙述的精确性、可靠性与文化的深广性、可感性、弥散性，历经一百余年考验。几乎没有第二本书可以超过，几近成为美学的代名词。,2021-12-21 00:41:17,2021-12-21 00:41:17
9787108028976,中国古代思想史论,https://img2.doubanio.com/view/subject/l/public/s3186821.jpg,李泽厚,,哲学,生活·读书·新知三联书店,本书从剖析孔子仁学开始，提出中国民族的“文化心理结构”问题，认为血缘、心理、人道、人格为四大因素，孟、荀从内、外两方展升为光辉的个体人格和伟大的人类特征，而以实用理性、乐感文化为部精神。本书并以此贯穿论说了自先秦至明清的各种主要思潮、派别和人物。其中着重论证了中国的辩证法是“行动的”，而非“思辩的”，论说了秦汉时期所形成具有机反馈机制的“天人感应”宇宙观流传至今，庄子、禅宗的哲学是对人生作形上追求的美学，宋明理学作为道德形而上学仍具有重要价值，以及在明清时期思想中“内圣”与“治法”已出现分离，标志着中国式的政教合一将逐动摇，认为这是走向近代的重要趋向等等。,2021-12-21 00:41:26,2021-12-21 00:41:26
9787508253602,道德经,https://img1.doubanio.com/view/subject/l/public/s4196519.jpg,,,哲学,,《道德经:老子》所选为《道德经》传世通行版本。原文共5500余字，包罗了宇宙观、人生观、认识论、方法论以及立身处世、治国安邦等方方面面的内容。并对其进行了注释、翻译与评析，使有些古奥难懂的内容变得通俗易懂，适合广大读者阅读、鉴赏。,2021-12-21 00:41:35,2021-12-21 00:41:35
9787100018715,哲学史讲演录(第一卷),https://img2.doubanio.com/view/subject/l/public/s1281091.jpg,[德]黑格尔,贺麟,哲学,商务印书馆,在哲学史里，我们立刻可以看到，如果从一个恰当的观点去看它的题材，它自然会引起我们很大的兴趣，但是即使它的目的被了解错了，它仍然具有它的兴趣。甚且一般人对于哲学和哲学史的目的愈益增加。因为从哲学史里人们特别可以推出一个足以证明哲学这门科学无用的理由。,2021-12-21 00:41:43,2021-12-21 00:41:43
9787101077377,周易,https://img1.doubanio.com/view/subject/l/public/s11334267.jpg,杨天才,,哲学,中华书局,《周易》被称为“群经之首”，由“经”、“传”两部分组成。“经”称《易经》，包括六十四卦，每卦都有卦象、卦辞、爻辞，是《周易》的主体；“传”由《彖》《象》《系辞》《文言》《序卦》《说卦》《杂卦》共七种十篇构成，称“十翼”，又自成体系而为“易传”。本书以《十三经注疏》中的《周易正义》为底本，采取逐段逐爻注释、翻译、评析的方式，释读文本，详析义理，是兼及《周易》普及与研读的文本。,2021-12-21 00:41:51,2021-12-21 00:41:51
9787508064789,说理,https://img2.doubanio.com/view/subject/l/public/s6395061.jpg,陈嘉映,,哲学,华夏出版社,本书是著名哲学家陈嘉映教授集四十年从事哲学思考与研究形成的最重要的哲学专著。全书共分九章，以语言分析哲学的方法论述了相关的全部哲学命题，各章包括“哲学之为穷理”，“哲学为什么关注语言”，“哲学语法”，“论理词与论理”，“感知与语言分析”，“亲知与观念”，“看法与论证”，“普遍性：同与通”，“事情本身与事实”等。现代语言分析哲学源出自英国经验主义传统，以分析语言与意义的关系达至问道穷理的目的。陈嘉映教授初入以德国理性主义传统下海德格尔研究入手，从而将西方二十世纪现象学潮流与分析哲学的深入研究紧密无间地结合为一体，形成了自己相对独立的学说体系。该书作者首先以“哲学何为”入手，说“哲学大致就是穷理”：“从一个道理追向另一个道理，谓之穷理。所谓哲学，大致就是穷理”。而穷理，在陈嘉映教授看来，就是一个在一定的哲学语法下对感知和语言进行分析的过程。这一分析在其发...,2021-12-21 00:41:58,2021-12-21 00:41:58
