9787535691682,克隆达·芬奇,https://img9.doubanio.com/view/subject/l/public/s33699126.jpg,[法]斯特凡纳·勒瓦卢瓦编绘,叶蔚林,科幻,后浪丨湖南美术出版社,好莱坞御用概念设计师耗时两年倾力打造纪念达·芬奇逝世五百周年，卢浮宫博物馆官方监修中世纪文艺复兴精神融合尖新科技幻想，一出浪漫瑰奇的太空歌剧五百年前他复兴文艺，一万年后地球陷落，他能否凭一己之力复兴人类？原版忠实复刻，巨幅开本珍藏之选“它即是艺术品本身！”▼编辑推荐◇纪念达·芬奇逝世500周年，卢浮宫博物馆官方监修出品漫画为纪念达·芬奇逝世500周年，卢浮宫钦点年轻的天才漫画家斯特凡纳·勒瓦卢瓦进行纪念漫画的创作，并向他开放超6000页从未公之于众的达·芬奇手稿和原作。斯特凡纳潜心创作两年，亲手临摹、复制了160幅达·芬奇原画，最终创作了这部令人震撼的漫画：它是达·芬奇超前的天才和高科技科幻的完美结合，中世纪文艺复兴人和未来人类星河太空征途的无缝衔接。◇好莱坞御用概念设计师耗时两年倾力打造，硬核画工“克隆”达·芬奇。斯特凡纳·勒...,2021-12-23 09:03:57,2021-12-23 09:03:57
9789579525213,星雲組曲,https://img2.doubanio.com/view/subject/l/public/s1398711.jpg,張系國,,科幻,洪範書店,張系國以科幻小說預言人類的命運，《星雲組曲》共收十篇科幻小說，勾劃二十世紀到二百世紀的未來世界，探索人類生命在星雲宇宙的衝突和交會中所扮演的角色。  《星雲組曲》共收十篇科幻小說，勾劃二十世紀到二百世紀的未來世界，探索人類生命在星雲宇宙的衝突和交會中所扮演的角色，靈視無限，渺茫波譎，在血肉心神的充分成長後，仍導致浩劫的悲劇。 張系國以科幻小說預言人類的命運，更透過悲憫的諷諭，批判今日人類的自滿和愚妄，如真似幻、玄思浩瀚。,2021-12-23 09:04:03,2021-12-23 09:04:03
9789222421428,阿瑟•克拉克中短篇科幻小说集,https://img2.doubanio.com/view/subject/l/public/s28120693.jpg,[英国]阿瑟·克拉克,江昭明,科幻,,著名科幻小说家 最伟大的科幻作家A·C·克拉克的中短篇小说集。,2021-12-23 09:04:09,2021-12-23 09:04:09
9787536453104,中国科幻小说精品集,https://img3.doubanio.com/view/subject/l/public/s1169670.jpg,姚海军,,科幻,四川科学技术出版社,《中国科幻小说精品集》收录的是从近年大量作品中遴选而出的优秀之作。十二篇作品，或想像奇伟，或故事诡异，将为读者提供最佳的科幻阅读体验。,2021-12-23 09:04:15,2021-12-23 09:04:15
9789863442790,華氏451度,https://img2.doubanio.com/view/subject/l/public/s28327183.jpg,雷.布萊伯利,徐立妍,科幻,麥田,蒙塔格是一名打火員，在他的世界裡，電視主宰著一切，文學則瀕臨滅絕；打火員的工作成了放火而非滅火。他的工作就是要摧毀非法的產品，也就是印刷書籍，以及藏匿這些書籍的房子。蒙塔格從來不去質疑自己的行為造成了什麼樣的破壞和損失，每天只是回到他無趣的生活和他的妻子蜜卓身邊，而她的妻子整天只會陪著她的電視「家人」。但這時，他遇見了古怪的年輕鄰居克萊莉絲，她讓他知道原來過去的世界裡，人們不必生活在恐懼中；在現今的世界裡，還是有人可以透過書本裡的思想來看待一切，不必仰賴電視中無腦的談話。就在克萊莉絲突然消失之際，蒙塔格開始質疑自己所知道的一切；一次出勤行動中，寧可與書俱焚的老婦人更讓他在心中深植這個想法——書本裡肯定有什麼。他開始在家裡藏書，而當他的偷竊行為被發現時，這個打火員得開始亡命天涯……,2021-12-23 09:04:23,2021-12-23 09:04:23
9787536494442,菲利普·迪克的电子梦,https://img9.doubanio.com/view/subject/l/public/s33475145.jpg,[美]菲利普·迪克,肖钰泉,科幻,四川科学技术出版社,本书收录了十篇菲利普·迪克精彩的短篇小说，数位知名编剧及导演大显身手，以这些小说为基础改编出了一部部扣人心弦的科幻剧集。这部名为《菲利普·迪克的电子梦》的剧集在亚马逊影视平台（Amazon Prime Video）上播出后受到观众的热评。离奇绝妙、诙谐幽默、震人心魄，这十部作品像是闪烁着奇光异彩的耀眼明珠，展现出了菲利普·迪克无边无际的想象和对人性最深刻的理解。在本书中，除了小说故事之外，读者还能阅读到各位编剧创作时的心路历程，真切地体会到从小说到影视艺术的转换魔法。,2021-12-23 09:04:31,2021-12-23 09:04:31
9787539962221,银河帝国10：裸阳,https://img2.doubanio.com/view/subject/l/public/s27972883.jpg,[美]艾萨克·阿西莫夫,叶李华,科幻,江苏文艺出版社,《银河帝国10：裸阳》：索拉利星球上，发生了第一起谋杀案。这起案件的困境在于：1）任何索拉利人，除了自己的配偶外，不可能与其他任何人接触。2）一切证据都说明被害人的妻子绝对不是凶手。凶手难道是身为奴隶的机器人吗？但是，“机器人学三大法则”是不可能允许机器人杀人的。凶手究竟是谁？贝莱与丹尼尔再次携手办案！“银河帝国”系列内容简介：人类蜗居在银河系的一个小角落——太阳系，在围绕太阳旋转的第三颗行星上，生活了十多万年之久。人类在这个小小的行星（他们称之为“地球”）上，建立了两百多个不同的行政区域（他们称之为“国家”），直到地球上诞生了第一个会思考的机器人。在机器人的帮助下，人类迅速掌握了改造外星球的技术，开启了恢弘的星际殖民运动；人类在银河系如蝗虫般繁衍扩张，带着他们永不磨灭的愚昧与智慧、贪婪与良知，登上了一个个荒凉的星球，并将银河系卷入漫...,2021-12-23 09:04:38,2021-12-23 09:04:38
9787806249451,基地续集2·基地与地球（上下）,https://img9.doubanio.com/view/subject/l/public/s1328664.jpg,[美]艾萨克·阿西莫夫,叶李华,科幻,天地出版社,银河未来的命运决定于某人一念之间，这个就是葛兰·崔维兹。他必须在第一基地，第二基地与盖娅之间做出银河未来由谁主导的决定，由第一基地创建的新帝国将会逞领银河进入科技昌明的世纪，由第二基地指导的新帝国将能确保人类的永久和平，而以盖娅为蓝图的盖娅星系则会是个心灵共同体，所有人类将与万物融合成一个良善的整体。崔维兹直觉地做出了选择，但却无法确定自己的选择是否正确，他怀疑宇宙中还藏有更强大的操纵力量。崔维兹相信地球是解开所有谜团的关键，因为地球是人类的起源母星。奇怪的是，银河中有关地球的资料全都神秘消失。决心查明真正的崔维兹，再次在险恶的群星间漂流，寻觅，究竟两万年前的地球隐藏着什么秘密，崔维兹会改变他的决定吗？,2021-12-23 09:04:47,2021-12-23 09:04:47
9787100046084,索拉里斯星,https://img1.doubanio.com/view/subject/l/public/s1707557.jpg,[波兰]斯塔尼斯瓦夫·莱姆,陈春文,科幻,商务印书馆,小说以一个被神秘大洋覆盖的星球为背景，演绎了人类寻求知识和生死相爱的科学神话。莱姆笔下的神秘大洋似乎是有智慧的，能够物化人类头脑中的隐私和邪念。科学家们围绕这个不解之谜作出种种推测，却难以自圆其说。任何一种解释都不过是用“一个更费解的谜代替另一个谜而已”。,2021-12-23 09:04:57,2021-12-23 09:04:57
9787540225056,海底两万里-全译本,https://img1.doubanio.com/view/subject/l/public/s27968387.jpg,[法]儒勒·凡尔纳,,科幻,北京燕山出版社,本书叙述的是法国生物学家阿龙纳斯教授探海旅行的故事。本书通过对“海上怪物”的追踪，为我们描绘出一片片神奇的海底世界，这里有海底平原、海底森林、海底墓场、珍珠世界、沉没的大洲和古城堡……当然，除此之外，小说还为我们展示出了各种各样迷离而又神奇的鱼类世界。同时，凡尔纳还用他神奇的笔为我们设置了很多惊险的场面，使整部小说显得跌宕起伏，扣人心弦。,2021-12-23 09:05:06,2021-12-23 09:05:06
9789571343808,銀河便車指南,https://img2.doubanio.com/view/subject/l/public/s1944901.jpg,[英]道格拉斯．亞當斯,丁世佳,科幻,時報文化,對大多數中文讀者而言，道格拉斯‧亞當斯 (Douglas Adams) 稍嫌陌生，但在廣大的英文讀者心目中，他卻是第一個成功結合喜劇和科幻的作家，一個幽默諷刺文學的泰斗。英國BBC前兩年舉辦的「大閱讀」票選，100本最受讀者喜愛的小說中亞當斯的《銀河順風車旅遊指南》高居第四(前三名為《魔戒》、《傲慢與偏見》及《黑暗三部曲》)，可見其重要。這個排名也打敗了排名第五的《哈利波特4──火盃的考驗》。 小說主要人物是一個無家可歸的地球人、一個到處為家的外星人，及幾位個性鮮明的角色。這套小說最早的形式是廣播劇本，因太成功又改寫成小說，光是英文版的銷量就超過一千四百萬本，八○年代風靡歐美，後來陸續改編成電視劇、舞台劇、電腦遊戲……等等，說是影響大眾最力的科幻作品(夢幻逸品)毫不為過。這套書影響了廣大年輕人，後繼的科幻作家，電影《星際戰警》(MIB)，也從這...,2021-12-23 09:05:14,2021-12-23 09:05:14
9784063145311,ブラム学園! アンドソーオン,https://img1.doubanio.com/view/subject/l/public/s33063307.jpg,弐瓶勉,,科幻,講談社,バイオメガ』をはじめとする異形・奇想のＳＦ作品群で漫画界を疾駆する男・弐瓶勉。世界を驚かせた彼の代表作『ＢＬＡＭＥ！』の続編を収めた作品集、ついに登場！　……といいつつ、収録作の残り半分は馬鹿漫画！　３回にわたって「アフタヌーン」に掲載されるたびに、芸風をコメディ・下ネタ・萌えとダイナミックに変化させ、読者を興奮と混乱のるつぼに叩き落とした『ブラム学園！』を完全収録！　さらに未発表短編や幻の実験作まで、全１０作品すべて加筆修正、フルカラー化作業を敢行。驚愕・圧巻・お得な１冊、ついに登場！ギガスケールＳＦ作品『ＢＬＡＭＥ！』、さらにハードな続編登場！　一方でぶち壊し萌え外伝も登場！　ジャンルを軽々と越境する弐瓶勉の作品世界、オールカラー全１０編！収録作品：ＺＥＢ－ＮＯＩＤ／ブラム学園！／ブラム学園！　京都奈良相合傘／ブラム学園！　桜咲く塔の下で／小包...,2021-12-23 09:05:20,2021-12-23 09:05:20
9787559420046,遥远的地球之歌,https://img9.doubanio.com/view/subject/l/public/s29839804.jpg,[英]阿瑟·克拉克,高天羽,科幻,江苏凤凰文艺出版社,百万光年的航道上，地球的末裔谱写着新生的赞歌。--------------------------------公元3620年，地球迎来了末日，但人类仍未灭绝。人类通过两种太空移民方式，使种族得以延续：一种是用播种船将基因运送到外星，再在外星直接培养出本土人类。 这种移民的历史短暂，却渐渐形成了独有的文化体系。而另一种，则是将最后一代地球人人体冷冻，用飞船送往外星。这种移民亲眼目睹了地球的毁灭，充满了沉重的使命感。这一天，在遥远的萨拉萨星，截然不同却又无比相似的他们终于相遇了……--------------------------------◆《遥远的地球之歌》作者阿瑟•克拉克是“20世纪科幻三巨头”，和阿西莫夫、海因莱因齐名。◆阿瑟•克拉克是美国科学与幻想作家协会“大师奖”终身成就奖得主。◆克拉克被誉为“太空预言家”，成功预言了互...,2021-12-23 09:05:28,2021-12-23 09:05:28
9787532153589,爱因斯坦的梦,https://img1.doubanio.com/view/subject/l/public/s27643179.jpg,(美)艾伦·莱特曼,童元方,科幻,上海文艺出版社,一九○五年，历史上重大的一年，在瑞士专利局工作的爱因斯坦即将要创造出惊天动地的理论，却陷入了一段又一段的梦中……在梦里，时间是一个圆，反复循环；或者，时间静止不动；有时，时间是一只夜莺，人们想捉而捉不到；但捉到时鸟却立时死亡……这三十个各自独立的梦境，交相出现在对爱因斯坦生活的描述中，却仿佛将人生、宇宙种种终极问题思索了遍，留下了无数个关于生命的问号。如果时间流转的方式不同，我们仍会如同现在一样的生活吗？如果生命以老朽为始，以童稚为终，那么年轻和年老如何定义？如果生命只有短短的二十四小时，看过一次日出就要淍零，此刻为何奔忙？如果所有梦想都将预知会成败，我们是否还会梦想？如果此刻初遇的爱人，下一刻便不复存在，爱情会不会只是一场徒劳？如果一分钟后世界就要末日，又该在哪里与谁相伴？,2021-12-23 09:05:41,2021-12-23 09:05:41
9787544782173,索拉里斯星,https://img1.doubanio.com/view/subject/l/public/s33925108.jpg,[波]斯坦尼斯瓦夫·莱姆,靖振忠,科幻,译林出版社,🌌这颗星球，知道你内心深处的秘密。🌌波兰科幻大师莱姆代表作，塔可夫斯基《飞向太空》原著小说。🌌刘慈欣、梁文道、戴锦华、吴岩、江晓原诚意推荐【编辑推荐】🌟波兰科幻大师斯坦尼斯瓦夫•莱姆代表作，以诗意笔触和深邃哲思触探人类认知边界。人类追寻着地外文明的蛛丝马迹，遇见了索拉里斯星的蓝色大洋。它像一面镜子，反映出人类的忧伤与迷惘，恐惧与执念。而它本身是什么，人类却永远也无法知道。🌟安德烈•塔可夫斯基据此改编《 飞向太空》，铸就电影史上的经典。🌟被无数人誉为无法超越的科幻神作，设立太空想象天花板，刘慈欣、梁文道、戴锦华、吴岩、江晓原诚意推荐。🌟莱姆是波兰科幻作家、哲学家，被译成52种语言，全球畅销4000余万册，以一己之力将波兰科幻提升到世界水平。早在70年前就预言了互联网、搜索引擎、虚拟现实和3D打印的出现，直言人类将遭遇人工智能和信息爆炸的挑...,2021-12-23 09:05:47,2021-12-23 09:05:47
9787533945183,安德的游戏·三部曲,https://img9.doubanio.com/view/subject/l/public/s28732956.jpg,[美]奥森·斯科特·卡德,李毅,科幻,浙江文艺出版社,★《安德的游戏》：世界即将毁灭。威胁来自另一文明——虫族。它们在数量、科技和战略上都碾压人类，在第一和第二次侦查性接触中，几乎摧毁所有人类舰队。如今，第三次虫族入侵已迫在眉睫，而地球舰队尚未找到任何抵抗的可能。世界即将毁灭。人类最后的救世主 ，是一个六岁的儿童——安德。在世界上几乎任何一家书店的书架上都能找到《安德的游戏》。这和它辉煌的得奖记录和畅销奇迹无关，只是因为，它真的太好看了。★《死者代言人》：这一次，虫族已经无从开口，但它们灭亡前的话语如梦魇般纠缠着安德，迫使他成为一名“死者代言人”。隐藏身份的安德在星际间流浪了3068年，凭借天才的头脑在二十四颗殖民星球上为死者道出真相。安德遭遇了一起残忍而离奇的虐杀事件。安德隐匿身份，再次踏入一个异生物星球。随着调查的深入，他一步步走向异种生物的圈套，而真相，居然与他童年的那段回忆有千丝万...,2021-12-23 09:05:55,2021-12-23 09:05:55
9787544738767,仿生人会梦见电子羊吗？,https://img9.doubanio.com/view/subject/l/public/s26858994.jpg,[美国]菲利普·迪克,许东华,科幻,译林出版社,核战后，放射尘让地球上的动物濒临灭绝，地球已不再适合人类居住。为了鼓励残存的人口移民，政府承诺，只要 移民到外 星球，就可以为每个人自动配备一个仿生人帮助其生活。仿生人不满足于被人类奴役的现状，想方设法逃回地球。主人公里克•德卡德是一名专门追捕逃亡仿生人的赏金猎人。在一次 追捕行动中，里克遭遇了新型仿生人前所未有的挑战。九死之后，能否一生？在与仿生人的接触和较量中，里克发现自己对仿生人的看法和态度有了很大的改变。这种改变究竟是福还是祸？,2021-12-23 09:06:05,2021-12-23 09:06:05
9787222036444,苹果核里的桃先生,https://img1.doubanio.com/view/subject/l/public/s9786979.jpg,七格,,科幻,云南人民出版社,本书共由五篇小说组成。即“语法树”、“可能世界”、“实无穷”、“形式国”、“神谕”。  弗吉尼亚·伍尔芙认为我们“每一个人内心都有一片原始森林，一片连飞鸟的足迹都是闻所未闻的雪原”。而当身体健康的时候呢，我们对此不仅不闻不理，而且还把它们当作“土著”民族加以教化，和它们“白天一起工作，夜晚一起娱乐。”而当我们生病了，“这种虚假就停止了。”我们逃离了“正直的大军”的行列，而“与河流的棍棒一起漂流，与草坪上的枯叶一起漫天飞舞。”（黄梅译）  读七格的《苹果核里的桃先生》（云南人民出版社2003年1月第1版，《广场文库》），也要事先预备这么一份心情，承认教化别人和自我教化的工作暂时告一段落。权当作生病发高烧，不知怎么的就迷路了，于是来到了一些奇奇怪怪的地方，那里的世界花花绿绿，异彩纷呈，天上人间不分，时间空间交错，人们行为古怪，功能异常，服装奇特...,2021-12-23 09:06:11,2021-12-23 09:06:11
9787536470200,经典的真身,https://img2.doubanio.com/view/subject/l/public/s7651902.jpg,(美)迪克等,,科幻,四川科学技术出版社,一直以来，科幻小说都是科幻电影发展的沃土。自1902年史上第一部科幻电影诞生起，无数导演从科幻小说中汲取灵感，拍摄出优秀的科幻影片；20世纪五六十年代美国科幻小说的黄金时期，更直接引领了好莱坞科幻大片的兴盛时代。本书共收录十四部优秀科幻电影的蓝本小说，题材涵盖太空探索、时间旅行、人工智能、记忆移植等等，对于想要深刻理解自己热爱的科幻影片的读者大有助益。在不到七千字的《岗哨》中，《2001：太空漫游》的科幻精髓闪耀其间；在《整个夏天的超级玩具》中，美丽而残忍的故事让库布里克和斯皮尔伯格两位大师同时心动；本杰明·巴顿的逆行人生在菲茨杰拉德笔下铺陈，一个世纪后又在大卫·芬奇的镜头中轮回……一个个短篇，凝结着作者的智慧和思考，又在导演的演绎下熠熠生辉，散发出经久不衰的艺术魅力，是所有喜爱科幻的读者应当珍视的宝藏。,2021-12-23 09:06:17,2021-12-23 09:06:17
9789629983482,銃夢.Last.Order 1,https://img1.doubanio.com/view/subject/l/public/s2874178.jpg,[日本]木城幸人,,科幻,天下出版有限公司,貌似作者不喜欢9卷本GUNNM里面的结局，说是匆匆做出的决定。现在GUNNM Last.Order经过作者的深思熟虑继续加里的传奇，讨论现代人类的哲学问题。,2021-12-23 09:06:23,2021-12-23 09:06:23
9787540224967,神秘岛,https://img1.doubanio.com/view/subject/l/public/s4620387.jpg,[法]儒勒·凡尔纳,陈筱卿,科幻,北京燕山出版社,《神秘岛(插图本珍藏版)》是凡尔纳著名三部曲（《格兰特船长的儿女》、《海底两万里》和《神秘岛》）的最后一部。《神秘岛(插图本珍藏版)》中，他讲述了美国南北战争时期，有五个被围困在南军城里的北方人，趁着偶然的机会，乘气球逃了出来。但中途遭遇风暴，落在太平洋的一个荒岛上。这五个人没有灰心丧气，而是团结起来，以集体的智慧克服了重重困难，在荒岛上安顿了下来。他们动手制造出陶器、玻璃、风磨、电报机……自给自足，丰衣足食。他们还挽救了被格兰特船长罚在另一荒岛上的罪犯，使之恢复人性，成为忠实的伙伴。在荒岛上，他们得到了《海底两万里》中的尼摩船长的暗中保护，屡屡化险为夷。最后，搭上了格兰特船长之子——罗伯特·格兰特指挥的“邓肯号”，回到了他们日夜思念的祖国。,2021-12-23 09:06:31,2021-12-23 09:06:31
9787500604433,神秘岛,https://img1.doubanio.com/view/subject/l/public/s1274167.jpg,(法)儒勒.凡尔纳,联星,科幻,中国青年出版社,《神秘岛》是法国著名科幻小说家儒尔·凡尔纳的三部曲之一，其他两部是《格兰特船长的儿女》和《海底两万里》。该书叙述美国南北战争期间，五名北军俘虏乘坐气球，从南军大本营里士满出逃。途中遭遇风暴，被抛到南太平滚一个荒无人烟的小岛上。这些落难者依靠自己的智慧和过人的毅力，克服了种种困难，不仅顽强地生存下来，而且还把小岛建设成一个繁荣富庶的乐园。整部小说情节跌宕起伏，充满了对奇异多姿的自然界的描写，并且把各种知识融会到惊心动魄的故事之中，因此出版至今虽然已有一百多年，但仍探受世界各地读者的推崇和喜爱。,2021-12-23 09:06:38,2021-12-23 09:06:38
9787100045612,完美的真空,https://img1.doubanio.com/view/subject/l/public/s1457687.jpg,[波兰]斯塔尼斯瓦夫·莱姆,王之光,科幻,商务印书馆,《完美的真空》作者莱姆是欧洲最多才多艺的独创性作家之一，是国际公认的科幻小说天才作家。他的头脑具有大无畏的尖刻讽刺精神，在《完美的真空》中，他凭借巧妙的构思和无孔不入的机智，用人们喜闻乐见、熟悉得令人不设防的发明来迷住我们——从“请你来写”的文学提神器，到“性爆炸”的社会被三家大公司驱赶入性福的大餐，到“小队元首路易十六”的纳粹战犯在南美的荒原里再造法国的黄金时代，他为模仿滑稽作品开拓子美丽的新世界。,2021-12-23 09:06:46,2021-12-23 09:06:46
9787533665241,八十天环游地球-插图版.全译本,https://img1.doubanio.com/view/subject/l/public/s9003718.jpg,凡尔纳,海狸,科幻,安徽教育出版社,《凡尔纳科幻经典:八十天环游地球(插图本•全译本)》内容简介：19世纪末，英国绅士菲利斯•福格因与改良俱乐部牌友的一个赌约，偕同仆人“万事通”开始了一项八十天环游地球的壮举。虽然在理论上八十天环游地球是可以实现的，但是现实中总会有各种各样的困难阻挠旅行的正常进行。福格先生与“万事通”不但一一排除了受人冤枉吃官司、遭遇海上风暴、遇到印第安人抢匪等险情，还“英雄救美”使得美丽的艾欧达夫人也加入了旅行。另外，还有一位傻瓜侦探费克斯，误认为福格是银行窃贼，一路跋山涉水跟踪福格，闹出了不少糗事与笑话——旅途也变得精彩纷呈、妙趣横生。福格一行人途经地中海、红海、印度洋、太平洋、大西洋，游历了印度、新加坡、中国、日本、美国等地，但就在即将回到伦敦时，却因福格先生没有登上返回伦敦的定期轮船，而使这个两万英镑赌约的结果变得难以预测……《凡尔纳科幻经典:八十天环游地球(...,2021-12-23 09:06:56,2021-12-23 09:06:56
9787559416551,与罗摩相会,https://img9.doubanio.com/view/subject/l/public/s29773195.jpg,[英]阿瑟·克拉克,刘壮,科幻,江苏凤凰文艺出版社,★科幻历史上真正的神作！ 科幻三巨头阿瑟·克拉克不朽的杰作。★史无前例，横扫雨果奖、星云奖、轨迹奖、木星奖、英国科幻协会奖、约翰•坎贝尔纪念奖6项科幻最高大奖。★关于与外星文明接触的终极构想，影响《三体》《星际穿越》《降临》《异形》《星际迷航》……★人类从未真正了 解宇宙，但从未停止探索。-一直以来，人类偏安于宇宙一角，自以为是宇宙仅有的文明。直到有一天，人类迎来了第一个外星文明……2131年，人类的活动遍布整个太阳系，一艘庞大的不明飞行物闯了进来。科学家以印度神话人物“罗摩”为它命名，在经过观测之后，科学家发现罗摩其实是一个空心圆柱体，于是派遣一艘飞船与它相会。人类还不知道的，他们探索的文明远远超过了自己的认知。-◆入选权威杂志《轨迹》杂志有史以来最伟大科幻小说榜单。◆入选权威媒体美国国家公共电台（NPR）有史以来100部最伟大科...,2021-12-23 09:07:05,2021-12-23 09:07:05
