9787229151003,三体,https://img9.doubanio.com/view/subject/l/public/s33679705.jpg,刘慈欣,,科幻,重庆出版社,刘慈欣，祖籍河南，长于山西，中国科普作家协会会员，山西省作家协会会员，高级工程师。自1999年处女作《鲸歌》问世以来，刘慈欣已发表短篇科幻小说三十余篇、出版长篇科幻小说六部，并创下连续八年荣获中国科幻最高奖“银河奖”的纪录。他的长篇作品《三体》开创《科幻世界》月刊连载原创作品的先例，成为2006年度最受关注、最畅销的科幻小说。,2021-12-23 08:28:55,2021-12-23 08:28:55
9787539983332,银河帝国：机器人五部曲,https://img1.doubanio.com/view/subject/l/public/s28284247.jpg,[美]艾萨克·阿西莫夫,叶李华,科幻,江苏凤凰文艺出版社,机器人学三大法则一、机器人不得伤害人类，或因不作为而使人类受到伤害。二、除非违背第一法则，机器人必须服从人类的命令。三、在不违背第一及第二法则的情况下，机器人必须保护自己。===人类蜗居在银河系的一个小角落——太阳系，在围绕太阳旋转的第三颗行星上，生活了十多万年之久， 直到地球上诞生第一个会思考的机器人。在机器人的帮助下，人类迅速掌握了改造外星球的技术，开启了恢弘的星际殖民运动；人类在银河系如蝗虫般繁衍扩张，带着他们永不磨灭的愚昧与智慧、贪婪与良知，登上了一个个荒凉的星球，并将银河系卷入漫长的星际战国时代……===“机器人五部曲”就是第一个会思考的机器人的故事。彼时，地球人蜗居在地球的大城里，大部分人畏惧远行，害怕机器人，只有少数人在寻找出路。而地球人侦探以利亚贝莱就是一个为地球开辟未来的先锋。贝莱起初也不喜欢机器人，然而，一桩发生在...,2021-12-23 08:29:02,2021-12-23 08:29:02
9787229124410,三体,https://img2.doubanio.com/view/subject/l/public/s29512502.jpg,刘慈欣,,科幻,重庆出版社,“文化大革命”如火如荼进行的同时，军方探寻外星文明的绝秘计划“红岸工程”取得了突破性进展。但无人料到，地球文明向宇宙发出的di一声啼鸣彻底改变了人类的命运。四光年外，为了生存挣扎的“三体文明”接收到了地球发来的信息。在运用超技术锁死地球人的基础科学之后，三体人庞大的宇宙舰队开始向地球进发……“凌晨一点至五点，整个宇宙将为你闪烁。”——《三体》庞大的三体舰队杀气腾腾直扑太阳系，尖端科技被锁死的地球人面对危局，突破口在于三体人透明的思维。于是，人类制订了神秘莫测的“面壁计划”，秘密展开对三体人的反击。“面壁计划”与人类的太空舰队，哪一样才是人类的希望？“黑暗森林”意味着什么？文明在波谲云诡的宇宙中又该如何存续？“宇宙就是一座黑暗森林，每个文明都是带枪的猎人。”——《三体Ⅱ·黑暗森林》与三体文明的战争使人类di一次看到了宇宙黑暗的真相，地球文明...,2021-12-23 08:29:09,2021-12-23 08:29:09
9787540471248,中国科幻基石丛书·三体（全三册）,https://img1.doubanio.com/view/subject/l/public/s29857148.jpg,刘慈欣,,科幻,重庆出版社,文化大革命如火如荼进行的同时，军方探寻外星文明的绝秘计划“红岸工程”取得了突破性进展。但在按下发射键的那一刻，历经劫难的叶文洁没有意识到，她彻底改变了人类的命运。地球文明向宇宙发出的一声啼鸣，以太阳为中心，以光速向宇宙深处飞驰……四光年外，“三体文明”正苦苦挣扎—— 三颗无规则运行的太阳主导下的百余次毁灭与重生逼迫他们逃离母星。而恰在此时，他们接收到了地球发来的信息。在运用超技术锁死地球人的基础科学之后，三体人庞大的宇宙舰队开始向地球进发……人类的末日悄然来临。《三体》的幻想源于经典物理中的三体问题，即三个体积质量相当的天体，在远离其它星系以致其它星系的引力影响可忽略不计的情况下，三个天体在互相引力的作用下互相围绕运行，其运行轨迹将产生不可预测的混沌。很多年来，数学家们一直希望能建立三体乃至多体问题的数学模型，可遗憾的是，得到的结果仅仅是三体...,2021-12-23 08:29:16,2021-12-23 08:29:16
9787221146083,魂国志(天机之谜),https://img9.doubanio.com/view/subject/l/public/s29803235.jpg,杭松,,科幻,贵州人民出版社,一棵决定命运的树，一个无法参破的禅，三个命运迥异的人接近天机的真相。昔日少年，今日英豪。是谁忘了不该忘记的人又结了不该结下的缘？昔日挚友，今日仇敌，是谁在谈笑间挥出锋利的刀子？死亡是圣裁者的仁慈，救赎是救世者的悲悯。守护还是毁灭，该如何抉择？我们参悟天机之谜，超越了吉凶，看淡了生死。到最后才发觉，物是镜中花，人是笼中鸟。,2021-12-23 08:29:22,2021-12-23 08:29:22
9780451457998,2001,https://img1.doubanio.com/view/subject/l/public/s9018397.jpg,ArthurC.Clarke,,科幻,Roc,2001: A Space Odyssey is the classic science fiction novel that changed the way we looked at the stars and ourselves....2001: A Space Odyssey inspired what is perhaps the greatest science fiction film ever made -- brilliantly imagined by the late Stanley Kubrick....2001 is finally here....,2021-12-23 08:29:34,2021-12-23 08:29:34
9787541160677,平面国,https://img3.doubanio.com/view/subject/l/public/s33959400.jpg,[英]埃德温·A.艾勃特（EdwinA.Abbott）,蒋慧,科幻,四川文艺出版社,百年传世科幻经典×堪称“空间”启蒙书搭配15幅全新插图，附插画师创作谈，讲述插画诞生背后的故事维度概念的先驱，深刻影响霍金、阿西莫夫、诺兰等众多科学、科幻界大师🔷编辑推荐◎世界经典名著，百年传世科幻经典，维度概念的先驱，堪称“空间”启蒙书。◆“科幻大师”阿西莫夫盛赞：“《平面国》是人们认知维度概念的最佳途径，它让我们深刻思考宇宙与自我。”◆《星际穿越》的隐秘彩蛋：“墨菲书架上的书”之一，同《万有引力之虹》、T.S 艾略特的 《荒原》、马尔克斯的《百年孤独》等一起，成为启示剧情发展的重要线索。◆《生活大爆炸》中谢尔顿心中的最佳旅行地：“如果可以造访一个幻想中的国度，我最想去的地方就是平面国。”◎搭配15幅全新插图，生动还原「平面国」世界设定；另附插画师创作谈，讲述插画诞生背后的故事。平面国的居民到底长什么样子？他们的日常画风怎样...,2021-12-23 08:29:44,2021-12-23 08:29:44
9784062143233,新世界より 上,https://img9.doubanio.com/view/subject/l/public/s2955924.jpg,[日本]貴志祐介,,科幻,講談社,ここは汚れなき理想郷のはずだった。1000年後の日本。伝説。消える子供たち。著者頂点をきわめる、3年半ぶり書き下ろし長編小説!子供たちは、大人になるために「呪力」を手に入れなければならない。一見のどかに見える学校で、子供たちは徹底的に管理されていた。いつわりの共同体が隠しているものとは――。何も知らず育った子供たちに、悪夢が襲いかかる!第29回日本SF大賞受賞,2021-12-23 08:29:51,2021-12-23 08:29:51
9787539983356,银河帝国：基地七部曲,https://img9.doubanio.com/view/subject/l/public/s28284246.jpg,[美]艾萨克·阿西莫夫,叶李华,科幻,江苏凤凰文艺出版社,人类蜗居在银河系的一个小角落——太阳系，在围绕太阳旋转的第三颗 行星上，生 活了十多万年之久。人类在这个小小的行星（他们称之为“地球”）上，建立了两百多个不同的行政区域（他们称之为“国家”），直到地球上诞生了第一个会思考的机器人。在机器人的帮助下，人类迅速掌握了改造外星球的技术，开启了恢弘的星际殖民运动；人类在银河系如蝗虫般繁衍扩张，带着他们永不磨灭的愚昧与智慧、贪婪与良知，登上了一个个荒凉的星球，并将银河系卷入漫长的星际战国时代，直至整个银河被统一，一个统治超过2500万个住人行星、疆域横跨十万光年、总计数兆亿人口的庞大帝国崛起——银河帝国。一个微妙的转折发生在银河帝国建国后的12020年。哈里·谢顿，这个刚满32岁的年轻数学家，开创了“心理史学”，这门学科能用数学公式准确推演全人类的未来——“预言”从此成为一门可以信任的科学，人类由此可以看...,2021-12-23 08:29:59,2021-12-23 08:29:59
9789622731578,最後的問題 : 西方短篇科幻小說精選,https://img2.doubanio.com/view/subject/l/public/s4361993.jpg,[美]艾萨克·阿西莫夫,李偉才,科幻,山邊社,譯作，並附作者介紹及內容評介,2021-12-23 08:30:05,2021-12-23 08:30:05
9780765186355,BLAME!探索者(02),https://img1.doubanio.com/view/subject/l/public/s3188217.jpg,貳瓶勉,郎偉彤,科幻,長鴻,,2021-12-23 08:30:11,2021-12-23 08:30:11
9780345453747,The Ultimate Hitchhiker's Guide to the Galaxy,https://img2.doubanio.com/view/subject/l/public/s1462762.jpg,DouglasAdams,,科幻,DelRey,"At last in paperback in one complete volume, here are the five classic novels from Douglas Adams’s beloved Hitchiker series.   The Hitchhiker’s Guide to the Galaxy  Seconds before the Earth is demolished for a galactic freeway, Arthur Dent is saved by Ford Prefect, a researcher for the revised  Guide . Together they stick out their thumbs to the stars and begin a wild journe...",2021-12-23 08:30:21,2021-12-23 08:30:21
9789579581905,银河英雄传说,https://img9.doubanio.com/view/subject/l/public/s2361994.jpg,[日]田中芳树,,科幻,台湾尖端出版社,銀河中原本三分天下勢均力敵的微妙關係，卻由於帝國內崛起了一位天才的戰略家萊因哈特而逐漸扭曲了這項平衡。率領著三萬艘艦隊踏上了征途的萊因哈特，在這場戰役中遇上了他畢生的宿敵──同盟軍的楊威利。他們在亞斯提星域初逢強敵，並展開了首次的智謀激鬥……一場規模壯大的太空戰記即將展開！,2021-12-23 08:30:28,2021-12-23 08:30:28
9781884214493,The Last Question (When the World Ends),https://img1.doubanio.com/view/subject/l/public/s7011308.jpg,IsaacAsimov,,科幻,ZigguratProductions,,2021-12-23 08:30:34,2021-12-23 08:30:34
9781452118697,Vader's Little Princess,https://img9.doubanio.com/view/subject/l/public/s24432825.jpg,JeffreyBrown,,科幻,ChronicleBooks,"In this irresistibly funny follow-up to the breakout bestseller Darth Vader and Son, Vader—Sith Lord and leader of the Galactic Empire—now faces the trials, joys, and mood swings of raising his daughter Leia as she grows from a sweet little girl into a rebellious teenager. Smart and funny illustrations by artist Jeffrey Brown give classic Star Wars moments a twist by bringing t...",2021-12-23 08:30:41,2021-12-23 08:30:41
9787115286956,星际迷航：联邦星舰进取号完全图解,https://img1.doubanio.com/view/subject/l/public/s11344267.jpg,[美]本·罗宾逊,徐辰,科幻,人民邮电出版社,“宇宙——最后的边疆。这是星舰进取号的旅程，她所肩负的五年任务她所肩负的使命，是去探索陌生的新世界，去寻找新的生命和新的文明，勇敢地航向前人未至之境！”1966年首播，六大系列共726集电视剧和电视动画，1979年首部电影上映，2013年第12部电影即将登上大银幕。这些令人震惊的数字让你想起了什么？这不是脑筋急转弯，甚至不用搜肠刮肚，每一位科幻迷都应该能够直截了当地道出答案——《星际迷航》（Star Trek）。如果这个世上还有一部电视剧可以称得上伟大，那么《星际迷航》系列是当之无愧的，它代表了人类历史上迄今无法超越的科幻巅峰！《星际迷航》已经成为一部历史，人们关心着舰长们的前途，为星舰上的乘员身陷困境而揪心，没有哪部电视剧集能够如此深刻地影响好几代人。当乔治•卢卡斯的绝地武士挥舞着光剑把美国人从越战后的低迷中拯救出来时，更早的《星际迷航》已将...,2021-12-23 08:30:47,2021-12-23 08:30:47
9785214589626,三体全集,https://img1.doubanio.com/view/subject/l/public/s33460607.jpg,刘慈欣,,科幻,读客文化,刘慈欣，祖籍河南，长于山西，中国科普作家协会会员，山西省作家协会会员，高级工程师。自1999年处女作《鲸歌》问世以来，发表短篇科幻小说三十余篇，出版长篇科幻小说七部，并创下连续八年荣获中国科幻最高奖“银河奖”的纪录。其气势恢宏的“地球往事”系列第一部《三体》开创了《科幻世界》月刊连载原创作品之先河，一举成为2006年度最受关注、最畅销的科幻小说。2008年，“地球往事”系列第二部《黑暗森林》面世，再次成为当年最畅销的科幻小说。2010年，“地球往事”系列第三部《死神永生》出版，一举拿下该年度中国科幻“银河奖”特别奖、全球华语科幻“星云奖”最佳长篇奖。刘慈欣亦因此被评论界誉为“21世纪中国文坛最值得关注的作家”。刘慈欣的作品恢弘大气、想象绚丽，既注意极端空灵与厚重现实的结合，也讲求科学的内涵与人文的美感，具有浓郁的中国特色和鲜明的个人风格，为中国科...,2021-12-23 08:30:54,2021-12-23 08:30:54
9787530208939,银河英雄传说VOL.8 乱离篇,https://img2.doubanio.com/view/subject/l/public/s2878111.jpg,[日]田中芳树,蔡美娟,科幻,北京十月文艺出版社,宇宙历八〇○年，新帝国历二年，莱因哈特皇帝拥兵千万，挥军进攻伊谢尔伦，欲与杨威利一决高下，“走廊决战”拉开大幕。杨威利灵活利用走廊狭窄地形，在帝国众多常胜猛将之间周旋，战争异常惨烈……双方都付出惨重的损失之后，莱因哈特终于向杨威利发出停战和谈邀请，杨欣然赴约。蓄谋已久的暗杀者将枪口对准了年仅三十三岁的杨威利……,2021-12-23 08:31:01,2021-12-23 08:31:01
9780756906788,2001 A Space Odyssey,https://img1.doubanio.com/view/subject/l/public/s4845487.jpg,ArthurCharlesClarke,,科幻,PerfectionLearning,2001: A Space Odyssey is the classic science fiction novel that changed the way we looked at the stars and ourselves....2001: A Space Odyssey inspired what is perhaps the greatest science fiction film ever made -- brilliantly imagined by the late Stanley Kubrick....2001 is finally here....,2021-12-23 08:31:07,2021-12-23 08:31:07
9780765319647,Blindsight,https://img9.doubanio.com/view/subject/l/public/s4585355.jpg,PeterWatts,,科幻,TorBooks,"Two months have past since a myriad of alien objects clenched about the Earth, screaming as they burned. The heavens have been silent since--until a derelict space probe hears whispers from a distant comet. Something talks out there: but not to us.Who you do send to meet the alienwhen the alien doesn't want to meet?You send a linguist with multiple personalities carved surgi...",2021-12-23 08:31:15,2021-12-23 08:31:15
9789579581554,銀河英雄傳說,https://img1.doubanio.com/view/subject/l/public/s1367128.jpg,田中芳樹,蔡美娟,科幻,尖端,"「銀河英雄傳說」是以宇宙為舞台的一篇架空幻想歷史故事。當時宇宙存在著兩大勢力，分別是控制銀河聯邦原有疆域的「銀河帝國」，和由逃出帝國的共和主義者建立的「自由行星同盟」。  帝國視同盟為「邊境叛徒的根據地」，同盟則將帝國當作「邪惡的黑暗專制勢力」，彼此水火不容。但是，在兩國領域之間，充滿了不利於宇宙航行的異常重力場， 只有兩個已知安全航道「費沙迴廊」和「伊謝爾倫迴廊」。由於距離的遙遠和交通上的困難，而使得兩國間形成了長達一個半世紀的戰爭狀態。 但是因為兩位劃時代的英雄的誕生, 令局面產生變化, 帝國的天才萊因哈特和同盟有「智將」和「奇蹟楊」之稱的楊威利，兩人交織出一幕幕扣人心弦的真實歷史場面。",2021-12-23 08:31:27,2021-12-23 08:31:27
9789867576798,第二基地,https://img2.doubanio.com/view/subject/l/public/s11176152.jpg,[美]以撒．艾西莫夫,葉李華,科幻,奇幻基地,,2021-12-23 08:31:34,2021-12-23 08:31:34
9780765377104,Death's End,https://img2.doubanio.com/view/subject/l/public/s29136583.jpg,CixinLiu,KenLiu,科幻,TorBooks,"With The Three-Body Problem, English-speaking readers got their first chance to experience the multiple-award-winning and bestselling Three-Body Trilogy by China's most beloved science fiction author, Cixin Liu. Three-Body was released to great acclaim including coverage in The New York Times and The Wall Street Journal. It was also named a finalist for the Nebula Award, making...",2021-12-23 08:31:53,2021-12-23 08:31:53
9789571003634,2001夜物語(01),https://img1.doubanio.com/view/subject/l/public/s3221158.jpg,星野之宣,許嘉祥,科幻,尖端,這是一部超越時空、SF漫畫的上乘之作，也是星野之宣的代表作之一。作者以經典級科幻片《2001年太空漫遊》為藍本，用史詩式、流暢的筆觸來描繪，闡述人類開拓宇宙新天地的意念。對於在新天地的人類，其思想、精神及心靈的淨化都有一種新的註解。星野之宣的作品預言的味道十分濃厚，在科幻的結構下，常常引出令人深思的劇情，除了表達對人的關懷外，也表現出對自然的崇敬。在人類不斷開發創造的同時，事實上也不斷地毀滅抹殺。而最終，當人自己以旁觀者的角度去探討的時候，卻發現自己製造的似乎好像都是悲劇，而最可悲的，是自己還無法從中認清，而陷入不斷的輪迴中，著實發人深省。,2021-12-23 08:31:59,2021-12-23 08:31:59
9787532412792,365夜科幻故事（上、下册）,https://img1.doubanio.com/view/subject/l/public/s4011568.jpg,饶忠华主编,,科幻,少年儿童出版社,,2021-12-23 08:32:06,2021-12-23 08:32:06
9789573429296,銃夢08,https://img2.doubanio.com/view/subject/l/public/s3151271.jpg,[日本]木城幸人,,科幻,東立,,2021-12-23 08:32:12,2021-12-23 08:32:12
9787530208625,银河英雄传说VOL.5 风云篇,https://img1.doubanio.com/view/subject/l/public/s2402289.jpg,[日]田中芳树,陈惠莉,科幻,北京十月文艺出版社,宇宙历七九九年、帝国历四九○年，征服费沙之后，莱因哈特拉开统一整个宇宙的大幕——大军直指自由行星同盟。杨威利为了灵活运用要塞驻军的战力，毅然主动放弃伊谢尔伦，并欲与莱因哈特在无边的宇宙中一决雌雄。杨威利以其神出鬼没的游击战法，连败银河帝国诸位猛将，逼使莱因哈特御驾亲征，并决意将巴米利恩星系定为决战之地。面对杨舰队势如破竹的攻势，自身积劳成疾而间歇性发作，年轻的霸者——莱因哈特遇到空前的危机……三国仅余两国，《银英》两大主角，第一次殊死搏斗，故事进入高潮……,2021-12-23 08:32:19,2021-12-23 08:32:19
9787539983301,银河帝国3 ：第二基地,https://img1.doubanio.com/view/subject/l/public/s28283777.jpg,[美]艾萨克·阿西莫夫,叶李华,科幻,江苏凤凰文艺出版社,人类蜗居在银河系的一个小角落——太阳系，在围绕太阳旋转的第三颗行星上，生活了十多万年之久。人类在这个小小的行星（他们称之为“地球”）上，建立了两百多个不同的行政区域（他们称之为“国家”），直到地球上诞生了第一个会思考的机器人。在机器人的帮助下，人类迅速掌握了改造外星球的技术，开启了恢弘的星际殖民运动；人类在银河系如蝗虫般繁衍扩张，带着他们永不磨灭的愚昧与智慧、贪婪与良知，登上了一个个荒凉的星球，并将银河系卷入漫长的星际战国时代，直至整个银河被统一，一个统治超过2500万个住人行星、疆域横跨十万光年、总计数兆亿人口的庞大帝国崛起——银河帝国。一个微妙的转折发生在银河帝国建国后的12020年。哈里·谢顿，这个刚满32岁的年轻数学家，开创了“心理史学”，这门学科能用数学公式准确推演全人类的未来——“预言”从此成为一门可以信任的科学，人类由此可以看见未...,2021-12-23 08:32:26,2021-12-23 08:32:26
9784107718747,少女終末旅行 3,https://img1.doubanio.com/view/subject/l/public/s29144428.jpg,つくみず,,科幻,新潮社,今日も今日とて終末世界で旅を続けるチトとユーリ。廃墟をさまよいながら、ふたりはさまざまな体験や発見を重ねていく。そして、さらなる上層では驚くべき出会いが……!,2021-12-23 08:32:32,2021-12-23 08:32:32
9787533964566,机器人大师,https://img9.doubanio.com/view/subject/l/public/s33857176.jpg,[波兰]斯塔尼斯瓦夫·莱姆,毛蕊,科幻,浙江文艺出版社,“我们所追求的完美是我们的桎梏，因为不可预知性总会伴随着我们创造出的每一样东西！”他们是伟大的发明家，从人格交换机到末世论改造机，无所不造。他们不仅要一起面对宇宙中无解的难题，还要为谁是更强的发明家争得你死我活。他们是特鲁勒和克拉帕乌丘斯，别称：机器人大师。◆波兰科幻名家高口碑代表作，新装上市。◆莱姆100年诞辰纪念版，入选波兰2021莱姆年100大海外版本。◆20个天马行空的脑洞故事，怪诞、幽默、辛辣、讽刺，《银河系搭车客指南》《瑞克和莫蒂》《飞出个未来》精神先驱。◆信息量超载的机器人版《一千零一夜》，融入伏尔泰式的巧思洞见，恣意徜徉于科学、文学和哲学之间。◆波兰原版完整引进，全译本无删节，新增5个故事。◆上外波兰语专业负责人历时2年翻译，182条注释深入剖析莱姆的文字游戏。◆收录波兰艺术家达尼埃尔·姆鲁兹绘制的25幅插画。◆...,2021-12-23 08:32:39,2021-12-23 08:32:39
9780330491198,The Hitch Hiker's Guide to the Galaxy,https://img1.doubanio.com/view/subject/l/public/s1830257.jpg,DouglasAdams,,科幻,Picador,"Seconds before the Earth is demolished to make way for a galactic freeway, Arthur Dent is plucked off the planet by his friend Ford Prefect, a researcher for the revised edition of The Hitch Hiker's Guide to the Galaxy who, for the last fifteen years, has been posing as an out of work actor. Together this dynamic pair begin their journey through space aided by quotes from The H...",2021-12-23 08:32:47,2021-12-23 08:32:47
9780345391810,The Restaurant at the End of the Universe,https://img2.doubanio.com/view/subject/l/public/s4750912.jpg,DouglasAdams,,科幻,BallantineBooks,"""DOUGLAS ADAMS IS A TERRIFIC SATIRIST.""--The Washington Post Book WorldFacing annihilation at the hands of the warlike Vogons is a curious time to have a craving for tea. It could only happen to the cosmically displaced Arthur Dent and his curious comrades in arms as they hurtle across space powered by pure improbability--and desperately in search of a place to eat.Among Art...",2021-12-23 08:32:55,2021-12-23 08:32:55
9780553283686,Hyperion,https://img1.doubanio.com/view/subject/l/public/s4249529.jpg,DanSimmons,,科幻,Spectra,"The winner of a 1990 Hugo Award follows seven pilgrims on a  voyage to the world of Hyperion--dominated by the all-powerful  creature, the Shrike--where they hope to learn the secret that will  save humanity. Reissue.",2021-12-23 08:33:03,2021-12-23 08:33:03
9787535807120,阿西莫夫科幻小说,https://img1.doubanio.com/view/subject/l/public/s3024327.jpg,[美]艾萨克·阿西莫夫,施咸荣,科幻,湖南少年儿童出版社,收选了阿西莫夫的长、中、短篇科幻小说三种：《天上的小石子》、《响铃》、《钢城》。,2021-12-23 08:33:09,2021-12-23 08:33:09
9787115294135,星球大战：千年隼号完全图解,https://img3.doubanio.com/view/subject/l/public/s25102880.jpg,[美]R.温德姆,徐辰,科幻,人民邮电出版社,2011年11月，美国海恩斯出版社发行了《千年隼号完全图解》一书。这本书的主要内容是千年隼号的经历（包括电影与衍生宇宙的内容，到《绝地归来》为止）、各部分技术解析以及与该船有关的著名人物介绍。但也有一定的篇幅介绍其制造商科雷利亚工程集团的历史以及从YG飞船到YT系列轻型货船的历史传承。和海恩斯过去出版的各类交通工具、武器等图解一样，主要以剖视图、线图和彩图对文字进行辅助，正文以外还穿插不少小花絮如主回廊地板下秘密隔间的防护措施、各级超空间引擎分类原理等。文字作者莱得•温德姆曾供职于黑马漫画，担任星球大战和印第安纳琼斯系列书籍的编辑，自己也为官方撰写星球大战小说，他的星战相关著作总数超过50本。在一次访谈中被问及是否很熟悉海恩斯出版的这个技术指南系列（特别是科幻作品相关的）时，他答道：“多年前我曾有一辆名爵MGB跑车，我买的第一本海恩斯技术指南正是关...,2021-12-23 08:33:16,2021-12-23 08:33:16
