9787542845375,混沌七鉴,https://img3.doubanio.com/view/subject/l/public/s6632200.jpg,(美)约翰·布里格斯//(英)F·戴维·皮特|译者,"出版社:</span>上海科技教育出版社<br/><spanclass=""pl"">出版年:</span>2008-4<br/><spanclass=""pl"">页数:</span>170<br/><spanclass=""pl"">定价:</span>21.00元<br/><spanclass=""pl"">丛书:</span> <ahref=""https://book.douban.com/series/3658"">世纪人文系列丛书·开放人文",科学,上海科技教育出版社,《混沌七鉴:来自易学的永恒智慧》主要内容：人们自古以来就与混沌打交道，直至最近，科学才认识到它为宇宙中的根本力。混沌理论，最初用于理解产生暴风雨、洪水和飓风的运动，如今正被运用于从医学、战争到组织如何形成、变化的社会动力学和理论。混沌正从一个科学理论演变成文化隐喻。作为一个隐喻，它促使我们提出关于实在的新鲜问题。我们现代社会沉迷于征服和科学上驾驭我们周围的世界。然而，非线性混沌系统（如自然、社会和个人生活）皆处在企图预言、操纵和控制它们之外。混沌表明，我们与其抗拒生命的不确定性，不如接受它们提供的诸多可能性。在这本振聋发聩的新著中，作者阐释了接受日常生活中混沌的七条鉴识：1．创造；2．运用蝴蝶力量；3．行云流水；4．上下求索；5．观世术；6．在时间内生活；7．回归整体。假如你一度感到生活失控、趋于混沌，科学有一条重要忠告：生活即混沌，那才是激动人...,2021-12-21 18:47:49,2021-12-21 18:47:49
9787544353472,魔鬼出没的世界,https://img2.doubanio.com/view/subject/l/public/s28107493.jpg,[美]卡尔·萨根,李大光,科学,海南出版社,"与其咒骂魔鬼的黑暗,不如点亮一支科学的蜡烛。祝愿我们的世界摆脱恶魔的纠缠,充满阳光。“魔鬼”（Demon）一词在希腊文中的意思是“知识”（Knowledge），犹指物质世界的知识。后来在社会的发展历程中，人类在追求知识的旅途里产生了迷惘，恐惧和无知使人类走向了自我催眠、邪恶的巫术和鬼神崇拜，“知识”不幸转化成了“魔鬼”，从此以后人类的历史都不能摆脱“魔鬼”的缠绕。在神灵主义泛滥的时代，我们就遇到神灵；当古老的神话对人们失去了吸引力，我们就开始认为外星生物是有道理的。然后靠催眠术产生幻觉的趋势就出现了……卡尔•萨根博士的著作《魔鬼出没的世界——科学，照亮黑暗的蜡烛》是他临终前的最后一部作品。当年便创下最佳畅销书第一名的记录。应该说，这是萨根诸多作品中比较全面地反映其思想的一部作品。卡尔•萨根以广博的知识，犀利的思想，入木三分的揭露，鞭辟入里的分析...",2021-12-21 18:47:57,2021-12-21 18:47:57
9787535732736,时间、空间和万物,https://img3.doubanio.com/view/subject/l/public/s9133900.jpg,B・K・里德雷,李泳,科学,湖南科技出版社,物理学有好多奇妙而令人疑惑的思想，可异它们都被锁在小盒子里，只有极少数的人拿着钥匙。作者用简单、没有数学的语言告诉我们，关于宇宙的基本结构、物理学会说些什么。他讲了现代物理学的所有基本概念，如基本粒子、黑洞、引力、量子论、时间、质量、相对论和能量还包括了一些近年涌现的概念，如弦、虚时间和混沌。他清晰而睿智的描述，将一般读者引向激动人心的世界，也为科学家们展望了科学的未来。,2021-12-21 18:48:04,2021-12-21 18:48:04
9787535739636,典雅的几何,https://img2.doubanio.com/view/subject/l/public/s9084683.jpg,M·伦迪,张菽,科学,湖南科学技术出版社,在《典雅的几何》里，罗列了二维几何的元素，也就是数在平面上的呈现；《典雅的几何》所属系列中的另一本书讲的则是三维几何的故事。的确，每当有人提到形而上学时，总会提到这些内容，而几何就像音乐一样，是“真实”的影子，既明亮又清晰的影子。,2021-12-21 18:48:11,2021-12-21 18:48:11
9787542827296,天遇,https://img9.doubanio.com/view/subject/l/public/s2020416.jpg,[罗]弗洛林·迪亚库,王兰宇,科学,上海科技教育出版社,作者写作这本书有两个目的。一是希望通过叙述天体力学和动力系统理论的历史发展，来重建人们所处的社会和智力环境；二是力图从较深层次说明那些先驱们留给我们的数学思想与方法，以及我们在此基础上做出的贡献（相比而言是很少的）。这本书适用于听说混沌并想比较深入了解它的起源、理论和创立者的读者。尽管混沌具有越来越通俗的表现形式，但它本质上是一门数学理论。,2021-12-21 18:48:17,2021-12-21 18:48:17
9780646313955,Thiaoouba Prophecy,https://img9.doubanio.com/view/subject/l/public/s3130174.jpg,MichelDesmarquet,,科学,ArafuraPublishing,法国人米谢的外星十日游，揭示地球史前文明、因果报应、生命轮回、基督来历、黄种人起源、宇宙旅行等。,2021-12-21 18:48:24,2021-12-21 18:48:24
9787200058314,天道与人文,https://img9.doubanio.com/view/subject/l/public/s1439805.jpg,竺可桢,,科学,北京出版社,《天道与人文》作者竺可桢是20世纪中国最伟大的科学家之一，中国近代地理学和气象学的奠基人，一位卓越的大学教育家，《天道与人文》所收文章，主要依据《竺可桢文集》，部分依据《竺可桢文录》《竺可桢科普创作选集》《物候学》《看风云舒卷》等书，多数是竺可桢长篇大论中与文史知识相关的精彩节选。,2021-12-21 18:48:31,2021-12-21 18:48:31
9787040158182,费曼传,https://img2.doubanio.com/view/subject/l/public/s1072012.jpg,（美）詹姆斯・格雷克,黄小玲,科学,高等教育出版社,这是三本内容和风格极为不同的书。《混沌》是一部几乎同步紧跟科学发展的大型报告文学。混沌现象的研究是20世纪非线性科学进展的重要方面，他在20世纪70年代中期兴起，而在20世纪80年代达到高潮。格雷克作为科学记者，采访了许多位工作在混沌研究前沿的学者，既描写了这些人的喜怒哀乐呵成长经历，也介绍了他们的科学贡献。这本书对于理解混沌现象所涉及的一些基本概念，以及混沌研究对当代科学发展的影响，都有相当好的描述。,2021-12-21 18:48:38,2021-12-21 18:48:38
9787550257610,迷人的材料,https://img1.doubanio.com/view/subject/l/public/s28277258.jpg,马克·米奥多尼克,赖盈满,科学,未读·探索家·北京联合出版公司,从茶杯、喷气发动机到家用电器、内裤，我们的生活充满了材料。但你想过没有，为什么玻璃是透明的？是什么让橡皮筋有弹性？为什么曲别针会弯曲？为什么不锈钢不生锈？水泥也能做成衣服？世界上最薄却最坚硬的东西是什么？为什么某一种材料做成的东西会长那样？材料如何塑造了我们的世界又对我们的生活产生了怎样的影响？世界顶级材料学大师带你用材料科学家的眼睛，以全新的方式看待你身边的每一样东西：钢、纸、混凝土、巧克力、塑料、玻璃、瓷器……本书以渊博的知识和极富感染力的文字写就。它不仅揭露了各种物质背后的神奇结构，还告诉我们隐藏在其背后的精采故事。每一章介绍一种材料，辅以照片和手绘图，极富可读性和趣味性。,2021-12-21 18:48:45,2021-12-21 18:48:45
9781101946596,Life 3.0,https://img1.doubanio.com/view/subject/l/public/s29593057.jpg,MaxTegmark,,科学,Knopf,"How will Artificial Intelligence affect crime, war, justice, jobs, society and our very sense of being human? The rise of AI has the potential to transform our future more than any other technology—and there’s nobody better qualified or situated to explore that future than Max Tegmark, an MIT professor who’s helped mainstream research on how to keep AI beneficial.How can we gr...",2021-12-21 18:48:52,2021-12-21 18:48:52
9787542839886,天地有大美,https://img9.doubanio.com/view/subject/l/public/s5655685.jpg,(英)格雷厄姆·法米罗,涂泓,科学,上海科技教育出版社,貌似神秘的一个个方程，是当代许多杰出科科学理论的核心部分。但这些方程难以理解的形式常常会成为一道障碍，使我们无法理解其奥义。它们从哪里来？能做什么？它们在当代文化中又有什么样的重要性？本书集合维尔切克、温伯格、彭罗斯、加利森、罗伯特·梅等世界上一些领衔的科学家和科学史家，向读者揭示了当代最杰出的科学理论中11个伟大方程；通过他们通俗、严谨的解释，读者心悦诚服、眼界大开，领略到这些使人望而却步方程的科学精义，及其本身展现的力量和优美。 科学在我们的文化中具有非凡的影响。许多最为杰出成功的科学理论，其核心部分就是方程。但是，对于我们中的许多人来说，这些方程是一本合上了的书。它们那些难以理解的形式常常会成为一道障碍，使我们无法理解它们的意义，它们甚至开始成为现代科学之神秘和恐怖的体现。《天地有大美》一书纠正了这一点，它为不精通数学的读者介绍了现代科学...,2021-12-21 18:49:00,2021-12-21 18:49:00
9787560079776,量子世界,https://img1.doubanio.com/view/subject/l/public/s24398479.jpg,肯尼斯·W.福特,王菲,科学,外语教学与研究出版社,王菲，男，美国德克萨斯大学(Austin)博士后，北京理工大学物理系副教授。研究方向原子与分子物理。主持和参与多项国家自然科学基金及教育部博士点基金项目，曾获北京市优秀青年科技论文奖励，并于2008年荣获教育部霍英东优秀青年教师奖。,2021-12-21 18:49:07,2021-12-21 18:49:07
9787508626277,蚕丝：钱学森传,https://img2.doubanio.com/view/subject/l/public/s6309711.jpg,[美国]张纯如,鲁伊,科学,中信出版社,作者张纯如历时三年，向美国国家档案局、美国国防部等相关单位搜集了大量的历史绝密资料，查阅了相关的大学的档案、公开出版物和学术杂志中的大量文献记录，并实地访问上百位钱学森的同事、师长、学生、邻居、朋友以及他的儿子钱永刚，采用洗炼而故事性的笔法撰写而成，译文流畅，可读性强，给我们讲述了这位最严谨、最具科学精神的天才如史诗般传奇的一生。1949年，钱学森向美国提交了加入美国国籍的申请，他当时是处于怎样的考虑做出这一决定的？ 在他旅居美国的20年中，他是否效忠于美国？是什么原因促使他在1950年突然决定返回中国？美国如何会怀疑他是间谍？钱学森归国经历了怎样的曲折历程？自从钱学森1955年回到中国，就再也没有踏进美国一步。他对美国的真实感情是怎样的？本书还叙述了钱学森的爱情。钱学森和蒋英两人相濡以沫走过了大半生，当初经历了怎样的恋爱过程?可以说本书不仅仅是...,2021-12-21 18:49:20,2021-12-21 18:49:20
9787532389414,宇宙的最后三分钟,https://img1.doubanio.com/view/subject/l/public/s2829189.jpg,戴维斯,傅承启,科学,上海科学技术,《宇宙的最后三分钟》根据一些著名物理学家和宇宙学家的最新研究成果，对以上问题进行了描述。随着大爆炸理论逐渐被大众和科学界所充分接受，人们越来越注重宇宙未来的研究。我们现在已有了宇宙如何诞生的很好的概念，但宇宙将如何结束呢?它最终的命运又将如何呢?宇宙是否会以爆炸或抽搐的形式终其一生，或甚至永久消失?那时，人类又将如何人类或其后裔，无论是机器人还是人类自己，能否幸免于难而永复存在。,2021-12-21 18:49:28,2021-12-21 18:49:28
9787508645957,盲眼钟表匠,https://img9.doubanio.com/view/subject/l/public/s27320894.jpg,[英]理查德·道金斯,王道还,科学,中信出版社,这是英国著名生物学家、《自私的基因》的作者道金斯又一本经典之作。本书是正宗的演化论入门书，是我们认识自己，认识生命本身的绝佳读本。作者道金斯在《自私的基因》之后，以“生物适应的起源”为核心，用稳健的文笔，详细阐释了生物适应是任何演化理论家不可回避的问题，而天择说是唯一可信的理论。一些学者提出了足以替代天择说的理论，或者认为天择说无足轻重，都过不了解释生物适应这一关。突变和自然选择是道金斯解释生命变化的两个基本概念。无论是对演化论有兴趣的朋友，还是持批判观点的人，本书都是最好的起点。本书是英语世界最流行的演化论教科书，曾获英国皇家文学学会非小说类最佳书奖、美国洛杉矶时报的文学奖。译者王道还先生说：“要是你一辈子只想读一本有关演化的书，就读这一本！”“钟表”是“世界运行模式”的隐喻，象征自然运行的机制是环环相扣、一丝不苟的。“钟表匠”本来是“创世主”。...,2021-12-21 18:49:36,2021-12-21 18:49:36
9787108034090,阿司匹林传奇,https://img2.doubanio.com/view/subject/l/public/s24932733.jpg,(英)杰弗里斯,暴永宁,科学,生活·读书·新知三联书店,1862年1月20日，美国人埃德温·史密斯获得了两卷古埃及的纸草书，其中提到的一味药——柳树，作为药物的关键成分就是后来被称为灵药的阿司匹林。本书就是从数千年前的药方开始的。英国的爱德华·斯通牧师1763年4月给皇家学会的会长写了一封信，报告他用柳粉治病的情况。到了19世纪初，研究柳树皮重新受到重视，多位化学家提炼出了其中的有效成分和提炼的方法，犹如一幅拼图中的各个部分，分别被不同的人造出来，最后终于形成了阿司匹林的完整图画——在拜尔公司，化学家们注意到柳苷、水杨酸、水杨酸钠的治疗效果，但对胃的伤害很大，于是他们着手研制一种不会“烧心”的药物，于是产生了“乙酰水杨酸”，为了便于商业推广，他们选用了“乙酰”的第一个字母a和绣线菊的前几个字母spir，再加上后缀in，组成了aspirin。1899年7月，划时代的阿司匹林头产了。然而，故事到这里并没有结束...,2021-12-21 18:49:46,2021-12-21 18:49:46
9787210097907,我们为什么不说话,https://img1.doubanio.com/view/subject/l/public/s29657358.jpg,[美]坦普尔·葛兰汀（TempleGrandin）,马百亮,科学,江西人民出版社,聊天是人们增进了解的常用方法，但假如是面对一只不会说话的动物呢？如何知道它的小脑袋里在想些什么？坦普尔·葛兰汀，美国科罗拉多州立大学动物科学教授，被业内称为能翻译动物语言的人，专业研究动物三十年心力之作。书中有新奇好玩的前沿科学试验，如让鸽子学会分辨毕加索和莫奈的画作；也有贴近生活的实用技巧，如家庭挑选合宠物狗、训练猫咪指南。全书由表及里地阐释了动物行为背后隐藏的情感、思维及非凡的才能。,2021-12-21 18:49:54,2021-12-21 18:49:54
9787546394268,身体密码,https://img9.doubanio.com/view/subject/l/public/s24407315.jpg,野口哲典,张佩珊,科学,吉林出版集团,本书以提供这样的话题为契机，在全面、完整地传达正确的性知识的基础上，解答广大读者所关心的各种问题。本书在讲授男女基础生理知识的同时，围绕性交和性，从心理学以及进化论的角度，向大家详细讲述人类是如何进化出男女的，以及我们中间为什么会出现美女和美男子。,2021-12-21 18:50:01,2021-12-21 18:50:01
9787513333450,睡莲的方程式,https://img2.doubanio.com/view/subject/l/public/s33507423.jpg,[法]阿尔贝·雅卡尔,姜海佳,科学,新星出版社,在湖里种一株睡莲，它每天增长一倍，30天后会占满湖面。问几天后能盖住一半湖面？第29天。这是显而易见的事实，但在现实生活中，人们却很容易掉进指数增长的陷阱。雅卡尔喜欢去学校与孩子交流，他发现教育中也存在诸多类似的盲区。他用科学的角度，破除学校中、社会上流行日久的偏见，例如成绩背后是怎样的价值观？知识的意义究竟在于实际应用还是形成观念？知识和理解能力是不是一回事？还有种族与种族主义、智力与智商、个人命运与遗传命运……雅卡尔提供了一份知识融合的模板，并启发读者重新审视知识、科学和教育的意义——科学应该帮助人们利用切实的论据推翻普遍的成见，不断认知复杂的世界和自我；教育不是为孩子进入社会做准备，而应帮助他们在与人交流的过程中成为自己，并建设一个新社会。知识的功用在于看到现实的更多侧面，它为人类提供了自由的可能。,2021-12-21 18:50:09,2021-12-21 18:50:09
9787508665030,量子大唠嗑,https://img1.doubanio.com/view/subject/l/public/s29091409.jpg,马兆远,,科学,中信出版集团,师从超冷原子物理理论之父Keith Burnett，25岁牛津大学博士毕业；美国国家标准局读博士后，师从量子调控实验之父William Phillips（1997年诺贝尔奖获得者）；伯克利研究助理，芝加哥大学访问教授，30岁入选中国科学院百人计划，研究员、正教授博导，作为首席科学家，为中国空间站天宫四号设计了世界第一个空间冷原子量子实验平台。名门正派打下扎实的物理学的底子；科学家的身份，为功成名就铺了道路。可是，就是在学术生涯势头正劲的时候，就在量子科学成为流行名词的时候，《量子大唠嗑》的作者——35岁的马兆远做了圈子的出走者。凭着科学的初心，以物理学以实验为核心的体验主义精神，他卷起袖子做了实业，希望去做一场科学研究与产业创新联系的实验。《量子大唠嗑》可以算做实验过程中的一些心得笔记。科学是认识世界的方法之一，但它是那个比较靠谱的《量子大唠嗑》...,2021-12-21 18:50:16,2021-12-21 18:50:16
9787229090111,心灵的未来,https://img1.doubanio.com/view/subject/l/public/s28011578.jpg,[美国]加来道雄,伍义生,科学,重庆出版社,加来道雄，纽约城市大学理论物理学教授，超弦理论的创始人之一，撰写多部饱受好评的科学著作，包括《穿越超时空》、《超越爱因斯坦》、《电影中不可能的物理学》和《未来物理学》。加来道雄以优异成绩毕业于哈佛大学，在加州大学伯克利分校取得博士学位，曾担任纽约大学和普利斯顿高级研究院客座教授。他主持过多档电视科普特别节目，许多节目紧贴他的著作，包括英国广播公司电视节目《时间和未来的图景》以及科学发现频道的《2057》，《科学幻想》和《未来图景》。他还主持一档周播科普广播节目，听众可以在130个无线电台以及Sirius XM卫星电台进行收听。他的文章曾刊载于《华尔街日报》、《新闻周刊》、《时代》、《科学美国人》、《发现杂志》、《天文学杂志》、《连线杂志》、《新科学家》和《波士顿环球报》。他参加过《早安美国》、《今日》、《夜线》、CNN、《福克斯新闻》、《大卫•莱特曼...,2021-12-21 18:50:24,2021-12-21 18:50:24
9787557677398,手术刀下的历史,https://img2.doubanio.com/view/subject/l/public/s33652692.jpg,[荷]阿诺德·范德拉尔,李命心,科学,天津科学技术出版社,自从人类行走在地球上，外科学就自然而然地发展起来。从兼职处理创伤的理发店到设备先进的现代手术室，从没有麻醉的截肢手术到无痛的微创手术，从美国总统肯尼迪的枪伤到大科学家爱因斯坦的动脉瘤，荷兰外科医师阿诺德·范德拉尔利用自己的专业知识和经验，为我们讲述改变了医疗史也改变了世界的27个手术故事。在这些名人“献身”的手术案例和作者充满趣味的描述中，一段跨越千年的历史被串连起来，我们得以再探医学发展的艰难历程、了解当下前沿的医疗成果、想象未来医学的无限可能。来自荷兰的外科医生阿诺德·范德拉尔，一手持刀，一手提笔，为我们讲述手术刀下的历史：★30余位名人“献身”，以伤病为鉴，为你剖析医学知识：爱因斯坦的主动脉瘤没有破裂，竟多亏一张玻璃纸；魔术大师、逃脱艺术家哈里·胡迪尼，却难逃阑尾炎的“魔爪”；射向美国总统肯尼迪的三颗子弹，哪颗才真正致命？★27个经典手术...,2021-12-21 18:50:30,2021-12-21 18:50:30
9787206030093,魔鬼出没的世界,https://img1.doubanio.com/view/subject/l/public/s27069249.jpg,[美]卡尔·萨根,李大光,科学,吉林人民出版社,精神世界是丰富多彩的，但是精神世界的源泉是什么？萨根在书中写道：“当科学与大自然相遇时，科学就必然会使人产生对大自然的敬畏的感觉。对大自然的真正的理解的行为是与自然的结合和融合的欢庆，即使是在很小程度上的结合也能使人感受到宇宙的宏伟和壮观。随着时间的流逝而积累起来的世界 范围内的知识体系使科学变成了跨国界、跨时代的超越所有界限的理智的东西。‘精神’一词是从拉丁文‘呼吸’变化而来的。我们呼吸的是空气，无论它多么稀薄，但毫无疑问它是物质.....”卡尔·萨根博士是美国康奈尔大学的天文学教授。同时他又是世界著名的科普作家。他对科学的精辟见解使他成为“唯一能够用简单扼要的语言说明科学是什么”的科学家。他成为本世纪最有影响的人物。《魔鬼出没的世界——科学，照亮黑暗的蜡烛》是他临终前的最后一部作品。当年便创下最佳畅销书第一名的记录。,2021-12-21 18:50:39,2021-12-21 18:50:39
9787542818614,确定性的终结,https://img1.doubanio.com/view/subject/l/public/s24431898.jpg,伊利亚·普利高津,湛敏,科学,上海科技教育出版社,时间，我们存在的基本维度，令艺术家、哲学家和科学家为之陶醉。如今，普利高津在他的新著《确定性的终结》中，向广大读者呈现他与自然之经典描述的彻底决裂。在本书中，他通过考察西方的时间观，引导我们经历一种奇妙的智力探险－－从古希腊出发，经过牛顿轨道和确定性混沌，到达量子理论与“免费午餐”宇宙学统一表述的高度。这本分水岭式著作表明，确定性的终结是科学与文化之自然法则全新的诞生。,2021-12-21 18:50:46,2021-12-21 18:50:46
9787535742698,四维旅行,https://img2.doubanio.com/view/subject/l/public/s1395572.jpg,[英]R.L.普瓦德万,胡凯衡,科学,湖南科学技术出版社,《四维旅行》以清晰、睿智的语言，激发我们倘徉在那众多的疑惑和悖论中间：时间与空间是我们经验的最基本特征，也是我们经历的最大困惑。时间有起点吗？宇宙之外还有空间吗？当万物停止了运动，时间还会继续吗？空间能空空如也地存在吗？时间旅行可能吗？时间可以倒流吗？空间存在第四维吗？作者从科学、历史和文学中找来大量的实例，让我们深切感受了寻常的时空观念引发的疑难，鼓励我们为了自己去思考那些问题。,2021-12-21 18:50:53,2021-12-21 18:50:53
9787542629456,当彩色的声音尝起来是甜的,https://img3.doubanio.com/view/subject/l/public/s3526170.jpg,科学松鼠会,,科学,上海三联书店,本书不是一本博客集，出自松鼠会网站的文章只占了1/3。全书54篇文章，精选自百位松鼠近三年创作的上千篇文章，从口腔溃疡到国际空间站，从玫瑰花到数学思想实验，内容天马行空，文字灵动活泼，一改传统科普的严肃面孔。梁文道称赞说“他们的科普小品简直有点像是带甜的凉茶”；罗永浩说，“为了跟愚昧和迷信争夺市场，科普作品在应有的理性和严谨之外，最好还能做到生动有趣，‘科学松鼠会’显然就做到了这一点。他们的科普文章大多数情况下都很有趣，有时候甚至很酷”。作者30人，其中17人为理工科博士或博士生，连文中的插图也出自理科博士之手。,2021-12-21 18:51:06,2021-12-21 18:51:06
9787115404800,引力是什么,https://img1.doubanio.com/view/subject/l/public/s28339519.jpg,（日）大栗博司,逸　宁,科学,人民邮电出版社,引力是宇宙中处于支配地位的力，与天体、生命的诞生息息相关，迷影重重的引力也是解开宇宙谜题的关键钥匙。经过牛顿、爱因斯坦，引力研究正迎来第三个黄金时期。本书以新颖有趣的形式讲解了从牛顿、爱因斯坦到前沿物理的研究内容，用全新的方式解读相对论、量子理论、超弦理论。真正让你理解引力、引力波、E=mc2 、黑洞等概念的含义与意义，也能让你体验到追寻宇宙深层谜题的冒险快感。,2021-12-21 18:51:13,2021-12-21 18:51:13
