9787539194851,蚂蚁革命,https://img9.doubanio.com/view/subject/l/public/s27301696.jpg,(法)贝尔纳·韦伯,胡纾,科幻,二十一世纪出版社,《蚂蚁帝国》三部曲分别是《蚂蚁帝国》《蚂蚁时代》《蚂蚁革命》，讲述在漫长的蚂蚁族群战争中，褐蚁联邦意欲成为蚂蚁世界乃至整个地球的霸主与人类世界之间进行的血雨腥风、惊心动魄的故事。蚂蚁这种老幼皆知且无人重视的微小昆虫，在本书中被塑造成地球上两大社会文明之一，并与人类社会文明相提并论。小说从地球生态平衡的高度，描写了人类和蚂蚁这两大社会文明在确定谁是地球真正主人的竞争中，从接触、冲突到合作的史诗般的过程，同时首次向人们彻底揭示了蚂蚁社会文明既神秘迷人又惊心动魄的“地球内部世界”。作者依据精深的蚂蚁生态学知识，采用拟人化的手法，将读者带入了一个宏伟壮观、不可思议的蚂蚁帝国……《蚂蚁革命》简介：经历千百年来的互不了解和对抗，两大社会中的精英分子终于认识到人类与蚂蚁在地球上的共同命运。于是，地球上的人类社会和地球内部的蚂蚁世界先后爆发了声势浩大的“蚂蚁革命”...,2021-12-23 10:03:37,2021-12-23 10:03:37
9787535687951,动物帝国,https://img9.doubanio.com/view/subject/l/public/s33535184.jpg,[法]恩基·比拉,王秀慧,科幻,后浪丨湖南美术出版社,在世界螺旋状崩坍的边缘聆听雪落的声音一首《荒原》式的图像长诗一部冷峻而温柔的末世启示录重量级法漫作者恩基·比拉沉寂十年之作,2021-12-23 10:03:44,2021-12-23 10:03:44
9787535458650,六道众生,https://img2.doubanio.com/view/subject/l/public/s24225882.jpg,何夕,,科幻,长江文艺出版社,《中国本土科幻经典•六道众生:何夕科幻自选集(纪念珍藏版)》介绍了“当年佛陀把欲世界分成包括地狱道，饿鬼道，畜牲道，阿修罗道，人道，天道在内的六道，它们在业力的果报下永无止境地流转轮回。”他稍停一下，语气变得像是宣判，“此所谓六道众生。”,2021-12-23 10:03:50,2021-12-23 10:03:50
9787513312356,撒旦之锤,https://img1.doubanio.com/view/subject/l/public/s27125847.jpg,(美)拉里·尼文,曲雯雯,科幻,新星出版社,号外 彗星来袭 全球吃紧！彗星为锤地做砧 敲打无数乱离人史上最畅销的天文灾难小说带你体味末日的每一个细节,2021-12-23 10:03:57,2021-12-23 10:03:57
9787559619204,没有名字的人2,https://img2.doubanio.com/view/subject/l/public/s32266343.jpg,FOXFOXBEE,,科幻,北京联合出版公司,和舒月一起抵达美国的汪旺旺，本该在一所小镇高中重新开始平静的生活，却阴差阳错加入了“研究特异功能”的奇葩社团，并因此结识总想成为超级英雄的“大傻子”迪克·庞德、电脑怪咖达尔文·陈、腼腆学霸沙耶加、患有自闭症的贫民窟女孩美年达。从水火不容到互相了解，五人慢慢打破了种族和国 籍的鸿沟成为了好朋友。在一次社团“科考活动”中，几人跟随美年达的脚步意外发现了一片神秘的地下海域，美年达身上更是怪事频发。汪旺旺逐渐发现，这个在学校里因为智力低下被排挤的印第安女孩竟然掌握了一套复杂的运算程式——她能够推算未来！谜团愈来愈多，美年达却在关键时刻离奇“自杀”，尽管表面上人证物证都无懈可击，但汪旺旺始终不相信自己的好朋友真的死了。小伙伴们开始用自己的方式展开调查，踏上了寻找美年达的危险旅途……,2021-12-23 10:04:03,2021-12-23 10:04:03
9787559454164,薄雾,https://img1.doubanio.com/view/subject/l/public/s33900058.jpg,微风几许,,科幻,江苏凤凰文艺出版社,超忆症，患上它的人能清楚地记得人生中的每一个细节，大到世界转折，小到脑海中产生过的每一个想法。他们过目不忘、求知若渴，使得他们极易成为某种意义上的天才。传说季雨时就是这样的天才，而且他相貌出众。季雨时要去支援天穹七队的消息一经传出，就炸开了锅。谁都知道七队队长宋晴岚一身匪气，不仅凭着超强的能力在两年内就成了战场黑马，还*讨厌上面往他队里塞花瓶。果然，宋晴岚当众发言：“有用？兄弟们是要去卖命，不需要会量子波动速读的小天才！”后来，一行人在任务中被逼到绝境。那个小天才神情冷静，出手百发百中，战斗力爆棚。宋晴岚当着众人的面求他：“季顾问，留下来。我给你卖命。”,2021-12-23 10:04:09,2021-12-23 10:04:09
9787805675862,神秘之球,https://img3.doubanio.com/view/subject/l/public/s3598630.jpg,[美国]迈克尔·克莱顿,庆云,科幻,译林出版社,在南太平洋深达千英尺的水面下，一群美国科学家正对一艘巨大的不明船体进行探测。探测的过程引发了一连串的惊奇和疑问。原来这是一艘太空船，根据船上的资料，它是自外太空坠落而来，但令人惊讶的是，它竟完好无损，而且已有300年的历史。在这艘太空船上最神秘莫测的物体是一颗直径30英尺的大球，科学家们从中发现了一个惊人的秘密，从而使他们自己面临着严峻的挑战，而人类又将由此面对着怎样一种命运呢？,2021-12-23 10:04:16,2021-12-23 10:04:16
9787805675817,失落的世界,https://img9.doubanio.com/view/subject/l/public/s10266066.jpg,迈克尔·克莱顿,孙坤荣,科幻,译林出版社,“侏罗纪公园事件”发生6年之后，在哥斯达黎加的一座荒岛上有恐龙生存下来。古生物学家莱文及索恩、萨拉、马尔科姆等人到岛是上进行探险和研究。但是又发生了意外，全岛陷入一片混乱。莱文他们既要设法逃生，又要阴止道奇森等心胸险恶之徒偷盗恐龙蛋……这是一次惊 心动魄之旅。,2021-12-23 10:04:23,2021-12-23 10:04:23
9787536454484,群星，我的归宿,https://img1.doubanio.com/view/subject/l/public/s1311987.jpg,阿尔弗雷德·贝斯特,赵海虹,科幻,四川科学技术出版社,本书是第一届世界科幻大奖“雨果奖”得主阿尔弗雷德·贝斯特最著名的长篇科幻小说，一经出版就引起轰动，至今仍有不少科幻作家表示，《群星，我的归宿》是他们一生的至爱。此书历经半个多世纪的考验仍屹立不倒，评论家称颂贝斯特的想像力“远远走在了时代的前面”。《群星，我的归宿》是一部想像瑰丽壮观，情节惊心动魄，同时又发人深思的杰作。贝斯特在书中构筑了一个人们能依靠思维进行瞬间移动的生动未来，呈现了一个被遗弃的人在那样的特定环境中艰苦而又疯狂的复仇之路。,2021-12-23 10:04:31,2021-12-23 10:04:31
9787807038986,从地球到月球,https://img2.doubanio.com/view/subject/l/public/s5979413.jpg,[法]儒勒·凡尔纳,毛子欣,科幻,上海百家出版社,美国南北战争结束后，巴尔的摩城大炮俱乐部主席巴比康提议向月球发射一颗炮弹，建立地球与月球之间的联系。在全国人民的热烈响应中，大炮俱乐都的成员着手准备这项伟大的事业。法国冒险家米歇尔·阿当获悉这一消息后建议造一颗空心炮弹，他邀请巴比康、尼科尔一同乘这颗炮弹到月球去探险。三个人克服了种种困难；终于乘坐这颗炮弹向月球出发了。但是他们没有到达目的地，炮弹并没有在月球上着陆，却成为月球的卫星，无止境地绕月运行。故事留下悬念，三位探险家的命运无人能知……《从地球到月球》中涉及的天文、地理、人文等知识并非是作者无中生有的虚构，书中所有的数字及描述都是作者丰富想象和理性知识的结合，都有着坚实的科学基础和依据。,2021-12-23 10:04:38,2021-12-23 10:04:38
9787508052939,时间机器,https://img1.doubanio.com/view/subject/l/public/s4064427.jpg,乔治·威尔斯,吴天骄,科幻,华夏出版社,《时间机器》是作者在1895年发表的一部作品，也是威尔斯的第一部科幻小说。有评论家将这《时间机器》的出版认定为“科幻小说诞生元年”。小说描述一位科学家通过时间旅行机器来到公元802701年，这时的地球到处是宫殿式建筑。人类进化为两类，一类叫埃洛伊人，是生活在地面上的人。他们体态娇小柔弱，衣着华丽，不思劳动，过度追求安逸的生活。智力、体能都发生了退化。另一类叫莫洛克人，是生活在地下的人类。他们外形像白色的猴子，眼睛灰红色，头发浅黄；习惯于黑暗，怕光怕火，只能在夜间才到地面上活动。他们在地下的机器旁为埃洛伊人生产各种物品，但是他们自己的食品却是埃洛伊人。来到未来的科学家好奇地闯入了莫洛克人的地下世界，结果被莫洛克人追赶，最后历经艰险终于逃离险境，回到现实世界。,2021-12-23 10:04:47,2021-12-23 10:04:47
9787539984070,时间移民,https://img2.doubanio.com/view/subject/l/public/s28112711.jpg,刘慈欣,,科幻,江苏凤凰文艺出版社,在未来的某个时间，地球的环境已经无法再容纳暴涨的人口生存，8000万25岁以下的地球人进行时间移民——经冷冻后在移民大使的带领下向未来进发。移民队伍在未来的四个时代进行了停留，黑暗时代的核战摧毁了人类文明，大厅时代的克隆技术可以让人长生不老，无形时代人类彻底舍弃了身体，在11000年以后，留守的人类彻底灭绝，在生态完全恢复的地球，移民开始了重建家园的新生活。,2021-12-23 10:05:00,2021-12-23 10:05:00
9787500748755,环绕月球,https://img9.doubanio.com/view/subject/l/public/s3583516.jpg,[法]儒勒·凡尔纳,,科幻,中国少年儿童出版社,你完全可以想象得到，这三位勇敢的旅行家是饶有兴致地凝视着他们这次冒险旅程的最后的目的地月球。只见它正沿着自已的轨道，在不知不觉中渐渐地接近天顶，而据计算，那正是它将在四天后所要到达的地方。虽然通过他们手中的望远镜，月球上的山川、平原以及整个轮廓比站在地球上的任何地方所看到的情形也好不到哪儿去，可由于此刻没有大气的阻挡，月光显得那么的清晰，圆圆的月亮像一面镜子似的闪闪发亮、光芒四射。旅行家们都被眼前,2021-12-23 10:05:06,2021-12-23 10:05:06
9787556509539,宇宙商店,https://img3.doubanio.com/view/subject/l/public/s33714170.jpg,Lisa,,科幻,杭州出版社,森雨文化作为国内领先的漫画团队，首次联合29位顶尖漫画家创作30个科幻短篇漫画作品，全书298页精彩的展现了人工智能，外来文明，反乌托邦等主题。覆盖科幻的多方面主题合成的宇宙商店，带给读者不一样的惊喜。,2021-12-23 10:05:12,2021-12-23 10:05:12
9787532742806,八十天环游地球,https://img9.doubanio.com/view/subject/l/public/s2652476.jpg,[法]儒勒·凡尔纳,任倬群,科幻,上海译文出版社,儒勒·凡尔纳（1828-1905），法国著名科幻小说家，“科幻小说之父”。《八十天环游地球》是他的重要小说之一。福格和改良俱乐部的会友以二万英镑为赌注，打赌可以在八十天里环游地球一周。随后他带着绰号叫“路路通”的仆人，从伦敦出发，开始了不可思议的环球旅行；最终历经天灾人祸，在没有飞机、远洋巨轮的十九世纪，竟然完成了这一天方夜谭般的绕地球一周，不仅赢得了打赌，而且获得了爱情。本书寓科学知识、创造力、艺术和趣味于一体，在全世界拥有广泛的读者。,2021-12-23 10:05:26,2021-12-23 10:05:26
9789863036319,生化！星際外援1,https://img2.doubanio.com/view/subject/l/public/s24505542.jpg,瘋丟子,,科幻,鮮歡,強大單純的外星人型兵器＋活死人肆虐的地球＝無厘頭偵查任務？地球文明發展軌跡很像我們的星系，但全球性的病毒危機，讓地球提前步入衰竭期。阿部羅，你去一趟地球吧。──天蠍星系戰鬥總指揮天蠍星系分隊長阿部羅化名「星旅」，帶著囉唆的人工智慧小智，孤身來到活死人肆虐的地球。王者級戰鬥力＋嬰兒級地球知識，星旅面臨了比征服行星還要困難的挑戰──第一次用雙腳行走……　　　　(評：極度缺乏效率的移動方式)第一次品嘗地球食物……　　　(嘆：極度缺乏效率的能源補給)第一次被(掩護)撲倒……　　(怒：本隊長不需地球人保護！)第一次知道被愛慕的滋味……　(問：埃姆？地球人的攻擊武器？)強大而單純的外星人型兵器，無厘頭的戰鬥觀察報告，她要怎麼完成令人頭痛的偵查任務？,2021-12-23 10:05:32,2021-12-23 10:05:32
9787536471122,副本,https://img2.doubanio.com/view/subject/l/public/s6834253.jpg,[英]理查德·摩根,崔正男,科幻,四川科学技术出版社,《副本》由英国著名科幻作家理查德·摩根著。从理论上说，意识的存储和备份让人类实现了长生不老的梦想。当躯壳衰老、死亡时，存储的意识备份可以重新载入一具新躯壳，意识的主人也将因此重获新生。这个过程周而复始、连绵延续以至无穷。但这只是理论。在现实中，只有最富有的人才可能不断地将自己的意识存储、备份、更新。除此之外，还有一批身负特殊使命的人，意识存储让他们能够不计生死、自蹈死地。星际调查局探员科瓦奇就是这样的人。他的意识被跨星际传输到地球。载入一具新躯壳，调查一桩杀人案。被害者是地球的一位富翁。下载意识复活之后，这位富翁决心查出凶手，查明在他上一次意识备份到被杀害期间，到底发生了什么事。杀人、换躯、性、死亡、重生……在意识存储的新时代，古老的犯罪和侦查过程以令人难以想象的新面貌实施、展开。,2021-12-23 10:05:38,2021-12-23 10:05:38
9787544714266,地心游记,https://img2.doubanio.com/view/subject/l/public/s29484421.jpg,[法]儒勒·凡尔纳,陈伟,科幻,译林出版社,《经典译林•地心游记》主要内容包括：德国科学家李登布洛克教授受前人萨克努塞姆一封密码信的启发，偕同侄子阿克塞尔和向导汉斯，进行了一次穿越地心的探险旅行。他们从冰岛的斯奈菲尔火山口下降，一路上克服了缺水、迷路、风暴等各种困难，终于在一次火山喷发中从西西里岛的斯德隆布利火山回到地面。整部小说就像凡尔纳的所有作品一样，不仅文笔幽默流畅，情节波澜起伏，而且有着浪漫而合乎科学的非凡想像力，把读者带进了一个超越时空的幻想世界。,2021-12-23 10:05:48,2021-12-23 10:05:48
9787539963419,幽灵舰队,https://img1.doubanio.com/view/subject/l/public/s26951529.jpg,[美国]约翰·斯卡尔齐,姚向辉,科幻,江苏文艺出版社,《幽灵舰队》内容简介：随着人类向外星球的扩张殖民，宇宙正在变得越来越危险，三个种族的外星人正准备结盟对付人类，一场大战迫在眉睫。幽灵旅——殖民防卫军的特种部队，是人类最强的防卫力量，他们由死去之人的DNA克隆而成，身体强壮、反应敏捷，生来就是战士。雅列·狄拉克，一名特别的“幽灵旅”战士，他诞生的目的，就是充当叛徒查尔斯·布廷的记忆容器，找到他背叛的理由。谁知传送的过程竟然出了差错，雅列产生了自己的意识。而布廷的记忆也随着战争的激化渐渐苏醒，一善一恶两个灵魂在他的体内不断交战，威胁人类的巨大阴谋也渐渐浮出水面……,2021-12-23 10:05:54,2021-12-23 10:05:54
9787513317481,达斯·维德本纪,https://img3.doubanio.com/view/subject/l/public/s28065230.jpg,徐辰,,科幻,新星出版社,《达斯·维德本纪》是深度发烧、恶趣味的产物。它的副题叫“星球大战经典三部曲时代的维德尊主轶事”，事实上梳理的是一个高概念电影产品的产生及其商业版图的扩张过程，对星战之外的读者应该也很有意思。2003年6月，美国电影学会从一百部国产影片中选出了百年百大英雄和反派（两类角色各五十位），达斯·维德荣登反派第三名，此时距离达斯·维德初现银幕不到三十年。这个当初只是卢卡斯为诸位英雄安排的一个具象化反派人物，经由概念艺术家、道具师、演员、作家和玩具设计师等各方人士倾力打造，铁面枭雄终于成为星战经典三部曲的代表性人物和终极文化符号。他的自我成长甚至反过来影响了他的创造者卢卡斯，后者也不得不承认，《星球大战》从来就不是卢克的故事，达斯·维德才是它的主角。同时，这个反面人物诞生四十年，俘获千万万口味独特的消费者，可谓是当代影视工业与高概念产品营销的上佳案例。《达斯...,2021-12-23 10:06:00,2021-12-23 10:06:00
9787550299399,机器人间,https://img1.doubanio.com/view/subject/l/public/s29461938.jpg,阿缺,,科幻,北京联合出版公司,本书收录了作者10篇中短篇科幻小说，是关于未来浪漫的故事，有机器人，有外星文明，有人类，有希望，有勇敢，有热血，有爱……,2021-12-23 10:06:07,2021-12-23 10:06:07
9787544716468,地球以外的文明世界,https://img9.doubanio.com/view/subject/l/public/s6509435.jpg,[美]艾萨克·阿西莫夫,,科幻,译林出版社,"人类去往何方？人类的后路在哪里？在茫茫宇宙中，我们人类并不是孤独的！肯定存在着其他的种类，他们也在寻找、研究着我们，而且或许比我们做得更有成效。许多天文学家都相信这一点。阿西莫夫也相信这一点。美国科幻大师阿西莫夫探索地外文明的著名作品，考据准确、想象丰富、推理有趣,他提出的有关外星讯息、空间探索、星际飞行的构想在天文学界引起轰动。",2021-12-23 10:06:14,2021-12-23 10:06:14
9787536454439,天意,https://img3.doubanio.com/view/subject/l/public/s6979030.jpg,钱莉芳,,科幻,四川科学技术出版社,"三代禅让，商汤伐桀，宗周革命，春秋战国……秦失其鹿，天下英雄共逐之！  然而又有谁能想到这“其兴也勃焉，其亡也忽焉”的王朝更替背后，竟有一股神秘力量在操纵。  在大秦帝国即将崩溃的前夜，淮阴韩信虽然才高八斗，学富五车，身怀治国平天下之策，却无人赏识。潦倒中，一位神秘的黑衣人出现在他面前，向他许下一个魔鬼交易。历史之轮自此徐徐转动，隐秘于上古神话中的黑手渐渐露出它庞大的身影,而韩信亦踏上逐鹿中原的征战之途。  历史会按照黑衣人的计划再度重演吗？那个注定要在史书中以“名将”相称的年轻人，韩信，会屈从于黑衣人的意志吗？在历史之轮停止前没有人能知道答案……",2021-12-23 10:06:22,2021-12-23 10:06:22
9787201124803,时间机器,https://img2.doubanio.com/view/subject/l/public/s29674692.jpg,[英]赫伯特·乔治·威尔斯,顾忆青,科幻,天津人民出版社,《时间机器》（The Time Machine）是英国著名小说家赫伯特·乔治·威尔斯在1895年发表的一部科幻小说。这本书也是威尔斯的第一部科幻小说。有评论家将这本书的出版认定为“科幻小说诞生元年”。作品描述一位科学家通过时间旅行机器来到公元802701年。这时的地球到处 是宫殿式建筑。人类进化为两类：艾洛伊人和莫洛克人。作者将将优雅的贵族描写为被莫洛克饲养的畜牲，而且还被当作食物，展示了人类退化的阴森景象。◆ “科幻界莎士比亚”赫伯特·乔治·威尔斯代表作◆ 1895年，《时间机器》的出版被认定为“科幻小说诞生元年”◆ 世界科幻小说史上第一部以时间旅行为题材的作品◆ 阿西莫夫、乔治·奥威尔、博尔赫斯、纳博科夫深受影响◆ 五次改编为广播剧，四次改编为电影，更有数十个其他衍生作品◆ 生活大爆炸中美剧《生活大爆炸》中出现的时间机器，就是1960...,2021-12-23 10:06:29,2021-12-23 10:06:29
9787801734761,海底两万里,https://img1.doubanio.com/view/subject/l/public/s5650647.jpg,[法]儒勒·凡尔纳,陈筱卿,科幻,国际文化出版公司,《海底两万里》是法国作家、“科幻小说之父”凡尔纳著名的科幻三部曲的第二部。小说描写的是法国博物学家阿罗纳克斯教授应邀登上一艘驱逐舰，参与追捕当时盛传的海上“怪物”，不幸被“怪物”俘获。而所谓的“怪物”竟是一艘当时无人知晓的潜水艇。潜水艇艇长尼摩邀请阿罗纳克斯教授一行三人作海底旅行。沿途他们饱览了海底变幻无穷的奇异景观和形形色色的生物，经历了种种危险。最后，当潜水艇到达挪威海岸时，阿罗纳克斯等三人不辞而别，将他们所知道的海底秘密公诸于世。,2021-12-23 10:06:41,2021-12-23 10:06:41
9787536468474,雪崩,https://img9.doubanio.com/view/subject/l/public/s3911776.jpg,（美）斯蒂芬森,郭泽,科幻,四川科学技术出版社,故事发生在21世纪初期的美国的洛杉矶，在这个未来中美国联邦政府将大部分权力给予了私人企业家和组织，国家安全交付给了雇佣军队，公路公司之间也相互竞争来吸引司机来上他们的路，政府剩余的权利只是做一些繁琐的工作而已，社会的繁荣安定与他们无关。政府的大部分的土地被各个大的私人瓜分，并建立了个人领地。这种安排类似与无政府资本主义，这是尼尔·斯蒂芬森下部小说《钻石时代》的主题。在严重的恶性通货膨胀下，美元急剧贬值，一兆美元也是一个会被忽略的数字，而人们交易中通常则使用的是其他的货币。 在小说中，斯蒂芬森创造了一个并非以往想象中的互联网——虚拟实境（Metaverse），而是和社会紧密联系的三维数字空间，与现实世界平行，在现实世界中地理位置彼此隔绝的人们可以通过各自的“化身”进行交流娱乐。小说的主人公名为Hiro，他在他的名片上写着“最后的自由黑客和世界上最强的...,2021-12-23 10:06:48,2021-12-23 10:06:48
9787544285650,环界3.环,https://img1.doubanio.com/view/subject/l/public/s29171859.jpg,[日本]铃木光司,许木兰,科幻,南海出版公司,为了解开未来世界发展的规律，美日科学家在巨型计算机内部，创造出了三次元的假想空间 “环界”。环界如宇宙一般广大，土壤、地形、气体等条件都与地球一致。在环界，死去的贞子曾将自己的怨念留在录像带中，看过录像带的人会在七天后死亡。本以为贞子的怨念已经平复，谁知她利用DNA技术借腹重生，进化为新的生命体，在暗处开始了猎杀人类的游戏。在现实世界中，“转移性人类癌病毒”正在肆无忌惮地繁殖、肆虐，它们无雌雄之分，而且永远不死。全世界已经有数百万患者。现实世界竟然和“环”处于相同的困境中，这是偶然？还是“环”计划果真准确地预测了未来？,2021-12-23 10:06:55,2021-12-23 10:06:55
9787532784110,弗兰肯斯坦,https://img3.doubanio.com/view/subject/l/public/s33710200.jpg,[英]玛丽·雪莱,刘新民,科幻,上海译文出版社,弗兰肯斯坦是个热衷于生命起源的生物学家，他怀着犯罪心理频繁出没于藏尸间，尝试用不同尸体的各个部分拼凑成一个巨大人体，当这具怪物终于获得生命睁开眼睛时，弗兰肯斯坦被他的狰狞面目吓得弃他而逃，他却紧追不舍地向弗兰肯斯坦所要女伴、温暖和友情：接踵而至的更是一系列诡异的悬疑和命案•••••••,2021-12-23 10:07:04,2021-12-23 10:07:04
9787536459519,异乡异客,https://img9.doubanio.com/view/subject/l/public/s27459374.jpg,罗伯特.海因莱因/RobertHeinlein,吴为,科幻,四川科学技术出版社,首次登陆火星的地球探险家全部遇难，只在火星上留下一个孤儿。二十五年后，第二支火星探险队将这个被火星人抚养长大的孩子带回了地球。按照地球法律，瓦伦丁·迈克尔·史密斯成为火星的拥有者。于是，从返回地球的那一刻起，他立即成为各大势力争夺的对象。但是，此时的迈克尔·史密斯对地球和人类一无所知。以火星人的眼光来看，他觉得这个新世界简直不可理喻，人与人之间充满尔虞我诈；这里没有爱，只有冷漠。所幸他遇到了一位出色的导师--作家朱巴尔·哈肖，哈肖像父亲一样引导着他，为他指出这个世界的荒谬，帮助他战胜蜂拥而来的“秃鹫”。迈克尔·史密斯迅速成长起来，他明白了自己的使命：召唤这个世界，用爱战胜邪恶。他将成为一名先知，等待着他的是无数先知的宿命。评论：这本书打破了科幻小说叫好不叫座的局面，使这类作品从此成为畅销书排行榜上的常客。同时，在崇尚偶像破坏和自由性爱的二...,2021-12-23 10:07:13,2021-12-23 10:07:13
