9787535744517,时间简史(普及版),https://img3.doubanio.com/view/subject/l/public/s1534820.jpg,[美国]列纳德·蒙洛迪诺,吴忠超,科学,湖南科学技术出版社,《时间简史》(普及版)是一本探索时间本质和宇宙最前沿的通俗读物，是一本当代有关宇宙科学思想最重要的经典著作，它改变了人类对宇宙的观念。史蒂芬·霍金这本畅销世界的《时间简史》已成为科学著述的里程碑。这不仅归因于作者迷人的表达方式，还归因于他讨论的令人敬畏的主题：空间和时间的本性，上帝在创生中的作用，宇宙的历史和将来。但是，在它问世后的岁月里，有些读者一直不断地向霍金教授诉说，该书某些最重要的概念理解起来非常困难。这就是写作《时间简史》(普及版)的缘起和理由：作者希望读者更容易接受它的内容——同时还纳入最新的科学观测和发现。虽然本书在篇幅上的确是“更简明”些，但它实际上却扩大了原书伟大的论题。删除了纯粹技术性的概念，诸如混沌的边界条件的数学等等。相反，包括相对论、弯曲空间以及量子论的课题，它们虽然具有无穷的趣味，但却由于散布于原书而很难理解，现在则各...,2021-12-21 18:15:50,2021-12-21 18:15:50
9787206036996,艺术与物理学,https://img9.doubanio.com/view/subject/l/public/s2169925.jpg,（美）史莱因,吴伯泽,科学,吉林人民出版社,艺术阐释视觉的世界，物理学描述其不可见的作品，这种区别使得两个领域看上去似乎完全是对立的。但在《艺术与物理学》一书中，史莱因通过历史面面俱到地追溯了艺术与物理学的背景，提示了在各种想象力中惊人的相关性。    从古希腊的雕塑家到瓦霍耳和姜斯，从亚里士多德到爱因斯坦，艺术家们预见到了科学家们的发现，例如莫奈和塞尚就由直觉知道了将由爱因斯坦在物理学中引发的剧变。在其生动多彩的叙述中，史莱因探索了在整个历史中如此众多的场合，艺术的突破怎样地预示了物理学家们富于想象的洞见。    《艺术与物理学》一书既令人激动，又富于创新，是艺术的浪漫与科学的剧作之天衣无缝的结合，是一部令人愉悦的思想史。,2021-12-21 18:15:57,2021-12-21 18:15:57
9787513326919,编码宝典,https://img1.doubanio.com/view/subject/l/public/s29533028.jpg,[美]尼尔·斯蒂芬森,刘思含,科学,新星出版社,这是一段长达一千多页的传奇，以破译数据密码为中心线索，结合了历史小说和科技惊险小说的元素，从第二次世界大战破译纳粹密码的“布莱切利公园”一直到现代在东南亚建立的“信息天堂”。这是一部跨越时空的信息流动发展史，被一代又一代IT人奉为“Geek圣经”。1942年，年轻的美国海军密码破解专家劳伦斯•沃特豪斯被委派到神秘的2702部队，这个部门的任务是掩盖德军的恩格玛密码已经被破解的事实。他们躲在敌人身后，想法设法在情报战中误导敌方。在2702部队服役的美军中士鲍比•沙夫托，冒着生命危险执行沃特豪斯的计划，与此同时，沙夫托的老朋友，日本的采矿工程师后藤田悟，被委派到菲律宾一座矿山中执行秘密任务，三人的命运紧密相连……1997年，兰迪•沃特豪斯通过光纤电缆为菲律宾移民提供讯息，寄生藤公司通过这笔收入在附近建立地下数据库，道格•沙夫托和他的女儿则负责电缆的海...,2021-12-21 18:16:04,2021-12-21 18:16:04
9787535785855,消失的微生物,https://img1.doubanio.com/view/subject/l/public/s29702467.jpg,［美］马丁•布莱泽,傅贺,科学,湖南科学技术出版社,为什么现在的孩子越来越高、越来越胖？为什么青少年糖尿病越来越多、发病年龄越来越小？为什么越来越多的现代人患上了哮喘、过敏性鼻炎以及五花八门的食物过敏？种种“现代疾病”背后是否有一个共同的“罪魁祸首”？美国著名科学家马丁·布莱泽申论，在过去的几十年里，由于滥用抗生素及剖 宫产，我们在不经意间已经伤害了与人类协同演化了数十万年之久的“微生物朋友”，特别是在我们的孩子们身上。这扰乱了人体内微生物的稳态，打破了人体与微生物之间的平衡，进而危害了我们孩子的代谢、免疫和认知能力。恩格斯的告诫犹在耳畔：“我们不要过分陶醉于对自然界的每一次胜利，对于每一次这样的胜利，大自然都报复了我们。”在《寂静的春天》里，蕾切尔·卡森提醒我们，滥用滴滴涕等杀虫剂会危害地球上其它的生物；在《消失的微生物》里，马丁·布莱泽提醒我们，滥用抗生素及剖宫产会危害我们自己的后代。作为人...,2021-12-21 18:16:13,2021-12-21 18:16:13
9787542851550,改变世界的方程,https://img1.doubanio.com/view/subject/l/public/s6974507.jpg,[德]哈拉尔德·弗里奇,邢志忠,科学,上海科教出版社,一个简单的数学方程果真能够改变世界吗？它究竟隐含着如何深邃的物理意义？作者以简明清新、通俗易懂的文笔讲述了狭义相对论的基本思想，其中著名的质能方程E=mc2在人们认识自然界的物质结构和性质之中扮演了核心的角色。原子弹爆炸的巨大能量来源正是基于这个方程所描述的物理原理，因此后者通过前者而改变了整个世界。 本书的主要内容是以虚拟的三人讨论的形式来表述的，参与者包括艾萨克·牛顿、阿尔伯特·爱因斯坦和一位虚构的名叫阿德里安·哈勒尔的理论物理学教授。他们代表了物理学发展的三个不同时代。通过三人之间生动活泼的对话，读者可以切身领会相对论的时空观，比如光速不变性原理、时间延缓和空间收缩。而质能关系的出现则加深了我们对物质世界的理解：核裂变、核聚变、粒子与反粒子的产生和湮没等等不可思议的现象都是物质和能量之间相互转化的例证。,2021-12-21 18:16:21,2021-12-21 18:16:21
9787535710598,时间简史,https://img1.doubanio.com/view/subject/l/public/s1462627.jpg,史蒂芬·霍金,吴忠超,科学,湖南科学技术出版社,霍金教授的时间简史，从大爆炸到黑洞。,2021-12-21 18:16:29,2021-12-21 18:16:29
9787535774965,大宇之形,https://img9.doubanio.com/view/subject/l/public/s27175586.jpg,[美]丘成桐史蒂夫·纳迪斯,翁秉仁,科学,湖南科学技术出版社,《第一推动丛书•宇宙系列:大宇之形》内容简介：广义相对论研究巨大尺度的物体──例如星体、甚至整个宇宙；量子力学研究甚至整个极小尺度的奇妙现象──如原子世界。弦理论（String Theory）则企图成为两者间的桥梁。从微细的“弦”振动开始，弦理论认为我们生活在一个十维的世界中，其中四维是我们日常生活感知的时空，另外六维呢？物理学家发现，1976年出现的「卡拉比-丘流形」（Calabi-Yau Manifolds），一个纯粹的数学几何结构，正好可以用来刻画六维空间的內在形状！《第一推动丛书•宇宙系列:大宇之形》中，丘成桐首次细说从头，从古希腊时代柏拉图等几何学家、到爱因斯坦、卡拉比以及丘成桐自己的研究、他对几何学未来的看法等等；敘述了他几十年來所有成就的来龙去脉以及心路历程。读者可以深切了解近代数学和物理学研究的重要进展，更体会到第一流科学家的研究精...,2021-12-21 18:16:36,2021-12-21 18:16:36
9787030145970,基因VⅢ,https://img1.doubanio.com/view/subject/l/public/s1348258.jpg,（美）本杰明·卢因,余龙,科学,科学出版社,从《基因》到现在的《基因Ⅷ》，该系列已成为20年来经久不衰的经典名著，堪称分子生物学的国际第一书。每一版的更新都紧跟学科发展，更加适合当前的学习和研究。作为最新一版，本书继承了原有的核心内容，包括系统介绍了基因的结构、组织与表达，蛋白质与细胞的分子活动等。同时，还增加了许多新的内容与特色，首先是对章节进行了新的编排，以基因组学贯穿全书，对基因组的组织、DNA复制、修复、重组、转录、翻译、基因调控等内容进行了全面的更新，增加了许多新的专题；扩充了原核生物的内容；图解也更加丰满详尽。中译版很好地保持了原书风貌，更加适合中国的学生和老师学习参考。本书是公认的学习分子生物学、分子遗传学、基因组学的最佳参考书之一。新增加和修订的内容：基因组、DNA复制、修复、重组、转录、翻译、癌症和信号传导的最新进展，以及人类和小鼠基因组序列数据。基因组学的事例：以基...,2021-12-21 18:16:43,2021-12-21 18:16:43
9787806797549,万物简史,https://img2.doubanio.com/view/subject/l/public/s1171582.jpg,[美]比尔·布莱森,严维明,科学,接力出版社,这是一部有关现代科学发展史的既通俗易懂又引人入胜的书，作者用清晰明了、幽默风趣的笔法，将宇宙大爆炸到人类文明发展进程中所发生的繁多妙趣横生的故事一一收入笔下。惊奇和感叹组成了本书，历历在目的天下万物组成了本书，益于人们了解大千世界的无穷奥妙，掌握万事万物的发展脉络。书中回溯了科学史上那些伟大与奇妙的时刻，引用了近年来发现的最新科学史料，几乎每一个被作者描述的事件都奇特而且惊人：宇宙起源于一个要用显微镜才能看得见的奇点；全球气候变暖可能会使北美洲和欧洲北部地区变得更加寒冷；1815年印度尼西亚松巴哇岛坦博士拉火山喷发，喷涌而出的熔岩以及相伴而来的海啸夺走了10万人的生命；美国黄石国家公园是“世界上最大的活火山”……而那些沉迷于科学的科学家们也是千奇百怪：达尔文居然为蚯蚓弹起了钢琴；牛顿将一根大针眼缝针插进眼窝，为的只是看看会有什么事情发生；富兰克林不...,2021-12-21 18:16:56,2021-12-21 18:16:56
9787532383900,心灵裸舞,https://img2.doubanio.com/view/subject/l/public/s2049953.jpg,[美]凯利·穆利斯,徐加勇,科学,上海科技出版社,本书是1993年诺贝尔化学奖获得者凯利·穆利斯的自传。作者以亲身经历介绍了聚合酶链式反应(PCR)诞生的传奇故事和发展、传播的内幕，以及他的获奖经过。同时，穆利斯还谈到了辛普森案、毒蜘蛛、毒品、他的童年趣事、对温室效应和艾滋病的独到见解。本书展示的是一位非传统的科学家形象，一个在科学研究上颇有创造性但有时又会走弯路，工作上严肃认真，生活上不拘自任的凯利·穆利斯。  序言 第一章 PCR的发明第二章 人奖第三章 实验室是另一个玩的地方第四章 洛杉矶的恐惧和律师第五章 感觉领域第六章 在玩电中思考第七章 和哈里一起的夜晚第八章 笑气历险第九章 阿伏伽德罗常量第十章 谁主沉浮? 第十一章 科学方法怎么了? 第十二章 来自斜蛛属隐上的攻击第十三章 异彤禁入 第十四章 第10000天生日 第十五...,2021-12-21 18:17:03,2021-12-21 18:17:03
9787213079757,上帝的手术刀,https://img2.doubanio.com/view/subject/l/public/s29431112.jpg,王立铭,,科学,浙江人民出版社,·这本书从孟德尔神父的“豌豆试验”入手，用跌宕起伏、起承转合的文学讲述手法，在全书中埋下层层伏笔，抖出了一个又一个的重磅包袱，宛如一位智者在科学之树下摇着扇子对基因编辑的历史脉络娓娓道来。其内容之深入浅出、讲述手法之驾轻就熟，令人手不释卷。·一本细致讲解生物学热门进展的科普力作，一本解读人类未来发展趋势的精妙“小说”。·打开基因科学深奥的硬壳，展现人类探索自身的的历史进程，从分子层面出发，重新思考人类的过去、现在和未来。,2021-12-21 18:17:11,2021-12-21 18:17:11
9787535770615,爱因斯坦传,https://img2.doubanio.com/view/subject/l/public/s27983353.jpg,[美]沃尔特·艾萨克森,张卜天,科学,湖南科学技术出版社,本书是爱因斯坦的所有文稿解密之后问世的第一部有关爱因斯坦的内容详尽、可读性极强的传记。爱因斯坦是如何思考的？这个天才又是如何造就的？本书基于新近披露的爱因斯坦的私人信件，探究了这位富于想象、不拘礼节的专利员领会造物主的心思、揭开原子和宇宙奥秘的过程。无论是那时还是现在，爱因斯坦的人生和个性都对我们有重要的启发意义。本书荣获美国国家科学院2008年度科学传播最佳图书奖。,2021-12-21 18:17:19,2021-12-21 18:17:19
9787218110219,什么是科学,https://img9.doubanio.com/view/subject/l/public/s28960634.jpg,吴国盛,,科学,广东人民出版社,本书直面现今国人科学概念的误区，即要么把科学等同于技术，等同于促进生产力发展的工具，要么把科学看成一种普遍存在的人类智力成就。作者指出：科学成为推动历史发展的强大动力只是十九世纪以后的现象，科学根源于希腊人对于自由人性的追求，因而是一种十分罕见的文化现象。现代科学起源于 希腊科学的复兴以及基督教内在的思想运动，对力量的追求、对自然的控制和征服成为现代科学的主导动机。在数理实验科学的意义上，中国古代并无科学。在博物学的意义上，中国古代有独特且强大的科学传统。,2021-12-21 18:17:33,2021-12-21 18:17:33
9787201163260,我的思想与观念 ：爱因斯坦自选集,https://img2.doubanio.com/view/subject/l/public/s33734442.jpg,[美]爱因斯坦,张卜天,科学,天津人民出版社,"一次与伟大灵魂的深度对话，一本书认识真实的爱因斯坦★英语世界广为流传的爱因斯坦通俗著作集，畅销60余年以1954年Ideas and Opinions为底本，收录爱因斯坦三个文集[英译本《我的世界观》（The World as I see it, 1934）《晚年集》（1950）《我的世界观》（Mein Weltbild, 1953）]中的重要篇目，及当时未出版的新文章，共计121篇，内容丰富详实，汇集爱因斯坦对人生、科学、文化、教育、战争、友谊及社会问题的思考与见解，显示了爱因斯坦豁达的人生态度、敏锐的洞察力和对人类命运的深挚关切。★爱因斯坦亲自参与编选，汇集他从青年时代到去世前的文章精华，是认识和研究爱因斯坦的必读书★清华大学科学史系教授张卜天全新译作清华大学科学史系教授、豆瓣9.3分《大问题》9.1分《爱因斯坦传》译者张卜天忠实翻译，...",2021-12-21 18:17:40,2021-12-21 18:17:40
9787535744159,发现的乐趣,https://img9.doubanio.com/view/subject/l/public/s1589656.jpg,R·P·费曼,张郁乎,科学,湖南科学技术出版社,《发现的乐趣》我们了解到，在科学家的孩提时代，他的父亲如何以带他认识这个世界为乐，而他，那个小男孩，如何享受“发现出事物”的巨大乐趣。我们还看到了处在最佳科学状态时的费曼，他宣讲他对未来计算机的前瞻（这种预测已经部分成为了现实》，他对科学价值的看法，以及他在挑战者号航天飞机爆炸一事上的结论。在每一篇中，我们都体验着费曼，分享他诡谲的语言和深刻的思想。费曼已经被誉为20世纪最有影响的人物之一。没有什么能够比他的话更适于记录这个时代的精神，科学上的进步或者我们文化上的里程碑。,2021-12-21 18:17:47,2021-12-21 18:17:47
9787301141724,科学的旅程,https://img9.doubanio.com/view/subject/l/public/s3372504.jpg,[美]雷·斯潘根贝格,郭奕玲,科学,北京大学出版社,揭开被科学辉煌成就遮蔽了的真实历史——科学史是一部由“正确”与“错误”“成功”和“失败”共同纺织的历史。当前科学教育中最缺乏的是“批判性思维”训练，而我们这个时代比以前任何时代都需要明晰而又具批判性的思考能力，以及把科学方法和原理恰当运用到我们时代处理各种复杂问题的能力。,2021-12-21 18:17:54,2021-12-21 18:17:54
9787535755674,未来总统的物理课,https://img2.doubanio.com/view/subject/l/public/s6018112.jpg,[美]R·A·穆勒,李泳,科学,湖南科学技术出版社,你害怕物理吗？你对全球变暖、间谍卫星、洲际弹道导弹、反弹道导弹、核聚变、核裂变等东西感到神秘吗？你想过核弹的核与核电厂的核在本质上是一样的吗？有人说我们正在耗尽化石燃料，反对者却说没有，你感到疑惑吗？有些大科学家说关于全球变暖的争吵已经结束了，而你看到它正如火如荼，是不是感到无所适从呢？你是不是觉得物理学和高技术令人头晕眼花呢？如果是，那么你还成不了世界的领导者。世界的领导者必须懂得这些问题.总统不必学数学，但需要懂物理。哪些效应最重要，哪些效应可以忽略？世贸中心为什么坍塌？朝鲜的核爆炸为什么失败？送人上太空的科学价值是什么？全球变暖的主要原因是什么？什么办法能真正解决问题而不仅仅是“感觉良好”的“样板”工程？太阳能、风暴、蓄电池和核能的前景如何？……本书讲述最基本的事实和思想，即那些能帮助总统做出更好决策的概念；讨论那些最急迫和最又意义的问题。,2021-12-21 18:18:01,2021-12-21 18:18:01
9787208140103,星际唱片,https://img2.doubanio.com/view/subject/l/public/s29073641.jpg,[美]卡尔·萨根,杨鹏,科学,上海人民出版社,◆大名鼎鼎、堪称科学家模范的卡尔·萨根，带领NASA“旅行者”号原班工作团队撰写，披露人类寄给外星生命的第一份地球档案的全部内容萨根领携的全精英团队为什么一定要做星际唱片？又如何筛选制作出最终代表人类和地球的唱片声音和图像内容？“我们很清楚，这颗行星和它的所有居民只 是宇宙中一个极小的颗粒。我们满怀谦卑与希望，向无垠的宇宙迈出这小小的一步。”◆. 我们是谁，我们如何存在？星际唱片是人类交给宇宙的第一份答案人类究竟应不应该寻找外星生命？在宇宙的尺度中，又该如何认识和定义人？旅行者一号是迄今唯一飞出太阳系的人造物，它载着的星际唱片，不仅是向外星生命介绍我们的名片，也是我们第一次挣脱地球，尝试从星际的尺度上认识自己。——————————————————————————————【 内容简介】星际唱片，是人类对于浩瀚宇宙充满浪漫的一次问候发射于...,2021-12-21 18:18:08,2021-12-21 18:18:08
9787810836074,科学发现的逻辑,https://img1.doubanio.com/view/subject/l/public/s4142947.jpg,卡尔·波普尔,查汝强,科学,中国美术学院出版社,《科学发现的逻辑》主要讨论知识理论的两个基本问题：划界和归纳问题。作者论证科学与非科学的划界标准不是可证实性而是可证伪性，科学的方法不是归纳法而是演绎检验法。书中提出的有关科学的性质和方法以及科学知识增长的独创性论点，对科学哲学、认识论、逻辑学、方法论以及科学史、自然科学、医学、设计理论、社会科学均有影响。一些著名科学家都认为他的方法符合科学研究的实际。,2021-12-21 18:18:17,2021-12-21 18:18:17
9787118057973,混沌与分形,https://img9.doubanio.com/view/subject/l/public/s3458764.jpg,[德]佩特根,田逢喜,科学,国防工业出版社,《混沌与分形:科学的新疆界(第2版)》介绍了分形与混沌理论的基础知识、基本原理和特性，包括：分形与自相似、分形的维数与测度、分形与图像数据压缩编码、随机性与确定性、分形的递归结构、细胞元自动机与吸引子、分形构造中的随机性、确定性混沌：灵敏度、混合与周期点、有序与混沌、奇异吸引子、典型的分形集如Julia集、Mandelbrot集等，重点介绍了分形与混沌的物理意义、两者之间的关系、与数学的其它方面以及自然现象的联系，展示出分形与混沌的在视觉、图像方面的优美结构和图案。,2021-12-21 18:18:23,2021-12-21 18:18:23
9787543939226,不可思议的物理,https://img2.doubanio.com/view/subject/l/public/s3803522.jpg,[美国]加来道雄,晓颖,科学,上海科学技术文献出版社,对不可思议事物——从死光和力场到隐身衣的科学原理的迷人探险，揭露这些科技在未来数十年到数千年间获得实现的可能性。,2021-12-21 18:18:31,2021-12-21 18:18:31
9787521708035,万物发明指南,https://img1.doubanio.com/view/subject/l/public/s33471187.jpg,[加]瑞安·诺思,王乔琦,科学,中信出版社,如果你忽然发现自己穿越到了只在历史书中读到过的古代，你该怎么办？-面对陌生的原始社会，没有电、没有手机、没有网络……没有任何现代化的工具，你该如何生存下去？-别担心，这本书可以帮到你！-从钻木取火到发明蒸汽机、计算机，以你的名字命名元素周期表和物理定律，从时空穿越到再造人类文明，你只需要这一本书。这是一本时光机维修手册，更是你成为人类文明主宰的秘籍。快开始新奇的文明创造游戏吧！这是一部穿越人类发展时空、图文并茂的科普作品，追溯了人类发展历程中的重大发明发现，带领读者重新感受了人类文明的发展进程。-本书编排精妙，切入点新颖有趣，是为一位不小心“被穿越”的旅行者而打造的生存指南，读者可以跟随作者的脑洞，搭乘时间机器返回那些曾经在传说中听过的时间、地点，根据具体的情境思考自己该如何生存。-书中有详细的操作步骤，交互式设计令读者...,2021-12-21 18:18:39,2021-12-21 18:18:39
9787542847225,大流感,https://img1.doubanio.com/view/subject/l/public/s33628967.jpg,约翰·M·巴里,钟扬等译金力校,科学,上海科技教育出版社,《大流感:历史上最致命瘟疫的史诗》主要内容：大流感指的是1918—1919年横扫世界的那次流感大流行，过去估计全球死亡人数约2000万，最新的权威估计数字为5000万－1亿。这个数字不仅高于历年来命丧艾滋病的人数总和，更远超中世纪二黑死病所造成的死亡人数。《大流感—历史上最致命瘟疫的史诗》作者依据大量的历史资料和数据，重绘1918年的惨状，为我们再现了这场最致命瘟疫发生、发展及其肆虐全球的过程，在《大流感—历史上最致命瘟疫的史诗》中，作者多线索展开论述，纵横交错地记述了有史以来最具毁灭性的流感故事，以及20世纪科学与医学发展的历史。《大流感—历史上最致命瘟疫的史诗》细致入微地描写了科学、政治与疾病传播互动的过程，并述及传统医学演化至现代医学的重要里程碑，以及当年科学家、医学工作者等在巨大压力下所显示出的勇气或怯懦，信仰、价值观、研究态度和方法……...,2021-12-21 18:18:48,2021-12-21 18:18:48
9787030257017,为什么要相信达尔文,https://img1.doubanio.com/view/subject/l/public/s4038139.jpg,杰里·A·科因,叶盛,科学,科学出版社,我知道你相信演化论（也许你更熟悉它的另一个名字——进化论），但能给个理由吗？即使是理查德·道金斯和斯蒂芬·杰伊·古尔德，他们在赞叹演化之美并且进行个案研究时，也未曾将证据本身作为关注重点。但来自实验室和自然界的证据是海量、繁杂、令人叹为观止的。科学家们找到了正一分为二的物种，观察到了自然选择在我们眼前对动物和植物进行着改造，发现了越来越多呈现出过去发生的变化的化石——比如长着羽毛的恐龙和拥有四肢的鱼。《为什么要相信达尔文》将遗传学、古生物学、地质学、分子生物学及解剖学现代研究结果的许多线索编织在一起，严谨而优雅地证明了为什么说演化论不止是一项正确的理论，更是一个事实。科学家不会轻易使用“正确”这个词，但在杰里的解释下，我们明白了为什么在谈论达尔文学说的时候生物学家们很乐意这么说。达尔文学说是“正确”的，不是因为专家这样认为，也不是因为有什么世界...,2021-12-21 18:18:56,2021-12-21 18:18:56
