9787536474284,发条女孩,https://img1.doubanio.com/view/subject/l/public/s11125827.jpg,[美国]保罗·巴奇加卢皮,梁宇晗,科幻,四川科学技术出版社,2009 年《时代杂志》年度十大小说2009 年《出版人周刊》（Publisher Weekly）年度科奇幻类推荐小说2009 年《图书馆期刊》（Library Journal）年度科奇幻类推荐小说2009 年《轨迹杂志》（Locus）年度科奇幻类推荐小说2009 年 Barnes & Noble 书店年度最佳科奇幻小说第二名2009 年星云奖（Nebula Award）最佳科奇幻小说得主2010 年雨果奖（Hugo Award）最佳科奇幻小说得主2010 年轨迹奖（Locus Award）最佳新人科幻小说得主2010 年约翰．坎贝尔纪念奖（John W. Campbell Memorial Award）得主2010 年康普顿．库克奖（Compton Crook Award）得主2010 年美国图书馆协会「参考及读者服务学会」（R...,2021-12-23 09:35:26,2021-12-23 09:35:26
9787544710800,海底两万里,https://img1.doubanio.com/view/subject/l/public/s6182289.jpg,儒尔•凡尔纳(JulesVerne),沈国华,科幻,译林出版社,从结构上说，《海底两万里》是一部出色的悬念小说。小说从海面上“怪兽”出没，频频袭击各国海轮，搅得人心惶惶开始，到鹦鹉螺号被大西洋旋涡吞噬为止，整部小说悬念迭出，环环相扣。小说展示的海底风光固然迷人，但是读者，或者说主人公始终被一个谜团所困惑，他始终在思考，想解开这个谜：尼摩船长究竟是什么人?这位天才的工程师、知识渊博的学者为什么如此仇视人类社会?他漫游海底的目的是什么?何时是旅途的终点站?阿罗纳克斯、龚赛依和尼德·兰屡次逃跑的努力似乎都在无意间被挫败，他们能否重返大地、获得自由?这次海底万里行究竟如何收场?老的疑团刚解开，新的困惑又摆在面前，整部小说就在这种一波未平，一波又起的氛围中展开。凡尔纳小说的悬念完全可以同希区柯克的悬念片媲美，在同时期的法国文坛上独树一帜。凡尔纳早年醉心于戏剧、特别是喜剧创作，娴熟地掌握了戏剧中的情节跌宕、启承转合的技巧，写...,2021-12-23 09:35:38,2021-12-23 09:35:38
9787513329330,地球纪元Ⅲ：时间旅者,https://img9.doubanio.com/view/subject/l/public/s29638684.jpg,彩虹之门,,科幻,新星出版社,中国首部网络硬科幻小说“银河奖”最佳网络文学奖得主彩虹之门系列长篇《地球纪元》的第三本起点中文网累计点击量超过500万，总推荐数超过30万跨越时空、大气磅礴的人类探索太空史诗太空漫游穿越千年， 孤独坚守宇宙尽头“死结”的阴影笼罩整个太阳系，人类文明陷入灭亡边缘。于数百年前乘坐星海号飞船出发，前往南门二星系进行探索的卫风成为了挽救文明的唯一希望。漫长的旅途，千年的孤寂，史前文明留下的神秘遗迹……一幅壮烈的文明史诗画卷即将在卫风眼前展开。,2021-12-23 09:35:44,2021-12-23 09:35:44
9787513343343,明日杀机,https://img3.doubanio.com/view/subject/l/public/s33875520.jpg,刘维佳编,,科幻,新星出版社,明日将至，杀机隐现未来世界，危如朝露惊险科幻，世界科幻发展动力最强的“发动机”13篇新生代惊险科幻小说，精彩绝伦，手难释卷燕垒生 / 韩松 /《流浪地球》编剧严东旭 / 科幻剧导演老算 鼎力推荐——————————惊险科幻，历史悠久，科幻小说开山之作《弗兰肯斯坦》就是惊险科幻，两百年来这一门类经典无数。叶永烈当年成功将中国科幻与惊险小说完美结合，迅速在中国掀起了科幻热潮，功标青史。21世纪的中国新生科幻作家们再接再厉，青出于蓝，在惊险科幻小说领域又做出了一番有声有色的事业，写出了许多惊险科幻佳作。这本《明日杀机》，精心遴选了进入21世纪以来最为精彩的十三篇原创惊险科幻小说。十三个惊心动魄、波谲云诡的惊奇故事，组成了杀机四伏、剑影森森的明日世界。这个五光十色的未来世界里，有外星智慧操纵古人，以匪夷所思的形态藏于九地之下，意欲鸠占鹊巢；有人...,2021-12-23 09:35:51,2021-12-23 09:35:51
9787500748663,八十天周游世界,https://img1.doubanio.com/view/subject/l/public/s27249267.jpg,[法]儒勒·凡尔纳,杨晓舸等,科幻,中国少年儿童出版社,本书将现实和幻想巧妙地结合起来，以生动流畅的语言，扣人心弦的情节，大胆丰富的想象，新奇神秘的场景，包罗万象的科学知识，创作出一个引人入胜的探险故事。,2021-12-23 09:35:59,2021-12-23 09:35:59
9787539978529,神们自己,https://img1.doubanio.com/view/subject/l/public/s27882508.jpg,[美]艾萨克·阿西莫夫,崔正男,科幻,江苏凤凰文艺出版社,22世纪，地球可以和平行宇宙进行物质交换，从此拥有了源源不绝的能源。但是，只有几个人才知道危险的真相：地球上的一个无人信任的科学家、能源渐渐枯竭的星球上的一个外星人、月球上出生的一个拥有预言能力的人类。只有他们知道，人类即将为看似源源不绝的免费能源付出巨大的代价……太 阳即将毁灭，可是无人倾听。真相，永远掌握在极少数人的手里。面对愚昧，神们自己也缄口不言……,2021-12-23 09:36:11,2021-12-23 09:36:11
9787900516176,三体 1,https://img2.doubanio.com/view/subject/l/public/s33661751.jpg,刘慈欣,,科幻,读客文化,军方探寻外星文明的绝秘计划“红岸工程”取得了突破性进展。但在按下发射键的那一刻，历经劫难的叶文洁没有意识到，她彻底改变了人类的命运。地球文明向宇宙发出的一声啼鸣，以太阳为中心，以光速向宇宙深处飞驰……四光年外的“三体文明”百余次毁灭与重生，正被逼迫不得不逃离母星，而恰在此时，他们接收到了地球发来的信息。庞大的三体舰队开始向地球进发，人类的末日悄然来临……,2021-12-23 09:36:24,2021-12-23 09:36:24
9787513322270,夏日遇见狄更斯,https://img2.doubanio.com/view/subject/l/public/s28887611.jpg,[美国]雷·布拉德伯里,刘媛,科幻,新星出版社,如果遇见狄更斯、王尔德、海明威、爱伦·坡……你会对他们说什么？且看老雷借幻想之力穿越时光，复活昔日的文坛巨星，为他们安排另一段精彩人生。幻想文学大师雷•布拉德伯里回顾自己六十年创作生涯，亲自挑选出100个最喜爱的短篇故事汇集成册。这些曾发表在《纽约客》《花花公子》《时尚》等知名杂志上的短篇小说，以奇诡的想象力和惊人的叙事技巧，勾画出一个个异彩纷呈的幻想世界。,2021-12-23 09:36:31,2021-12-23 09:36:31
9787569926910,醉步男,https://img3.doubanio.com/view/subject/l/public/s33499480.jpg,[日]小林泰三,丁丁虫,科幻,北京时代华文书局,本书收录时间旅行小说《醉步男》+日式恐怖小说《玩具修理者》。——————————————血沼，我以后大概都不会和你相遇了。话没说完，小竹田在我眼前消失了。不仅仅是人消失不见，连他放在桌子上的威士忌也消失了。仿佛从头到尾都只有我一个人孤孤单单地坐在酒馆里。一阵寒意袭上身来。大概别人的一生中从 来都不会碰上遇到自己不认识的好友的事，但是我却碰上了。这可真是一件至死都忘不了的事情。不过，这件事情真的发生过吗？那个名叫小竹田的男子——今天第一次见的老朋友，真的存在过吗？看起来，我到底是醉得不轻了。——————————————今后若是论及小林泰三的唯一性，《醉步男》与《玩具修理者》的这本合集会是一个象征性的事件。至今我还能回想起读完《醉步男》时那种真切的眩晕感，在所有的意义上，《醉步男》都是打破定型的作品。——井上雅彦（日本小说家）《醉步男》...,2021-12-23 09:36:42,2021-12-23 09:36:42
,太阳系历险记,https://img1.doubanio.com/view/subject/l/public/s28205567.jpg,[法]儒勒·凡尔纳,惊蛰,科幻,中国青年出版社,,2021-12-23 09:36:48,2021-12-23 09:36:48
9787559435460,老人的战争,https://img1.doubanio.com/view/subject/l/public/s33475057.jpg,[美]约翰·斯卡尔齐,姚向辉,科幻,江苏凤凰文艺出版社,"◆美国读者票选的21世纪科幻小说桂冠！◆当代科幻奇才约翰·斯卡尔齐一鸣惊人的处女作！""老人的战争""六部曲第一部！◆登顶美国科幻出版社Tor读者票选的2000-2010年科幻奇幻小说榜单！◆登顶美国科幻杂志《轨迹》官网读者票选的21世纪科幻小说榜单！◆入选美国国家 公共电台读者票选的历史百大科幻奇幻小说！◆雨果奖、轨迹奖入围作品！该系列一共5次入围雨果奖、轨迹奖！◆世界范围内共发行75个版本，畅销26个国家和地区：美国、英国、西班牙、葡萄牙、法国、意大利、匈牙利、俄罗斯、以色列、波兰、日本、韩国、泰国、中国台湾……◆用疯狂幽默的方式讲述疯狂刺激的太空大战！◆你要相信一切都来得及，任何时候都有更好的人生在等你。-【故事简介】-约翰‧佩里在他七十五岁生日时决定开始自己的新人生，这天他做了两件事：第一件事是给妻子上坟；第二件事是去太空...",2021-12-23 09:36:56,2021-12-23 09:36:56
9787539964188,时间移民,https://img1.doubanio.com/view/subject/l/public/s27760627.jpg,刘慈欣,,科幻,江苏凤凰文艺出版社,中国科幻第一人，九届银河奖得主，《三体》作者刘慈欣作品。未来，迫于环境恶化和人口压力，地球政府决定派出远征队伍，选取25岁以下的人类成员向未来移民。旅行队伍进行了多次停留，但每一次的地球环境都不再适合人类居住，最后一次航程，“大使”把时间定在未来11000年。在这未来的这个时代，地球基本恢复了原始生态，人类开始了新文明的起点。,2021-12-23 09:37:11,2021-12-23 09:37:11
9787539955650,当人类决战机器人2：海伯利安完结篇,https://img2.doubanio.com/view/subject/l/public/s23129691.jpg,[美国]丹·西蒙斯,潘振华,科幻,江苏文艺出版社,《当人类决战机器人2:海伯利安完结篇》内容简介：当机器人产生了自我意识，它会成为人类的仆人、朋友还是敌人？《当人类决战机器人2:海伯利安完结篇》是探讨人类与机器人关系的经典之作。1921年，捷克作家恰佩克由捷克文的“劳役、苦工”(Robota)创造出了一个新词，“机器人”（Robot），人类从此有了“机器人”这个概念；1939年，纽约世博会上展出了第一台家用机器人，它由电缆控制，可以行走，会说77个字，甚至会抽烟，但并不具备实际功能；1942年，科幻宗师阿西莫夫提出了“机器人学三大法则”，学术界自此有了默认的研发原则；1954年，美国人德沃尔制造出第一台可编程机器人，从此，各种机器人被制造出来服务人类；2012年，机器人不仅已成为搬运货物、打扫卫生的苦力，更是老人的看护、孩童的玩伴，在人类世界的各个角落发挥着重要的作用；2030年，人类一如既往地享受...,2021-12-23 09:37:18,2021-12-23 09:37:18
9787500748731,格兰特船长的儿女,https://img9.doubanio.com/view/subject/l/public/s23566185.jpg,[法]儒勒·凡尔纳,谢伟明,科幻,中国少年儿童出版社,格雷凡爵士一言不发地骑在马上，任由坐骑悠悠趋前，众人只知道他很难受，但是无从知道他在想些什么。雅各博士的心里被那些漂瓶文件上的文字塞得满满的，他下决心把每个字的都重新生嚼一遍，一定要品出新味来。塔卡夫的坐骑此刻充当着远征队的向导，因为它的主人此刻没有心思做任何事。麦克少校与其他人相反，脸上没有作何颓丧的表情，他这一辈子难得有承认失败的时候。一向颇为迷信的水手威尔逊与水手莫拉迪此时正在交流着各自心头,2021-12-23 09:37:26,2021-12-23 09:37:26
9787536495241,老威尔的行星,https://img2.doubanio.com/view/subject/l/public/s33496181.jpg,[日]小川一水,丁丁虫等,科幻,四川科学技术出版社,《老威尔的行星》是小川一水的首部科幻中短篇集，收录了四篇质量上乘的作品，讲述不同的智慧生命在极端环境下如何生存。与世隔绝、末日危机、真假人生、无边孤独……从个体、团队到种族，故事主人公将在危机中寻找生机，以及生命的意义。如果你感受过生与死、聚与离，拥有过伙伴又失去，那 么一定能与之共鸣，生出继续成长的勇气。篇目：《加尔纳夫卡迷宫》我们的成就越大，我们的悲哀就越浓。自然和世界本应奖励我们、赐予我们无上的荣耀，但在这个地下迷宫里，荣耀却无从寻觅，我们有的只是无可奈何的空虚。《老威尔的行星》“威尔。我们是威尔。”《幸福之匣》若一个人对人生已有足够的了解，便不会再热衷那样的世界。《漂流者》（日本星云赏获奖作）对我来说，孤独不是过程，而是结局。不是说讨厌孤独就可以不孤独的。,2021-12-23 09:37:33,2021-12-23 09:37:33
9787513329026,神秘博士：美丽的混沌,https://img1.doubanio.com/view/subject/l/public/s29642797.jpg,[英]加里·拉塞尔,王爽,科幻,新星出版社,博士和多娜回到了地球，回到了多娜久违的家中。家里，母亲因孤独而郁郁寡欢；爷爷忙于发现小行星和照顾一位相见恨晚的红颜知己。与此同时，有一位神秘人则用通灵纸片传递信息，迫使博士卷入一次诡异的救援中……,2021-12-23 09:37:39,2021-12-23 09:37:39
9787533944933,安德的影子,https://img2.doubanio.com/view/subject/l/public/s28733023.jpg,[美]奥森·斯科特·卡德,郭卫文,科幻,浙江文艺出版社,【内容简介】★“上帝知道，我愿意替你去死”他默念着祷告。当安德和队员们全力以赴挑战最后的难关时，只有一人早已知晓这背后残酷的真相。他是影子，在英雄如阳光照射大地之时，只有影子能承接必然尾随而至的黑暗。★《安德的游戏》其实，是一个罗生门的故事，更为残酷和悲哀的事实，作者留给了《安德的影子》。【编辑推荐】· 当人类濒临绝境，但你不是救世主。· 当末日来临时，你该怎么做？· 当英雄扛起旗帜之时，你是摇旗呐喊还是与他并肩作战？· 当英雄四面楚歌时，你愿做他的护盾还是刺向他的长矛？· 在真相与友谊面前，你的抉择是什么？·无关大义，为了生存，你愿意成为英雄的影子吗？·《安德的游戏》中没有揭示的秘密，都在《安德的影子》中。·只有读完这一本，你才真正看完了《安德的游戏》。【名人推荐】★在这部小说中，卡德充分满足了读者的预期——而且大大超过...,2021-12-23 09:37:47,2021-12-23 09:37:47
9787536493759,流浪地球,https://img1.doubanio.com/view/subject/l/public/s29989149.jpg,刘慈欣,,科幻,四川科学技术出版社,刘慈欣的短篇小说构思巧妙，想象力纵横恣肆，将坚实的科学基础以及厚重的人文关怀隐藏在灵动精致的故事结构中。本集精选出刘慈欣的十一篇短篇小说，其中《朝闻道》《流浪地球》《乡村教师》《中国太阳》《全频带阻塞干扰》均获银河奖。《流浪地球》《乡村教师》已被改编为电影。《带上她的眼睛》入选人教版七年级下学期《语文》教材。本书封面插画为《流浪地球》同名电影海报。,2021-12-23 09:37:54,2021-12-23 09:37:54
9787532759675,生命，宇宙以及一切,https://img3.doubanio.com/view/subject/l/public/s23126730.jpg,(英)道格拉斯·亚当斯,姚向辉,科幻,上海译文出版社,有理论声称，若是有谁真的搞清楚了宇宙为何存在、因何存在，宇宙就会立刻消失，取而代之的则是更怪异、更难以说明的东西。另有理论声称，此事已经发生过了。……一颗位于银河边陲、名叫“坂裘”的不起眼行星突然向整个银河系发动了灭绝袭击，原因只是由于它忽然发现了银河系的存在。在此之前，坂裘人始终以为他们孤独地生活在宇宙之中，因为这颗星球被重重尘埃星云包围。坂裘军队是一帮白色机器人，所持武器在我们看来无比类似板球拍和板球。为此，银河系的其他星球始终对地球敬而远之。因为我们打板球。,2021-12-23 09:38:03,2021-12-23 09:38:03
9787539194837,蚂蚁帝国,https://img2.doubanio.com/view/subject/l/public/s27301691.jpg,(法)贝尔纳·韦伯,敖敏,科幻,二十一世纪出版社,《蚂蚁帝国》三部曲分别是《蚂蚁帝国》《蚂蚁时代》《蚂蚁革命》，讲述在漫长的蚂蚁族群战争中，褐蚁联邦意欲成为蚂蚁世界乃至整个地球的霸主与人类世界之间进行的血雨腥风、惊心动魄的故事。蚂蚁这种老幼皆知且无人重视的微小昆虫，在本书中被塑造成地球上两大社会文明之一，并与人类社会文明相提并论。小说从地球生态平衡的高度，描写了人类和蚂蚁这两大社会文明在确定谁是地球真正主人的竞争中，从接触、冲突到合作的史诗般的过程，同时首次向人们彻底揭示了蚂蚁社会文明既神秘迷人又惊心动魄的“地球内部世界”。作者依据精深的蚂蚁生态学知识，采用拟人化的手法，将读者带入了一个宏伟壮观、不可思议的蚂蚁帝国……第一部简介：在漫长的蚂蚁族群战争中，褐蚁联邦成为蚂蚁世界的霸主，建立了宏大的蚂蚁帝国，拥有无上至尊的地位。然而那个有关“手指”（人类）的古老传说恐吓着一代又一代蚁群。为了证明蚁族才是...,2021-12-23 09:38:09,2021-12-23 09:38:09
9787519221911,尼乌尔克1.黑孩儿,https://img2.doubanio.com/view/subject/l/public/s29389243.jpg,[法]奥利维耶•瓦提纳（OlivierVatine）,卞文佳,科幻,世界图书出版公司,在生化灾难发生的数世纪后，海洋枯竭，人类退化到原始阶段，仅存了几个未开化的部落。其中的一个部落是由窦兹率领的。在这个部落中，生活着一个黑孩儿，受到部落其他人的排斥。部落的老人家宣布要去古巴的圣地亚哥朝圣众神，那里是众神的领地。老人家在出发之前宣判了黑孩儿的命运：等他回来，就是黑孩儿的死期。但是老人家没回来……黑孩儿决定去寻找老人家，但他不知道的是，他将会在旅途中发现二十世纪的文明遗迹……,2021-12-23 09:38:16,2021-12-23 09:38:16
9787521735727,沙丘,https://img3.doubanio.com/view/subject/l/public/s34047020.jpg,[美]弗兰克·赫伯特（原著）,刘勇军,科幻,中信出版社,《沙丘》（第一部）漫画正式出版！★科幻史上同时荣获雨果奖、星云奖的双冠之作，绝对不可错过的科幻经典！★影响《星球大战》《阿凡达》《冰与火之歌》等超多科幻巨著的重量级读物，现代科幻的里程碑之一。★同名电影由甜茶、“灭霸”乔什·布洛林、张震等人主演，国内即将上映！★猩红辽旷的沙漠星球，冰与火的权力之争，未来生态的科技迷思，漫画的故事与画风都忠实还原那个充满冒险、权力、宗教和生态的原著《沙丘》宇宙，为读者带来复古又无可替代的视觉盛宴！,2021-12-23 09:38:22,2021-12-23 09:38:22
9787536483286,奥杜瓦伊峡谷的七个故事,https://img1.doubanio.com/view/subject/l/public/s28923287.jpg,[美国]迈克·雷斯尼克,袁枫,科幻,四川科学技术出版社,本书精选美国著名科幻作家迈克•雷斯尼克中短篇小说二十二篇，其中包括雨果奖、星云奖等世界科幻大奖的获奖及提名作品。这些作品不仅代表了雷斯尼克的最高水平，也是世界科幻文学宝库中的珠玉之作，其精巧的构思、深邃的思想令人过目难忘。《奥杜瓦伊峡谷的七个故事》以外星人的视角，深刻剖析了人性的温暖与丑恶，令人掩卷恻然；《游子还乡》中，无论外形如何变化，行至宇宙哪个角落，亲情仍旧将人类紧紧相连……这些故事，不仅展示了宇宙的广袤无垠，更对人类情感进行了细致入微的刻画。,2021-12-23 09:38:29,2021-12-23 09:38:29
9787536473966,天堂的喷泉,https://img9.doubanio.com/view/subject/l/public/s9126855.jpg,【英】阿瑟·克拉克,陈经华,科幻,四川科学技术出版社,两千年前，在赤道附近的岛国塔普罗巴尼发生了一场血腥的宫廷政变，暴君卡利达萨借机上台。此人并不满足于人间的欢乐，他要在高山之巅建造天国，向天神挑战，由是诞生了“天堂的喷泉”。两千年后，国王与帝国早已化为尘土，人类迈向了太空时代。为方便快捷地进入太空，工程师摩根要在“天堂的喷泉”旧址建造登天电梯，实现前人未曾实现的梦想。但摩根要面对的，除了世俗舆论、宗教僧侣的轮番挑战，还有无穷的技术困难。这是一首歌颂人类精神的伟大赞歌，是科幻“黄金时代”最宝贵的精神财富。,2021-12-23 09:38:37,2021-12-23 09:38:37
,鲵鱼之乱,https://img2.doubanio.com/view/subject/l/public/s3899801.jpg,卡・恰佩克,贝京,科幻,人民文学出版社,长篇幻想小说《鲵鱼之乱》是对资本主义世界及帝国主义法西斯的全面、深刻的揭露与讽刺，是作者面临法西斯威胁对人类发出的严重警告。这部小说的故事情节纯属虚构，说的是在印度尼西亚群岛上偶然发现的一种鲵鱼的历史。资本家把这些样子像人、十分机敏的动物当作廉价劳动力培殖起来采珍珠、从事水下建筑。鲵鱼不仅逐渐掌握了人的技术，而且也掌握了法西斯思想，到后来，竟然拿着从人那儿得来的武器，袭击大陆，并要求扩充海面、淹没大陆、毁灭人类。最后通过作者幻想的鲵鱼统一体的自身瓦解和互相残杀，才出现人类复苏的希望。,2021-12-23 09:38:44,2021-12-23 09:38:44
9787550291225,黑暗的左手,https://img1.doubanio.com/view/subject/l/public/s29630049.jpg,[美国]厄休拉·勒古恩,陶雪蕾,科幻,北京联合出版公司,在寒冷的冬星上，生活着一群无性人，他们可以自由选择自己的性别。在每月的一个特别日子，他们自由成为男人或女人。一名星际联盟特使，被派往冬星，完成一个秘密使命。然而，冬星上的一切——怪异的风俗、古老的传说、混乱的政局，无不冲击着特使固有的观念。面对陌生的一切，孰是孰非，他该如何面对？在宇宙尽头的陌生人身上，看到了另一个自己。编辑推荐◆	不愧是世界幻想文坛的传奇女王！◆	6次雨果奖、6次星云奖、21次轨迹奖、世界奇幻奖、美国国家图书奖、美国文学杰出贡献奖、卡夫卡奖、纽伯瑞奖、号角书奖、小詹姆斯•提普翠奖！◆	美国科幻奇幻作家协会“大师”称号、作家与艺术家中的“在世传奇”、“奇幻小说三巨头”之一！◆	在宇宙尽头的陌生人身上，看到了另一个自己。◆	刘慈欣：《黑暗的左手》这本书很文学，但是对人性的描写多了一个角度，因为作品中一个人就有两个性别...,2021-12-23 09:38:53,2021-12-23 09:38:53
9787534348662,少数派报告,https://img9.doubanio.com/view/subject/l/public/s1097406.jpg,[美国]菲利普·迪克,曾鸣,科幻,江苏教育出版社,少数派报告，ISBN：9787534348662，作者：（美）菲利普·迪克（Philip K.Dick）著；曾鸣译,2021-12-23 09:39:00,2021-12-23 09:39:00
9787500608837,格兰特船长的儿女,https://img1.doubanio.com/view/subject/l/public/s1274169.jpg,儒勒.凡尔纳(法),范希衡,科幻,中国青年出版社,很佩服凡尔纳的文学功底和丰富的知识，当你读这本小说时仿佛你也深入其中，你会为他们的一举一动感到兴奋或着急。他们是多么勇敢与乐于助人啊……一个从鲨鱼肚中发现的漂流瓶让他们走上这条艰苦的冒险之路，换位想一想，如果是你经历这样的情况呢？你会不会推辞道：“嗨，这已经是老事了，信纸都被海水给侵蚀了，说不定人都已经死了，我们还为什么要卖力去就一个生死未卜的人呢？”我承认，如果是我，我也不一定会像这群勇敢的人们，为了一个素不相识的人而放弃一切踏上这条旅程。这是一种精神，虽然这个故事是作者虚构的，但每一个故事的灵魂都是要告诉人们一些我们知道，但不一定能够办到的精神……格兰特船长会得救吗？这群勇敢的志者会遇到危险吗？大家会不会中途放弃呢？这一切的一切都是一个未知……而我们的人生，不也是等待着一个一个未知的成功与失败的到来吗……,2021-12-23 09:39:08,2021-12-23 09:39:08
