9787530130155,可怕的科学,https://img9.doubanio.com/view/subject/l/public/s10244455.jpg,,,科学,北京少年儿童出版社,三度荣获国际科普图书安万特青少年奖。全球热销千万册版权销售至25个国家和地区。亚马逊网五星级评论。名校名师特别推荐。北京科普创作出版专项资金资助。,2021-12-21 17:42:43,2021-12-21 17:42:43
9787301272121,基础有机化学 上册,https://img1.doubanio.com/view/subject/l/public/s28949317.jpg,邢其毅,,科学,北京大学出版社,本书在2005年出版的《基础有机化学》（第3版）基础上修订而成。全书共27章。上册13章，主要介绍： （1）有机化学的起源和发展简史；（2）有机化合物系统命名、静态立体化学、光谱等基本知识；（3）烷烃、烯烃、炔烃、卤代烃、醇、醚、醛、酮、羧酸及羧酸衍生物等各类化合物的结构、性质和合成等；（4）自由基取代反应、饱和碳原子上的取代反应、酰基碳原子上的取代反应、自由基加成反应、亲电加成反应、亲核加成反应、周环反应、β-消除反应、缩合反应等基本反应。      下册14章，主要介绍：（1）胺、杂环化合物、芳香化合物、酚、醌等各类化合物的结构、性质和合成等；（2）芳香亲电和亲核取代反应、氧化反应、重排反应以及过渡金属参与的有机反应等；（3）生物分子的结构、性质和在自然界中生命体中的作用等；（4）对逆合成的分析；（5）文献资料的检索方法等。      本书除保留...,2021-12-21 17:42:49,2021-12-21 17:42:49
9780201021158,The Feynman Lectures on Physics,https://img9.doubanio.com/view/subject/l/public/s1439985.jpg,RichardPhillipsFeynman,,科学,AddisonWesleyLongman,我们心中的英雄是--Richard Feynman,2021-12-21 17:42:56,2021-12-21 17:42:56
9787501160853,智障儿童学写字,https://img2.doubanio.com/view/subject/l/public/s4047972.jpg,,,科学,新华出版社,智障儿童学写字，ISBN：9787501160853，作者：，出版社：新华出版社,2021-12-21 17:43:02,2021-12-21 17:43:02
9787538813609,世界真奇妙,https://img9.doubanio.com/view/subject/l/public/s3570775.jpg,姜云明主编,,科学,黑龙江科学技术出版社,,2021-12-21 17:43:07,2021-12-21 17:43:07
9787534217029,最新21世纪少年儿童百科,https://img2.doubanio.com/view/subject/l/public/s26691253.jpg,日本株式会社小学馆,赵云飞等,科学,浙江少年儿童出版社,,2021-12-21 17:43:13,2021-12-21 17:43:13
9787553679624,野鸟形态图鉴,https://img1.doubanio.com/view/subject/l/public/s32312878.jpg,[日]赤勘兵卫,赵天,科学,后浪丨浙江教育出版社,关于51种野鸟的翼、足、喙、眼自然观察者用画笔记录下的飞羽邂逅◎ 编辑推荐鸟类观察爱好者作为博物学领域的先行者之一，在细化和深化鸟类观察技巧的同时，也在公民科学的理念之下，为严谨的鸟类学研究贡献各自的发现所得。本书集科学绘画、自然保育与鸟类形态学于一身，是自然观察与视觉艺术的绝佳结合。◎ 内容简介从20世纪90年代开始，本书的作者便开始为日本面向鸟类爱好者的月刊《观鸟》（Birder）连载鸟类观察的文章与图画创作。在本书中，他与一直参与救助受伤野鸟的大山先生合作，用细致的画笔描绘出各种野鸟的形态细节。本书主要分为正文与解说两部分，正文描绘了不同类群鸟的羽毛分区、翅及尾的内外形态，对鸟的喙、足、须、鳞、距等特征都进行了翔实的描绘；解说部分主要涉及野鸟的分布、生态和历史等，是较为综合性的介绍。另外，本书提供了详细且精确的测量数据，如“翼长”“...,2021-12-21 17:43:19,2021-12-21 17:43:19
9787303114863,珍爱生命,https://img3.doubanio.com/view/subject/l/public/s33520370.jpg,刘文利主编,,科学,北京师范大学出版社,《珍爱生命—小学生性健康教育读本》（一年级上册）共分三个单元：（1）家庭与朋友；（2）生活与技能；（3）性别与权利。在“家庭与朋友”单元，有“热爱家庭”和“珍视友谊”2个主题。人与人之间的关系在儿童的生活中起着重要的作用。儿童刚进入小学一年级，对陌生的环境既感觉到新鲜又有些不安。“热爱家庭”和“珍视朋友”两个主题，在挖掘儿童已有的对家庭和友谊的经验上，使他们通过观察、体验和思考，更加深入地理解家庭对生活的重要意义以及友谊的宝贵。“热爱家庭”帮助儿童在热爱家庭的情感基础上，了解家庭的概念，理解家庭成员都需要遵守由家庭成员共同制定的家庭规矩，并学会如何尊重父母。“珍视朋友”帮助儿童了解什么是朋友，什么人可以成为朋友；知道友谊的可贵。在掌握学会与朋友友好相处的能力上，体验拥有朋友的快乐和幸福，形成珍视友谊的意识。在“生活与技能”单元，有“学做决定...,2021-12-21 17:43:25,2021-12-21 17:43:25
9787547816370,费恩曼物理学讲义（第2卷）,https://img2.doubanio.com/view/subject/l/public/s26655863.jpg,R.P.Feynman,李洪芳,科学,上海科学技术出版社,本书为量子力学，系美国著名物理学家为本科生所作的演讲。本书共分三卷，第一卷包括力学、相对论、光学、气体分子运动理论、热力学、波等。第二卷主要是电磁学，第三卷为量子力学。,2021-12-21 17:43:31,2021-12-21 17:43:31
9787040243062,量子力学,https://img2.doubanio.com/view/subject/l/public/s28095393.jpg,Л.Д.朗道,严肃,科学,高等教育出版社,《量子力学(非相对论理论)(第6版)》是《理论物理学教程》的第三卷，根据俄文最新版译出，讲述非相对论量子力学，共计18章和1个数学附录，内容包括量子力学的基本概念和原理，近似方法，对称性和角动量理论，原子分子和原子核以及散射理论。,2021-12-21 17:43:39,2021-12-21 17:43:39
9787229101220,自然哲学的数学原理,https://img2.doubanio.com/view/subject/l/public/s28650352.jpg,艾萨克·牛顿,任海洋,科学,"重庆出版社,重庆出版集团",《自然哲学的数学原理》是牛顿的科学才华处于巅峰时期所写的旷世巨著，是他“个人智慧的伟大结晶”。牛顿不但总结出了力学的基本定律，而且还发现了证明这些定律的数学方法，奠定了数学成为描述宇宙运动的语言的基础。在《自然哲学的数学原理》之后，人类在自然科学中的伟大成就层出不穷，但这些成就无一不与这部非凡的著作息息相关。牛顿提供了科学思维体系的样板。《自然哲学的数学原理》标志着经典力学体系的建立，是人类科学史乃至整个人类文明史中的不朽巨著。《自然哲学的数学原理》不仅影响着自它面世后的300年里的自然科学领域，而且对人类的宇宙观也产生了深刻的影响。,2021-12-21 17:43:46,2021-12-21 17:43:46
9787530113363,可怕的科学（共57册）,https://img9.doubanio.com/view/subject/l/public/s1345715.jpg,尼克·阿诺德,阎庚,科学,北京少年儿童出版社,紧密配合最新课标，精选世界科普经典。囊括科学新知+体验科学历程。,2021-12-21 17:43:52,2021-12-21 17:43:52
9787532378753,费恩曼物理学讲义 第3卷,https://img1.doubanio.com/view/subject/l/public/s1514178.jpg,RichardP.Feynman,潘笃武,科学,上海科学技术出版社,20世纪60年代初，美国一些理工科大学鉴于当时的大学基础物理教学与现代科学技术的发展不相适应，纷纷试行教学改革，加利福尼亚理工学院就是其中之一。该校于1961年9月至1963年5月特请著名物理学家费恩曼主讲一二年级的基础物理课，事后又根据讲课录音编辑出版了《费恩曼物理学讲义》。本讲义共分三卷，第1卷包括力学、相对论、光学、气体分子动理论、热力学、波等，第2卷主要是电磁学，第3卷是量子力学。全书内容十分丰富，在深度和广度上都超过了传统的普通物理教材。当时美国大学物理教学改革试图解决的一个主要问题是基础物理教学应尽可能反映近代物理的巨大成就。《费恩曼物理学讲义》在基础物理的水平上对20世纪物理学的两大重要成就——相对论和量子力学——作了系统的介绍，对于量子力学，费恩曼教授还特地准备了一套适合大学二年级水平的讲法。教学改革试图解决的另一个问题是按照当前物...,2021-12-21 17:44:00,2021-12-21 17:44:00
9787540471248,中国科幻基石丛书·三体（全三册）,https://img1.doubanio.com/view/subject/l/public/s29857148.jpg,刘慈欣,,科学,重庆出版社,文化大革命如火如荼进行的同时，军方探寻外星文明的绝秘计划“红岸工程”取得了突破性进展。但在按下发射键的那一刻，历经劫难的叶文洁没有意识到，她彻底改变了人类的命运。地球文明向宇宙发出的一声啼鸣，以太阳为中心，以光速向宇宙深处飞驰……四光年外，“三体文明”正苦苦挣扎—— 三颗无规则运行的太阳主导下的百余次毁灭与重生逼迫他们逃离母星。而恰在此时，他们接收到了地球发来的信息。在运用超技术锁死地球人的基础科学之后，三体人庞大的宇宙舰队开始向地球进发……人类的末日悄然来临。《三体》的幻想源于经典物理中的三体问题，即三个体积质量相当的天体，在远离其它星系以致其它星系的引力影响可忽略不计的情况下，三个天体在互相引力的作用下互相围绕运行，其运行轨迹将产生不可预测的混沌。很多年来，数学家们一直希望能建立三体乃至多体问题的数学模型，可遗憾的是，得到的结果仅仅是三体...,2021-12-21 17:44:08,2021-12-21 17:44:08
9787513337533,格微济世（医学大神14）,https://img9.doubanio.com/view/subject/l/public/s33505205.jpg,朱石生,,科学,新星出版社,“医学大神”系列以十四册、九十万字的体量，忠实再现四百年现代医学史，精细描摹十四位业界传奇大神，并穿插解说医学科普知识，是一套集传记、历史、科普于一身的大众读物。本册介绍极负盛名的青霉素和更负盛名的弗莱明，以及寂寂无名的弗洛里团队。以下是作者为本册撰写的导读：1848 年，弗莱明访问西班牙巴塞罗那。一位激动的市民冲出人群，到弗莱明面前跪下亲吻他那件博士长袍的下摆。西班牙科学专栏作家马拉农给弗莱明写完一篇简介，然后发表感言：“此时此刻，我确定弗莱明就坐在天父的身边。”人们对弗莱明如此敬仰，因为“人人都知道，是弗莱明发现了青霉素”。这个提法，正如同“地球围着太阳转”一样，都是不言自明的真理。而青霉素拯救的生命何止千百万。垂死的败血症患者，只要有了青霉素，一夜之间就能转危为安。的确，1928年，弗莱明注意到青霉斑点对金黄色葡萄球菌的抑制作用，也...,2021-12-21 17:44:15,2021-12-21 17:44:15
9787532378784,费恩曼物理学讲义（第1卷）,https://img1.doubanio.com/view/subject/l/public/s1475298.jpg,RichardP.Feynman,王子辅、李洪芳、钟万蘅,科学,上海科学技术出版社,20世纪60年代初，美国一些理工科大学鉴于当时的大学基础物理数学与现代科学技术的发展不相适应，纷纷试行教学改革，加利福尼亚理学院就是其中之一。该校于1961年9月至1963年5月特请著名物理学家费恩曼主讲一二年级的基础物理课，事后又根据讲课录音编辑出版了《费恩曼物理学讲义。本讲义共分三卷，第1卷包括力学、相对论、光学、气体分子运动论、热力学、波等，第2卷主要是电磁学，此外还有性、流体的流动及弯曲空间等内容，第3卷是量子力学。全书内容十分丰富，在深度和广度上都超过了传统的普通物理教材。        当时美国大学物理教学改革试图解决的一个主要问题是，基础物理教学应尽可能反映近代物理巨大成就。《费恩曼物理学讲义》在基础物理的水平上对20世纪物理学的两大重成就——相对论和量子力学做了系统的介绍，对于量子力学，费恩曼教授还特地准备了套适合大学二年级水平的...,2021-12-21 17:44:27,2021-12-21 17:44:27
9787805018775,演化,https://img2.doubanio.com/view/subject/l/public/s28361823.jpg,[法]让-巴普蒂斯特·德·帕纳菲厄,邢路达,科学,北京美术摄影出版社,《演化》并非一般意义上的摄影艺术画册，本书由生物学专家编撰，严谨而平实的文字结合骨骼照片，将脊椎动物的演化历史娓娓道来。《演化》也非严格意义上的科普作品，摄影师藉由黑白摄影再现博物馆中的骨骼标本，从艺术的层面，创作方式已先于创作内容表达了艺术家的创作意图。《演化》全书分为六篇，共有44章，从不同动物身体的结构对比入手，再依次讲述生物物种形成的机理、自然选择（包括性选择）的神奇力量、生物结构发生改变的过程和机理、环境对生物演化的塑造，以及演化与时间。从中读者不仅可以了解到许多现代脊椎动物的知识，而且还可以熟悉一些生物演化历史上最为重要的化石和事件。作者还恰如其分地讨论了自然选择和性选择的关系，并且批评了社会达尔文主义者对达尔文科学理论的滥用和曲解。艺术与科学结合，既是对博物学传统的回溯，也是科学传播新的发展方向。《演化》作为一部在内容与形式上都追求...,2021-12-21 17:44:34,2021-12-21 17:44:34
,从一到无穷大,https://img2.doubanio.com/view/subject/l/public/s3506792.jpg,（美）G·伽莫夫,暴永宁,科学,科学出版社,在写法上，《从一到无穷大》与其他常见的按主题分类来写作的科普著作不同，伽莫夫完全是一种大家的写作风格，把数学、物理乃至生物学的许多内容有机地融合在一起，仿佛作者是想到哪说到哪，将叙述的内容信手拈来，其实，仔细思考，就会感觉到其中各部分内容之间内在的紧密关系。一般科普读物，往往怕数学太“枯燥”和“艰深”而不敢使用它，只局限于做定性的概念描述。这本书则恰恰相反，全书都用数学贯穿起来，先漫谈一些基本的数学知识，然后用一些有趣的比喻，阐述了爱因斯坦的相对论和四维时空结构，并讨论了人类在认识微观世界（如基本粒子、基因等）和宏观世界（如太阳系、星系等）方面的成就。,2021-12-21 17:44:43,2021-12-21 17:44:43
9787100067676,爱因斯坦文集（第一卷）（增补本）,https://img2.doubanio.com/view/subject/l/public/s4234183.jpg,爱因斯坦,许良英等编译,科学,商务印书馆,《爱因斯坦文集(增补本·第1卷)》内容简介：爱因斯坦生长在物理学急剧变革的时期，通过以他为代表的一代物理学家的努力，物理学的发展进入一个新的历史时期。由伽利略和牛顿建立的古典物理学理论体系，经历了将近二百年的发展，到十九世纪中叶，由于能量守恒和转化定律的发现，热力学和统计物理学的建立，特别是由于法拉第和麦克斯韦在电磁学上的发现，取得了辉煌的成就。这些成就，使得当时不少物理学家认为，物理学领域中原则性的理论问题都已经解决了，留给后人的，只能在细节方面作些补充和发展。可是，历史的进程恰恰相反，接踵而来的却是一系列古典物理学无法解释的新现象：以太漂移实验、元素的放射性、电子运动、黑体辐射、光电效应，等等。,2021-12-21 17:44:50,2021-12-21 17:44:50
9787532378746,费恩曼物理学讲义（第2卷）,https://img2.doubanio.com/view/subject/l/public/s2397241.jpg,"（美）RichardP.Feynman,RobertB.Leighton,MatthewSands",桑兹(M.Sands),科学,上海科学技术出版公司,20世纪60年代初，美国一些理工科大学鉴于当时的大学基础物理教学与现代科学技术的发展不相适应，纷纷试行教学改革，加利福尼亚理工学院就是其中之一。该校于1961年9月至1963年5月特请著名物理学家费恩曼主讲一二年级的基础物理课，事后又根据讲课录音编辑出版了《费恩曼物理学讲义》。本讲义共分三卷，第1卷包括力学、相对论、光学、气体分子动理论、热力学、波等，第2卷主要是电磁学，第3卷是量子力学。全书内容十分丰富，在深度和广度上都超过了传统的普通物理教材。当时美国大学物理教学改革试图解决的一个主要问题是基础物理教学应尽可能反映近代物理的巨大成就。《费恩曼物理学讲义》在基础物理的水平上对20世纪物理学的两大重要成就——相对论和量子力学——作了系统的介绍，对于量子力学，费恩曼教授还特地准备了一套适合大学二年级水平的讲法。教学改革试图解决的另一个问题是按照当前物...,2021-12-21 17:44:59,2021-12-21 17:44:59
9787532428380,生命的世界,https://img2.doubanio.com/view/subject/l/public/s2239613.jpg,郝思军,丁志芸（动物篇）,科学,少年儿童出版社,生命的世界 带你进入奇趣迷人的动植物王国　　天空与地球 使你了解神奇奥秘的星空地球　　身边的科学 告诉你周围常见现象的来龙去脉　　人类与社会 帮助你认识人类的自身和过去将来,2021-12-21 17:45:11,2021-12-21 17:45:11
9787040396706,量子力学（第一卷）,https://img9.doubanio.com/view/subject/l/public/s27396544.jpg,C.Cohen-Tannoudji,刘家谟,科学,高等教育出版社,《量子力学(第一卷)》第一作者claude cohen-tannoudji，因发展激光冷却与陷俘原子的方法与朱棣文和w．d．phillips共同获得1997年诺贝尔物理学奖。《量子力学(第一卷)》根据claude cohen-tannoudji和bernard diu、franck laloe三人合著的法文第二版译出。原书共两卷，第一卷内容有：量子力学的基本概念，量子力学的数学工具，量子力学的假定和简单应用，一维谐振子，角动量的普遍性质，中心势场中的粒子，氢原子。每章都有丰富的补充材料。本书叙述详细，物理概念清晰，便于自学。《量子力学(第一卷)》可作为我国高等院校物理及有关专业高年级本科生及研究生学习量子力学的参考书，也可供有关专业教师和科研人员参考。,2021-12-21 17:45:18,2021-12-21 17:45:18
9780345376596,Pale Blue Dot,https://img2.doubanio.com/view/subject/l/public/s4320021.jpg,CarlSagan,,科学,BallantineBooks,FASCINATING . . . MEMORABLE . . . REVEALING . . . PERHAPS THE BEST OF CARL SAGAN'S BOOKS.--The Washington Post Book World (front page review),2021-12-21 17:45:26,2021-12-21 17:45:26
9781439107959,The Emperor of All Maladies,https://img9.doubanio.com/view/subject/l/public/s4560494.jpg,SiddharthaMukherjee,,科学,Scribner,"Starred Review. Mukherjee's debut book is a sweeping epic of obsession, brilliant researchers, dramatic new treatments, euphoric success and tragic failure, and the relentless battle by scientists and patients alike against an equally relentless, wily, and elusive enemy. From the first chemotherapy developed from textile dyes to the possibilities emerging from our understanding...",2021-12-21 17:45:36,2021-12-21 17:45:36
9787108063151,科学作为天职,https://img1.doubanio.com/view/subject/l/public/s33539058.jpg,李猛编,,科学,生活·读书·新知三联书店,1917年11月7日，马克斯·韦伯在德国的慕尼黑大学向年青学子们做了《科学作为天职》的著名演讲，这篇演讲对科学工作及其与信仰和职业伦理的关系做了深刻而又有现实感的界定和剖析，影响了几代人，也成了韦伯常销不衰的代表作。为了纪念一百年前的这篇演讲，韦伯研究者李猛以“我们时代的命运” 为核心关切，编选了这本与韦伯对话的文集：不仅全新精译了演讲全文，收录了六篇韦伯同时代人对此篇演讲的批评与回应；还组织国内学人如渠敬东、应星和田耕等为文诠释韦伯当年的思考，直面当下中国日益严峻的学术体制化与专业化困局，借助经典的力量来审视自己的现实处境，为学术研究寻找信仰和职业的基础。,2021-12-21 17:45:44,2021-12-21 17:45:44
9787532428366,身边的科学,https://img9.doubanio.com/view/subject/l/public/s3205326.jpg,BarbaraReseigh,盛蕙（科学篇）,科学,少年儿童出版社,,2021-12-21 17:45:50,2021-12-21 17:45:50
9787100167277,圣经、新教与自然科学的兴起,https://img9.doubanio.com/view/subject/l/public/s32265875.jpg,[澳]彼得·哈里森,张卜天,科学,商务印书馆,理解科学与宗教的关系对于深入理解西方近代科学的兴起或科学革命起着至关重要的作用。彼得·哈里森是目前研究科学与宗教关系的顶尖学者，在这本书中，他考察了圣经在自然科学的兴起过程中所起的作用，显示了圣经的内容，尤其是它被诠释的方式，对公元3世纪到17世纪的自然观产生了深远的影响。近代科学的兴起与新教处理文本的方法有关，这种方法宣告了中世纪象征世界的结束，为科学地研究自然和用技术开发自然确立了条件。,2021-12-21 17:45:56,2021-12-21 17:45:56
9787040236088,物理学的概念与文化素养,https://img3.doubanio.com/view/subject/l/public/s3796670.jpg,[美]ArtHobson,秦克诚,科学,高等教育出版社,《物理学的概念与文化素养（第4版）（ 翻译版）》是Physics： Cormepts&Contaections（第四版）的中文翻译版；原书是一本在美国十分流行并广受好评的文科物理教材。作者Art Hobson三十多年来怀着提高公众科学素养的强烈使命感，孜孜以求，致力于对文科学生的科学素养教育。他主张教给学生最新的物理学，注重讲清楚物理概念和建立鲜明的物理图像，采用不用数学的概念式教学；他积极涉及社会生活中与物理学有关的诸多热点问题，如臭氧枯竭、全球变暖、技术风险、能源、核动力、核武器、伪科学等。作者由于本书和他提倡讲授与科学有关的社会论题，于2006年获得美国物理教师协会颁发的密立根奖。在美国有130多所学校采用这本书作为文科物理教材。《物理学的概念与文化素养（第4版）（ 翻译版）》的译者和原作者是十多年的老友。在翻译过程中，译者严谨推敲，与作者配...,2021-12-21 17:46:03,2021-12-21 17:46:03
9787502575151,免疫学概览,https://img1.doubanio.com/view/subject/l/public/s1538129.jpg,L.松佩拉克,,科学,化学工业,免疫学是一门较难学习的学科，其中包含了大量复杂的机制。本书以生动的语言、幽默的表述，用“演讲”方式，试图使读者对免疫学无处不在的细节有更深刻的理解，使读者建立免疫系统全景式的大画卷，真正做到享受学习免疫学的乐趣。本书共9讲，分别讲述了健康状态下的免疫系统中的先天免疫系统、B细胞和抗体、抗原呈递、T细胞和细胞因子、淋巴器官和淋巴细胞运输、耐受诱导和MHC限制性，以及疾病状态下的免疫系统中的免疫病理学和癌症与免疫学的关系等。    本书可作为高年级本科生和研究生免疫学核心教材，也可作为其他教材的配套用书。同时，本书还是一部轻松、快速掌握免疫学的考试复习用书。,2021-12-21 17:46:10,2021-12-21 17:46:10
9787544722841,几何原本,https://img9.doubanio.com/view/subject/l/public/s7009864.jpg,(古希腊)欧几里得,兰纪正,科学,译林出版社,《汉译经典037:几何原本》是世界上最著名、最完整且流传最广的数学著作，也是欧几里得最有价值的传世著作。欧几里得在《汉译经典037:几何原本》中，系统地总结了泰勒斯、毕达哥拉斯及智者派等前代学者在实践和思考中获得的几何知识。欧几里得建立了定义和公理并研究各种几何图形的性质，从而确立了一套从公理、定义出发，论证命题得到定理的几何学论证方法，形成了一个严密的逻辑体系——几何学。而《汉译经典037:几何原本》也就成了欧氏几何的奠基之作，它的出现，对西方人的思维方式产生了深刻影响。,2021-12-21 17:46:19,2021-12-21 17:46:19
