9787532770137,明日的餐桌,https://img9.doubanio.com/view/subject/l/public/s28360195.jpg,［美］帕梅拉•罗纳德,蒋显斌,科学,上海译文出版社,《明日的餐桌》是一本有趣的科学人文读物，探讨的是人类未来的生存问题。本书提出，有机农业和基因工程技术有可能相结合，从而帮助可持续农业的发展，解决未来的粮食问题，共同造福人类。本书的两位作者是一对来自美国加州大学戴维斯分校的夫妻，帕梅拉•罗纳德是一位植物病理学家，丈夫拉乌尔•亚当查克是一位有机农场主，而本书论及的两大内容，有机农业和转基因作物之间，也如同他们的婚姻，不仅没有冲突，反而可以共存，互补。本书提供的种种信息、数据，提出的观点，都诞生于两位专家的日常生活，帕梅甚至在书中展示了以他们种植的作物为原料制作的美食（食谱），并且解释了他们为什么选择这些食物。同时，也记录了在他们的生活中，和学生、邻居、亲朋好友之间发生的关于“转基因食品是否对人类健康存在威胁”的争论。本书为那些关心家人健康，关注地球未来的人而写。,2021-12-21 19:17:15,2021-12-21 19:17:15
9787559644183,像火箭科学家一样思考,https://img1.doubanio.com/view/subject/l/public/s33742618.jpg,【美】奥赞·瓦罗尔,李文远,科学,北京联合出版公司,这个世界正在以令人眼花缭乱的速度变化发展，每个人在日常生活中都会遇到复杂和陌生的问题。在没有明确指导方针且时间紧迫的情况下，那些能够像火箭科学家一样思考，并去解决问题的人，无疑享有非凡优势。或许不能人人都成为火箭科学家，但人人都能掌握火箭科学家的思维方式。刨去艰涩的专业知识，隐藏在火箭科学这一难懂学科背后的，是足以改变我们生活的创造力和批判性思维。它将指引我们——突破固有思维的局限，另辟蹊径，激发创意；对创意进行提炼和重构，并敲打测试它的可行性，以降低失败的风险；客观看待失败与成功，从成败的经验中激发更大的潜能。当你像火箭科学家那样处理日常问题，你将成为自己人生的主宰，质疑各种假设和陈规旧习，并树立起自己的思维模式。当别人看到重重困难时，你看到的却是各种机遇，并且使现实服从你的意愿。你将理性地处理问题，制订创新的解决方案，重新定义现...,2021-12-21 19:17:21,2021-12-21 19:17:21
9787549581962,免疫,https://img1.doubanio.com/view/subject/l/public/s28919877.jpg,【美】尤拉·比斯,彭茂宇,科学,广西师范大学出版社,本书由三十篇文笔优雅、思想深入的文章构成，讨论了众所关注的“免疫”及“接种”等问题。本书作者尤拉·比斯新为人母时，这个全新角色使得她陷入了妈妈们常有的一种焦虑当中：对政府和医疗机构无法完全信任，担心孩子呼吸的空气、吃的食物、用的床垫、吃的药以及使用的疫苗中究竟是什么……她发觉人们实际上是无法让自己的孩子或者自己“对这个世界免疫”的，于是，她开始了一场针对“免疫”的细致的调研，而本书则是她研究内容的集结，本质上，也是与新父母们，以及社会大众的诚恳交谈——谈信任问题，谈取舍问题，谈科学的可贵，以及人们有时候的急功冒进。比斯正视了现代社会中人们的共同忧虑，她理解这种焦虑正是面对诸多信息来源，面对人类自身的偏见、脆弱、不能相互信任，以及面对永恒的不可知与不断变化的外部世界时的一种无力反应。然后她在书中告诉我们：每一个个体其实都在一次次地面对着生命中的重要...,2021-12-21 19:17:29,2021-12-21 19:17:29
9787807633129,爱因斯坦信上帝吗？,https://img1.doubanio.com/view/subject/l/public/s3911509.jpg,方舟子,,科学,广西科学技术出版社,要真正了解科学史，就读《爱因斯坦信上帝吗？(方舟子解读科学史著名谜团)》！★当代中国最有影响力的科普作家方舟子最新力作！《爱因斯坦信上帝吗？(方舟子解读科学史著名谜团)》汇集《经济观察报》《中国青年报》等一流媒体科普专栏文字精华，为方舟子博士力辨科学史真相的权威力作。★困惑人们多年的科学史谜团，究竟还有哪些是我们所不知道的真实？在课堂上，你的老师绝不可能告诉你这些事儿！★中国科学院院士何祚庥、北京大学生命科学学院院长饶毅、清华大学教授赵南元联袂推荐★《爱因斯坦信上帝吗？(方舟子解读科学史著名谜团)》出版前，中信出版社、广西师范大学出版社、人民日报出版社等多家知名出版社纷纷向作者邀约此书出版。科普作家方舟子以独特的视角逐一透视科学史上的著名谜团！在课堂上，你的老师绝不可能告诉你这些事儿！,2021-12-21 19:17:36,2021-12-21 19:17:36
9787544247214,大象的时间，老鼠的时间,https://img2.doubanio.com/view/subject/l/public/s4363312.jpg,(日)本川达雄,乐燕子,科学,南海出版公司,为什么大象总是慢悠悠的，老鼠却匆匆忙忙？为什么掉在陷坑里，马会骨折，老鼠却没事？为什么蝴蝶小时候是青虫，长大后却要长翅膀？为什么动物不使用轮子和螺旋桨？关于动物的体型和时间，有很多有意思的发现——老鼠的寿命只有两年，大象有近70年，但它们一生中的心跳数却是相同的；老鼠虽小，但4天就能吃下和自己体重相等的食物；牛个头大，但要吃完相当于自己体重的食物得花一个月。动物的体型不同，它们的食量、运动方式、生活习性也有很大不同。本书作者通过丰富的事例和大量插图、表格、实物照片，从你意想不到的角度来解读动物，生动地描绘出了一个与众不同的动物世界。本书曾荣获日本文部科学省科学技术奖、讲谈社出版科学文化奖，部分内容还入选了日本中学课本，并被《朝日新闻》、《读卖新闻》、《每日新闻》等多家媒体报道，是日本著名的科普类畅销读物。,2021-12-21 19:17:43,2021-12-21 19:17:43
9787571004460,假如你跳进一个黑洞里,https://img9.doubanio.com/view/subject/l/public/s33630844.jpg,保罗·多赫蒂,王思明,科学,湖南科技出版社,这是一本从书名、内文到注释，都有趣到不行的科普书。45种离奇死法，有的看似异想天开，有的确有其事，有的来自某些勇者的亲身经验（或尸检报告），有些情况暂无第一手资料，因此作者酌情参考军事、医学、天文学、物理学的报告及假说，或某些好奇教授的研究。当斯蒂芬·金遇上斯蒂芬·霍金，以严谨的科学家精神，探究无比滑稽、荒谬、悲惨的死法！,2021-12-21 19:17:56,2021-12-21 19:17:56
9787040158359,牛顿传,https://img1.doubanio.com/view/subject/l/public/s1034187.jpg,（美）詹姆斯・格雷克,吴铮,科学,高等教育出版社,他出生在一个充满黑暗，朦胧和巫术的世界。他的一生坎坷而凄美，他至少一次濒临思想崩溃的边缘，他总是隐藏地工作，但是他却比任何在他之前或之后的人更多地发现了人类知识的最核心部分。他是现代世界的首席建筑师，他解开了古时的光和运动之迷，他说明了如何预测天体的运行轨道并从而确定了人类在宇宙中的位置，他建立了法则，人们把它们叫做牛顿定律……过去的传记作家往往只专注于牛顿在科学上的巨大贡献，却对其神学信仰及思想发展脉络避而不谈，或一带而过。而美国最伟大的科学普畅销书作家詹姆斯・格雷克则以科技记者特有的专业和史料，并借助于牛顿的重要信件和许多从未公开的笔记，抽丝剥茧，为我们还原了一个真实的牛顿。更重要的是，通过对牛顿的性格和生活，与他有关联的人物，对他产生影响的重要事件以及他所处的历史时期的记述和描写，格雷克还细细探究了牛顿伟大思想的形成脉络，从而使我们可以从内在...,2021-12-21 19:18:03,2021-12-21 19:18:03
9787111495499,先天后天,https://img2.doubanio.com/view/subject/l/public/s28053392.jpg,[英国]马特·里德利,黄菁菁,科学,机械工业出版社,2001年2月，学界宣布，基因组包含的不是如原先所预想的10万个基因，而是只有3万个。这个令人震惊的修改导致一些科学家得出结论，认为人类基因其实不足以解释人们的所有不同方式的行为：我们必定是由后天而不是由先天所造就的。生物学再一次要被放在先天-后天的争论这张普洛克路斯忒斯之床上撕扯。广受赞誉的科普作家马特•里德利主张，正在出现的真相比这种神话要有趣得多。后天培育依赖于基因，而基因也要求后天培育。基因不仅预先规定大脑的广义结构，而且它们还吸收塑形的经验、因应社会的线索，甚至运转记忆。它们是意志的原因。也是意志的结果。在DNA双螺旋结构发现60多年之后出版的这本《先天后天》，详细记录了我们对基因的理解中所发生的一场新的革命。里德利描述先天力量的信徒与后天力量的信徒，为解释人类这种悖论式的造物如何能够既有自由意志同时又受本能与文化的推动而发生的百年之争。...,2021-12-21 19:18:10,2021-12-21 19:18:10
9787122338402,无穷小,https://img2.doubanio.com/view/subject/l/public/s32320751.jpg,[美]阿米尔·亚历山大,凌波,科学,化学工业出版社,1632年8月10日，5名身着黑袍的男子聚集在昏暗的罗马宫殿里，就一个看似简单的命题进行讨论: 一条连续的线由不同的、无穷小的部分组成。教士们大笔一挥，严令禁止无穷小的传播，宣布永远不许传授或提及无穷小概念。他们认为，它是危险和颠覆性的，是对当时信仰的极大威胁，即世界井然有序，由严格和不变的规则所统治约束。如果无穷小被接受，他们担心，整个世界将陷入混乱。在本书中，享有盛誉的历史学家阿米尔·亚历山大披露了教士裁决背后的深层原因，并揭示了无穷小和不可分量学说是如何持续存在，并成为微积分和大多数现代数学与技术的基石的这段历史。事实上，并不是每个人都同意教士们的观点。欧洲各地的哲学家、科学家和数学家都将“无穷小”视为科学进步、思想多元的关键。正如亚历山大所揭示的，不久，这两个阵营就展开了一场战争，即欧洲的等级和秩序与多元化和变革间的斗争。从德国的帝国城市...,2021-12-21 19:18:16,2021-12-21 19:18:16
9787542837967,不确定的科学与不确定的世界,https://img9.doubanio.com/view/subject/l/public/s10319675.jpg,亨利·N·波拉克,李萍萍,科学,上海科技教育出版社,《不确定的科学与不确定的世界》讲述为什么科学永远不能回答以下引人注目的重大问题：地球正由于温室效应而变暖吗？恐怖主义者释放炭疽孢子意味着什么危险？应该采取什么措施应对口蹄疫或疯牛病的爆发？为什么我们不能预测地震的发生？,2021-12-21 19:18:24,2021-12-21 19:18:24
9787535798206,迷人的技术,https://img2.doubanio.com/view/subject/l/public/s29862823.jpg,[美]凯莉•魏纳史密斯,刘天峄,科学,湖南科学技术出版社,每天都有奇妙的事情在发生，从未间断，在无尽的前沿上，有无数的问题有待被回答，有无数聪明的脑袋有待戴上美丽的花环……正如作者所说，新的技术是美妙的事物，但就像米开朗基罗的圣母怜子像或罗丹的沉思者一样，制作它们通常是一种可怕的痛苦。这本书不仅是想告诉你这些技术是什么样的，还有这些技术将如何以令人难以置信的方式改变我们的世界。美国亚马逊网站Best Seller和《科学》周刊倾情推荐这是写给科技青年和城市白领的锦囊书，对于喜欢科技创新潮流的人来说，这本书将带来愉快的阅读体验，也会给到不少启示。,2021-12-21 19:18:31,2021-12-21 19:18:31
9787544287562,假设的世界,https://img1.doubanio.com/view/subject/l/public/s29414977.jpg,[日]竹内薰,曹逸冰,科学,南海出版公司,这个世界上没有永恒的正确，人们当作真理的“科学知识”，都不过是“假设”而已。本书全面回溯当代科学理念的发展历程，提出如今我们掌握的科学知识，不管是父母教的，课本记载的，或是被理所当然认定的常识，全部都始于假设。不论是伽利略、哥白尼、牛顿、爱因斯坦，还是电脑或网络的出现，都是因为破除了古老假设的樊篱，并且构思出新的假设。当你大脑中出现第一个“如果”时，千万要珍视它，或许它足以撼动这个世界。今天的错，或许就是明天的对，这个世界上没有绝对的真理。大胆地怀疑常识，才是扭转世界的立足点。,2021-12-21 19:18:38,2021-12-21 19:18:38
9787557673802,想太多的人类学家,https://img3.doubanio.com/view/subject/l/public/s33615890.jpg,[美]李相僖,陈建安,科学,天津科学技术出版社,这是一本介绍人类学知识的趣味科普书。22个关于人类进化的故事，揭开我们的身世之谜。美国加州大学人类学教授李相僖用诙谐幽默的语言、贴近生活的故事、专业的人类学知识回答了“你是谁？你从哪里来？要到哪里去”这一系列问题，解释了我们是如何一步步从普通的动物进化为智慧的人类，又为此付出了多少沉重的代价。,2021-12-21 19:18:45,2021-12-21 19:18:45
9787544359948,寻找薛定谔的猫,https://img2.doubanio.com/view/subject/l/public/s28070182.jpg,[英]约翰·格里宾,张广才等,科学,海南出版社,主编推荐：薛定谔这只离奇的、著名的“猫”从何而来?探索科学史上最离奇的佯谬，感受物理学里最迷人的量子世界。这只不死不活的猫总是像噩梦一样让物理学家们不得安宁……全面论述了量子理论的基本概念，并赋予那些无限复杂又伤脑筋的实验以生机，使我们可以毫不费力地把握现代量子力学之谜。内容介绍：《寻找薛定谔的猫》是一本跨越量子力学、物理学及哲学等多学科的科普图书。它就像一个科学向导，带着读者领略20世纪物理学的发展过程;它又仿佛是一本思想史，把物理学家们的思维过程非常清晰地展现出来，让读者看到科学家成功前的一次次失败。格里宾在《寻找薛定谔的猫》中生动地描述了科学家得出他们理论的过程，让读者轻松地理解瞬间的真实性和一般量子力学。,2021-12-21 19:18:53,2021-12-21 19:18:53
9787229046682,生物中心主义,https://img2.doubanio.com/view/subject/l/public/s8909212.jpg,罗伯特-兰扎&amp;鲍勃-伯曼,朱子文,科学,重庆出版社,"《生物中心主义:宇宙新理论的奠基之作》内容简介：通过一位生物学家的观点和天文学家的讲述，《生物中心主义:宇宙新理论的奠基之作》展现了一个完全不同于前人的宇宙——我们自身——我们的生命和意识，引领读者走上一个看似不可能但最终不可避免的旅程。从物理学转换到生物学的观点，打开了西方科学不经意间自我禁锢的囚笼,打破了读者关于生命、时间和空间甚至死亡的观念。同时，它把我们从生命不过是碳元素等少数其他元素的混合物这一沉闷的世界观中解放出来，提出了生命是不朽的可能性。唤起读者不再用原来的方式观察真实的世界。",2021-12-21 19:19:00,2021-12-21 19:19:00
9787122312594,大脑简史,https://img9.doubanio.com/view/subject/l/public/s29758336.jpg,谢伯让,,科学,悦读名品｜化学工业出版社,【编辑推荐】“自私”的大脑如何战胜“自私的基因”？生命的终止是否就是进化的宿命？献给你，渴望突破桎梏、向往自由的大脑！第一颗大脑如何诞生？为什么我们会有大脑？大脑的自由意志是否受限于基因？生命的终止是否就是进化的宿命？经过四十亿年的进化，大脑是否已经摆脱自私基因的掌控？摆脱自然界和“人择”，“心择”的时代来临？！【内容简介】作者以亲切诙谐的拟人口吻，从40亿年前的第一个细胞开始，抽丝剥茧，带领读者浏览进化的长河，生物体为了存活使用的种种策略。将大脑的形成比喻成一场身体资源竞逐的战役，神经系统为了抵抗外在艰困环境，不断“结党营私”，突破各种生死关卡，最终形成了大脑……【媒体推荐】作者提出大脑与基因之争的个人见解，认为人类大脑已经超脱基因掌控！由于科学界及哲学界对此见解尚无定论，因此，文书力请多位意见领袖，请他们站在自己的专业立...,2021-12-21 19:19:07,2021-12-21 19:19:07
9787309099706,科学外史,https://img2.doubanio.com/view/subject/l/public/s28579751.jpg,江晓原,有2014年6月3印本,科学,复旦大学出版社,江晓原编著的这本《科学外史》的内容包括：为什么孔子诞辰可以推算；天狼星颜色之谜；谁告诉了中国人寒暑五带的知识；三件奇物的复制问题；望远镜及其在中国的早期谜案和遭遇；羊皮书上的一场科学史奇案；作为养身之道的房中术；萨哈罗夫和福明海军少将的故事；科学家与电影人之同床异梦……,2021-12-21 19:19:13,2021-12-21 19:19:13
9787300225074,颠覆性医疗革命：未来科技与医疗的无缝对接,https://img2.doubanio.com/view/subject/l/public/s28594821.jpg,[匈牙利]赫塔拉·麦斯可BertalanMeskó,大数据文摘翻译组,科学,中国人民大学出版社有限公司,亚马逊医学类参考书排名前100亚马逊kindle医疗参考类电子书排名前十未来医疗学家、医学极客赫塔拉 • 麦斯可力作硅谷奇点大学“指数级增长医学”教授吕西安·恩格乐作序力荐医生、护士及医疗方向MBA必读当医疗插上科技的羽翼腾飞，无疑会给人类带来巨大的福祉。未来，面对疾病，我们也许将不再那么恐惧。因为：器官将可在器皿中培植，让器官移植不再成为一种奢望；医生将可以远程操控机器人为千里之外的患者进行手术，以解决医疗专家短缺的问题；基因测序以及纳米机器人靶向给药，有助于我们实施个性化预防措施与精准治疗；神奇的数字文身将会像守护神般时刻监测和上传我们的健康数据；动力驱动的体外骨骼和神经控制的义肢可以让瘫患病人重新站立行走，并获得敏锐触觉；医学上将终结以真实人体进行试验，而代之以全身仿生装置；医生将可以通过人体冷冻的方式，成功拯救患者的生...,2021-12-21 19:19:20,2021-12-21 19:19:20
9787535715791,时间简史续编,https://img1.doubanio.com/view/subject/l/public/s6529368.jpg,[英]史帝芬·霍金,胡小明,科学,湖南科学技术出版社,被全世界广泛尊为继爱因斯坦以来最伟大的理论物理学家史蒂芬・霍金教授的科学名著《时间简史》是一项世界出版奇迹。其印数在1000万册以上，发行近40种语言文字。现在，从获奖电影纪录片《时间简史》而产生的本书――《时间简史续编》，是为那些想要更多地了解霍金教授的生平及其学说的读者而编的。从与电影制作人讨论拍摄《时间简史》这部电影起，霍金教授就坚持不要将其拍成一部传记性电影，而是要一部能为广大观众阐释他的研究学说的电影。因此，这部花费350万英镑，获得美国纪录片大奖的电影就成了一部生动的关于霍金教授的口述历史。其中，包含了霍金、他的家庭、生平好友、同事和世界知名的物理学家，以及关于霍金教授的科学概念的演化与性质的充满激情的过程历览。一部纪录片绝对无法涵盖全部的拍摄过程中所收集的丰富的个人和科学资料。因此，本书不仅是反映了电影，而且在内容上有重要的大量的扩...,2021-12-21 19:19:27,2021-12-21 19:19:27
9787535737212,未来50年,https://img1.doubanio.com/view/subject/l/public/s2905589.jpg,J・布洛克曼,李泳,科学,湖南科学技术出版社,《未来50年》汇集了世界上最有眼光的科学家们的25篇未曾发表过的，关于我们有生之年可能看到的科学和技术进步的原创作品。,2021-12-21 19:19:34,2021-12-21 19:19:34
9787543931862,魂灵,https://img1.doubanio.com/view/subject/l/public/s2408039.jpg,玛丽.罗奇,谭琪,科学,上海科学科技文献出版社,死亡是永远的终结，还是另一端生命的开始？永生是否存在？这是长久以来困扰人类的难题。在本书中，作者记述了历史上人们对灵魂的探索里程，并亲自进行了长达一年的探索，从印度农村到英国灵媒学校，从剑桥大学图书馆到杜克大学医学院，从劳伦森大学意识研究实验室到被卡罗来纳州的乡村，再到弗吉尼亚大学手术室。作者以极大的智慧和不倦的好奇心将作者带上了一段奇异的旅程。,2021-12-21 19:19:41,2021-12-21 19:19:41
9787204067275,图说相对论,https://img2.doubanio.com/view/subject/l/public/s1088162.jpg,林为民,,科学,内蒙古人民出版社,假如我以光速跟一道光束飞行，我会看到哪些奇异景象？比方说，这道光速若是由一座时钟反射出来，我应该看到一座静止的钟，也就是说在我眼中，那座钟的时间是静止的；可是在别人看来，同样的钟却在滴答滴答走，这是不是矛盾呢？,2021-12-21 19:19:47,2021-12-21 19:19:47
9787521717747,糖的故事,https://img2.doubanio.com/view/subject/l/public/s33657362.jpg,[英]詹姆斯·沃尔韦恩（JAMESWALVIN）,熊建辉,科学,中信出版社,英国皇家文学院院士詹姆斯·沃尔韦恩依据详实的史料，从贸易史、殖民史、战争史及经济史等维度，阐释了糖为什么能从中世纪只有王公贵胄才能享用的奢侈品演化成了日常生活中普通的食材；为什么糖给人类带来愉悦的同时，却又成为破坏生态环境，耗尽资源，威胁人类健康与生命，甚至也是引发战争的关键因素；为什么在21世纪糖仍然是造成多种疾病肆虐全球和许多人流离失所的推手；为什么面向21世纪，仅仅开征糖税不能有效解决上述问题。,2021-12-21 19:19:54,2021-12-21 19:19:54
9787213089329,创造的本源,https://img1.doubanio.com/view/subject/l/public/s29880847.jpg,(美)爱德华·威尔逊,魏薇,科学,浙江人民出版社,一本讲述创造力的起源的重磅新作,2021-12-21 19:20:01,2021-12-21 19:20:01
9787508647456,谣言粉碎机:餐桌上的明白人,https://img3.doubanio.com/view/subject/l/public/s27974430.jpg,果壳Guokr·com,,科学,中信出版社,• 一次性纸杯的第一杯水，该不该喝？• 长时间嚼口香糖有害吗？• 吃了1个烤鸡腿，等于抽了60根烟？• 炸鸡丰胸，男女皆宜？• 婴幼儿喂养误区：你的宝贝需要补钙吗？• 牛奶与香蕉同食会拉肚子吗？面对众说纷纭，谁来调查真相？你能一眼洞穿谣言吗？爱科学，不爱流言。爱考证，不爱迷信。爱证据，不爱权威。谣言粉碎机——捍卫真相与细节，一切谣言将在这里被终结，树立理性思考的生活方式，让轻信与盲从止于科学！“谣言粉碎机”系列包含以下三册：《餐桌上的明白人》《危言出没，身体请注意》《谣一谣，你就真懂了》针对广为流传的食物、健康、奇闻各向谣言，通过专业知识和科学精神逐个击破，果壳“谣言粉碎机”主题站三年来的精华积累集结成书。在一个“泥沙俱下”的时代，人人都需要一台“谣言粉碎机”！★严肃的科学精神+活泼的研究方式+简白的幽默感+...,2021-12-21 19:20:09,2021-12-21 19:20:09
9787301112441,科学史十五讲,https://img9.doubanio.com/view/subject/l/public/s21566894.jpg,江晓原,,科学,北京大学出版社,《科学史十五讲》由学科力量较强的上海交通大学人文学院科学史系的几位专家学者合著，从科学史的意义发端，在总论其学科史、功能、定位、方法范式以及在中国的历史和现状后，前五讲追溯了古希腊、古代中国、阿拉伯、欧洲文艺复兴时期的科学发展历程，后十讲则着眼于独立学科如天文学、物理学、数学、化学等，以若干具有划时代意义的里程碑连线，贯串整个人类科学史，兼顾内史与外史，择要叙论重要人物、事件及其社会功能、文化性质并时加点评，显现了扎实的科学和人文功底。,2021-12-21 19:20:22,2021-12-21 19:20:22
