9787559645753,从总账到总监,https://img2.doubanio.com/view/subject/l/public/s33794521.jpg,钱自严,,管理,北京联合出版公司,这是一本用小说体例写作的财务专业书籍。工作中如何将财物数据业务化，找到绩效管理的关键点？在人工智能都会写诗的时代，财务这门学科是否会毫无价值？以及在未来，财务人员应该具备哪些专项能力才能不被替代？跨国公司全球首席财务官钱自严与我们分享了一个资深财务人眼中的商业世界，看看他怎样透过数据，以资源效率的视角，揭示绩效管理的秘诀和方法。本书的每个管理工具与财务模型，都代表着一条久经锤炼的管理智慧与商业思维。无论你是怎样的行业背景与职场角色，都可以从中获得认知提升与职场进阶的有益参考。,2021-12-23 18:48:08,2021-12-23 18:48:08
9781491973899,The Manager's Path,https://img9.doubanio.com/view/subject/l/public/s29478934.jpg,CamilleFournier,,管理,O′Reilly,"Managing people is difficult wherever you work. But in the tech industry, where management is also a technical discipline, the learning curve can be brutal—especially when there are few tools, texts, and frameworks to help you. In this practical guide, author Camille Fournier (tech lead turned CTO) takes you through each stage in the journey from engineer to technical manager....",2021-12-23 18:48:13,2021-12-23 18:48:13
9787111273707,专业服务公司的管理,https://img1.doubanio.com/view/subject/l/public/s3943977.jpg,梅斯特,大龙,管理,机械工业出版社,《专业服务公司的管理》自出版以来，一直被奉为专业服务领域的管理圣经，总销量超过30万册。在欧美，它是与管理大师彼得·德鲁克、战略大师迈克尔?波特、营销大师菲利普·科特勒比肩的管理经典。专业服务公司是利用专业知识来提供服务的公司。如会计师事务所、律师事务所、咨询公司、投行、公关公司、广告公司，等等，它们与工业型公司和餐馆等服务型企业差异巨大，其面对的每个客户都各不相同，每个项目都有其独特性，其收益和分配也有自己的规则。因此，专业服务公司的管理必须特别对待。《专业服务公司的管理》的特色在于权威与实用并举。理论部分提供了专业服务公司最权威的核心管理原则，充满基于常识、一针见血的洞见；操作部分则为专业服务公司的各种管理实务提供了明确、合理的建议，如利润衡量、服务质量、业务推广、招聘、薪酬、项目组成员配比、员工发展等。此外，易为公关还特别结合中国的实际情况对中...,2021-12-23 18:48:19,2021-12-23 18:48:19
9787111280736,管理的实践,https://img2.doubanio.com/view/subject/l/public/s6075322.jpg,彼得·德鲁克,齐若兰,管理,机械工业出版社,第一部从实际执行层面立论的管理学书籍，第一部兼顾管理现有企业和创新未来企业的著作，最棒的一本讲述。“管理如何能够复制”的著作，《管理的实践(珍藏版)(中英文双语)》的根本目的在于通过对管理原则、责任和实践的研究，探索如何建立有效的管理机制和制度。而衡量一种管理制度是否有效的标准就在于该制度能否将管理者个人特征的影响降到最低。贯穿全书的三条主线：管理企业，管理管理者，管理员工和工作，德鲁克的三个经典提问：我们的事业是什么，我们的事业将是什么，我们的事业究竟应该是什么，管理必须同时需要考虑三个方面的问题：成果和绩效，这是企业存在的目的，在企业内部共同工作的人所形成的组织，外在社会，也就是企业的社会责任。,2021-12-23 18:48:25,2021-12-23 18:48:25
9787111592525,专业服务公司的管理（经典重译版）,https://img3.doubanio.com/view/subject/l/public/s29775630.jpg,[美]大卫•梅斯特(DavidH.Maister),吴卫军,管理,机械工业出版社,全球销量50万册！专业服务公司的成功，取决于两类资产的管理——人才和客户，比肩彼得·德鲁克、迈克尔·波特的专业服务管理大师，顶级会计师事务所、律师事务所、咨询公司、广告公司、猎头公司都在遵循的管理法则。,2021-12-23 18:48:31,2021-12-23 18:48:31
9787513923316,权力与领导,https://img2.doubanio.com/view/subject/l/public/s33318372.jpg,[美]詹姆斯·克劳森,马昕,管理,后浪丨民主与建设出版社,一本领导学理论和技巧的集大成之作跨越心理学和管理学的畅销经典多国高管培训材料，百所美国著名大学采用◎ 编辑推荐《权力与领导》这本书对于寻求建立长效领导力，塑造企业文化和价值观的企业家、管理人员来说是极具启发和实操意义的。领导力并不仅仅是管理职位上碾压别人的权力，也不仅仅是大数据死理性派的运筹帷幄，还有属于企业家精神的热情和感染力，包括选择什么样的企业战略，建立什么样的企业文化，如何陈述企业愿景。这些都是企业长效发展必备的顶层设计，而一个高屋建瓴的企业家不应该忽略这一点。达顿商学院作为哈佛商学院外唯一的案例教学商学院，也为本书塑造了用案例辅助理论阐述的风格，内容跨越心理学和管理学，有助于管理人员理解管理中的困境，改善领导能力，提高工作绩效。《权力与领导》为美国百所大学商科教材，也被列为美、英、德、日、荷等多国高管培训材料，是一本不可多得的正...,2021-12-23 18:48:36,2021-12-23 18:48:36
9787539987149,华杉讲透《孙子兵法》（修订版）,https://img9.doubanio.com/view/subject/l/public/s29161155.jpg,华杉,,管理,江苏文艺出版社,《孙子兵法》6111字，似乎每个字都艰深玄奥，让很多人望而却步；其实，只要抓住兵法的根本思想，就会发现处处豁然开朗、字字明明白白。本书作者华杉，研究孙子兵法二十余年；在本书中，抓住兵法根本思想，通过155个经典战例，将《孙子兵法》的原意剖析得详尽透彻。同时援引2000多年来，解读《孙子兵法》的传世注家曹操、杜牧等11人的注解，从不同角度还原兵法原意。全书通俗流畅，精彩纷呈；背水一战、围魏救赵等经典战例，更是讲解得令人身临其境，犹如置身战场上空，看交战双方兵马调动，浴血奋战，在震天的厮杀声中演绎着兵法的深邃思想。,2021-12-23 18:48:42,2021-12-23 18:48:42
9787111203179,企业战略博弈,https://img9.doubanio.com/view/subject/l/public/s7654174.jpg,[美]布鲁斯·格林沃德,程炼,管理,机械工业出版社,竞争战略往往被搞得很复杂，事实上，如果你真正了解所属行业的竞争结构，正确的战略通常只是围绕着一个问题的答案而发展出来的。这个问题是：有什么进入市场的障碍，能够让我们做到其他公司做不到的事情？如果答案是“没有”，那么问题其实不在战略。因为公司没有竞争优势，就只能面对两种选择：要不就积极追求高度的运营效率，要不就选择退出目前的市场，进入你可以创造并充分运用竞争优势的不同领域。如果答案是“有”，那么战略就变得至关重要。公司的获利能力就取决于你是不是能有效地抵挡潜在竞争对手进入市场，并且有效掌握其他同业之间的竞争，让你可以充分运用你的竞争优势。,2021-12-23 18:48:47,2021-12-23 18:48:47
9787543215771,基于实践的微观经济学,https://img1.doubanio.com/view/subject/l/public/s3773499.jpg,[美]赫伯特·西蒙,孙涤,管理,格致出版社上海三联书店上海人民出版社,《基于实践的微观经济学》为当代经济学译库系列丛书之一。《基于实践的微观经济学》集中探讨了经验研究对于微观经济进一步发展的必要性，分别论述了决策理性、组织在经济中的作用和经济学的经验证据。,2021-12-23 18:48:53,2021-12-23 18:48:53
9787300153100,营销管理（第14版·全球版）,https://img1.doubanio.com/view/subject/l/public/s27967027.jpg,菲利普·科特勒,王永贵,管理,中国人民大学出版社,全球化时代的“营销圣经”，科特勒经典巨著最新第14版全球化视角，取材源自世界各地，充分展现全球经济的变化与发展。更加丰富、实用的专栏资料，展现当今营销理论与实践的巨大变化。重点解读当下经济、环境及技术的巨大变化给营销带来的冲击。更全面、更与时俱进、更适合MBA教学。1962—1967年，科特勒教授用5年时间完成了一部影响世界40多年的巨著《营销管理》。它首先受到美国众多高校的欢迎，后逐步流行于美国的企业界，继而冲出美国走向世界。这部“营销圣经”最先被芝加哥大学用作市场营销课程教材，现已成为世界公认的营销课程教材，广泛用于本科生和研究生的教学。科特勒被美国营销协会推选为营销思想界第一领袖，各界颁发给他的营销奖项不计其数。科特勒的首要贡献在于“把营销原理引入企业管理的最前线”，并始终依据时代的变迁来修正他的观点和思想，永久保持这部巨著的新鲜...,2021-12-23 18:49:00,2021-12-23 18:49:00
9787543806634,孙子兵法,https://img3.doubanio.com/view/subject/l/public/s1195910.jpg,,贾尔斯(英)/等,管理,湖南出版社,孙武（约公元前545年—约公元前470年），字长卿，齐国乐安（今山东广饶））人，中国春秋时期著名的军事家、政治家，尊称兵圣或孙子（孙武子），被誉为“百世兵家之师”、“东方兵学的鼻祖”。大约活动于公元前六世纪末至前五世纪初。由齐至吴，经吴国重臣伍员（伍子胥）举荐，向吴王阖闾进呈所著兵法十三篇，受到重用为将。他曾率领吴国军队大败楚国军队，占领楚国都城郢城，几近覆亡楚国。其著有巨作《孙子兵法》十三篇，为后世兵法家所推崇，被誉为“兵学圣典”，置于《武经七书》之首。他撰著的《孙子兵法》在中国乃至世界军事史、军事学术史和哲学思想史上都占有极为重要的地位，并在政治、经济、军事、文化、哲学等领域被广泛运用。被译为英文、法文、德文、日文，该书成为国际间最著名的兵学典范之书。,2021-12-23 18:49:08,2021-12-23 18:49:08
9787301139097,组织与管理研究的实证方法,https://img1.doubanio.com/view/subject/l/public/s3173778.jpg,陈晓萍,,管理,北京大学出版社,《组织与管理研究的实证方法》分五个部分：“科学研究的目的和过程”、“管理学的研究方法”、“管理学研究中的测量统计方法”、“研究发表的旅程”以及附录。全书立足于思维方式、理论构建以及管理研究的全过程，介绍了组织与管理研究中的各种实证方法，并在附录中给出了组织与管理研究方法论的经典文献，对研究者具有极高的参考价值。,2021-12-23 18:49:13,2021-12-23 18:49:13
9787508656823,当客户说“不”,https://img2.doubanio.com/view/subject/l/public/s28376902.jpg,汤姆·霍普金斯,杨晓瑜,管理,中信出版社,"即便是最出色的专业销售人员，也会经常听到潜在客户对他们说“不”。当你的首次尝试被潜在客户拒绝后，你应该采取哪些有效的策略呢？此时，是收起材料转身就走，还是认清顾客说“不”的真正意图，从而继续进行陈述呢？销售大师汤姆•霍普金斯在《当客户说“不”》中告诉我们，一个消费者在购买产品之前会说5次“不”,而销售人员要做的就是认真听对方是如何表达出抗拒的，抓住细微的线索，当场对症下药，继续为对方做产品陈述，将客户导入霍普金斯独创的“说服客户的循环”。成千上万名销售人员已经在实践中应用了从《当客户说“不”》中学到的策略，并成功地证明了这些策略是行之有效的。这些新策略可以让客户反思自己最初做出的决定，改变态度，让销售人员的陈述继续进行下去，直至取得销售成功。",2021-12-23 18:49:18,2021-12-23 18:49:18
9780679762881,High Output Management,https://img9.doubanio.com/view/subject/l/public/s4263066.jpg,AndrewS.Grove,,管理,Vintage,"This is a user-friendly guide to the art and science of management from Andrew S. Grove, the president of America's leading manufacturer of computer chips. Groves recommendations are equally appropriate for sales managers, accountants, consultants, and teachers--anyone whose job entails getting a group of people to produce something of value. Adapting the innovations that have ...",2021-12-23 18:49:25,2021-12-23 18:49:25
9787111188469,管理,https://img9.doubanio.com/view/subject/l/public/s1692924.jpg,[美国]彼得·德鲁克,王永贵,管理,机械工业出版社,本书围绕经营绩效、服务机构的绩效、卓有成效的工作和有所成就的员工、社会影响和社会责任、管理者的工作、管理技能与组织管理、高层管理者的任务与组织、战略与结构等，系统探讨和揭示了企业使命、企业责任、员工责任、员工资产、知识工作者、目标管理、管理分权、组织设计、规模、多国公司、成长和创新新型组织等方面的问题。20世纪管理最重要、独特的贡献就是将体力工作的生产力提高了50倍之多；21世纪管理所能做的贡献是提升知识工作和知识工作者的生产力。因此，管理是一项崇高的使命。管理需要设立营销、创新、人力资源、资本资源、物质资源、生产力、社会责任及利润八个方面的目标。八个目标之间应该达到三种平衡。管理重心是使工作有生产力并使员工有成就感。管理需要以社会影响和社会责任为支柱。,2021-12-23 18:49:39,2021-12-23 18:49:39
9787111623687,一本书看透股权架构,https://img3.doubanio.com/view/subject/l/public/s33464650.jpg,李利威,,管理,机械工业出版社,本书作者拥有律师、注册会计师、注册税务师执业经历，服务过联想控股、拉卡拉等百余家公司的股权设计项目。本书是其15年实战经验的系统总结。本书四大特点：1. 模型化书中归纳了股权架构的9种应用模型，不仅可以让读者快速理解股权本质，还可以让股权设计变得更高效。2. 系统性本书打通了法律、财务、税务、管理4个领域的边界，避免了股权设计中“只见树木不见森林”的误区 。3. 场景化以30家名企案例贯穿始终，让读者在似曾相识的场景中产生共鸣，启发其思考。4. 实操性全书以指导股权实战为宗旨，每节均包含案例、模型及操作要点提示，是本超级实用的股权架构设计指南。,2021-12-23 18:49:44,2021-12-23 18:49:44
9780060521998,The Innovator's Dilemma,https://img2.doubanio.com/view/subject/l/public/s1479751.jpg,ClaytonM.Christensen,,管理,HarperPaperbacks,在线阅读本书,2021-12-23 18:49:51,2021-12-23 18:49:51
9787115510761,知行,https://img9.doubanio.com/view/subject/l/public/s33457985.jpg,刘建国,,管理,人民邮电出版社,"技术管理者是当今宝贵而稀缺的中坚力量。对于瞬息万变的泛互联网行业，机会无处不在。广大互联网技术管理者一方面成长迅速，一方面又亟待系统方法论的指引。本书结合了作者多年互联网行业的管理实践经验和管理理论，针对广大技术管理者最关心的三类问题展开了探讨：”why“的问题，关乎管理意愿问题，核心纠结在于”要不要做管理“，比如：老板让我做管理，我到底要不要做呢？管理这条路是否适合我呢？对我个人发展有什么建议么？我不像某某那么适合做管理、我是否还要去尝试呢？”what“的问题，关乎管理认知，核心是迷惑”管理都需要做什么“，比如：“管理者到底都需要做哪些事呢？”“有没有管理的框架图可以让我按图索骥，做到心中有数呢？”“怎样才算是一位职业的管理者，我做得是否足够呢？”""How""的问题，关乎管理实操，核心是想了解”管理具体怎么做“，比如：“怎么做团...",2021-12-23 18:49:56,2021-12-23 18:49:56
9787111189572,管理的实践 （中英文双语典藏版）,https://img2.doubanio.com/view/subject/l/public/s1760753.jpg,彼得·德鲁克,齐若兰,管理,机械工业出版社,《管理的实践(中英文双语典藏版)》提供了观念、原则和工具，是一套极具系统化的管理知识。本书问市后，不仅在美国一炮而红，而且在全球各地也都非常成功，包括在欧洲、拉丁美洲，尤其在日本更是备受重视。本书以“管理企业、管理管理者、管理员工和工作”三项管理的任务，贯穿整本书的主轴和精髓，并以八个关键成果领域、三个经典的问句以及组织的精神丰富其内涵。,2021-12-23 18:50:02,2021-12-23 18:50:02
9780201835953,The Mythical Man Month and Other Essays on Software Engineering,https://img1.doubanio.com/view/subject/l/public/s4088217.jpg,FrederickP.BrooksJr.,,管理,AddisonWesley,"Few books on software project management have been as influential and timeless asThe Mythical Man-Month. With a blend of software engineering facts and thought-provoking opinions, Fred Brooks offers insight for anyone managing complex projects. These essays draw from his experience as project manager for the IBM System/360 computer family and then for OS/360, its massive softwa...",2021-12-23 18:50:09,2021-12-23 18:50:09
9787300234601,管理学(第13版),https://img2.doubanio.com/view/subject/l/public/s29357103.jpg,斯蒂芬·P·罗宾斯(StephenP.Robbins),刘刚,管理,中国人民大学出版社,本书位列全球基础管理学教材的榜首，自引进我国以来，深受国内学界和业界的欢迎，也影响了无数的中国读者和管理者。全书以管理的四大职能——计划、组织、领导、控制为主体脉络，环环相扣，逻辑清晰，全面覆盖了管理理论的主要知识点，将管理理论与管理实践紧密结合，帮助读者提升管理技能。第13版是zui新版，适应管理理论与实践的发展，进行了及时的更新，主要包括：• 充分以技能和职业为重点，切实让学生为进入职场做好准备。• 各章增加了开篇专栏“这是你的职业”，突出管理者需要掌握的关键工作技能，如：时间管理、成为更好的决策者、培养全球观等。• 对部分章节进行了调整，将“决策”一章移到了第I篇“管理导论”（因为管理者做的一切都包含决策），把创业型企业的内容移到了第III篇“计划”，拓展了第II篇“现代工作场所的管理基础知识”的内容，涵盖了在现代工作场所进行管理的基本...,2021-12-23 18:50:21,2021-12-23 18:50:21
9787806451335,旁观者-管理大师杜拉克回忆录,https://img1.doubanio.com/view/subject/l/public/s1004557.jpg,彼得·德鲁克,廖月娟,管理,海南出版社,本书是彼得・杜拉克的自传。他刻画了自己漫长的一生中结识的诸多人物，包括弗洛伊德、亨利・鲁斯、阿尔弗雷德・斯隆、约翰・刘易斯和马歇尔・麦克鲁汉。在这本回忆录中，作者描写了维也纳的童年，第一次世界大战，二十年代和三十年代初期笼罩在欧洲各地的纳粹阴影，三十年代的伦敦生活，新政下的美国，二战岁月和战后的世界。,2021-12-23 18:50:27,2021-12-23 18:50:27
9787111280699,管理：使命、责任、实务(使命篇),https://img1.doubanio.com/view/subject/l/public/s29082477.jpg,彼得·德鲁克,王永贵,管理,机械工业出版社,《管理:使命、责任、实务(使命篇)(珍藏版)》围绕经营绩效、服务机构的绩效、卓有成效的工作和有所成就的员工、社会影响和社会责任、管理者的工作、管理技能与组织管理、高层管理者的任务与组织、战略与结构等，系统探讨和揭示了企业使命、企业责任、员工责任、员工资产、知识工作者、目标管理、管理分权、组织设计、规模、多国公司、成长和创新型组织等方面的问题。20世纪管理最重要、独特的贡献就是将体力工作的生产力提高了50倍之多；21世纪管理所能做的贡献是提升知识工作和知识工作者的生产力。因此，管理是一项崇高的使命。管理需要设立营销、创新、人力资源、资本资源、物质资源、生产力、社会责任及利润八个方面的目标。八个目标之间应该达到三种平衡。管理重心是使工作有生产力，并使员工有成就感。管理需要以社会影响和社会责任为支柱。,2021-12-23 18:50:34,2021-12-23 18:50:34
9787300133508,组织理论,https://img9.doubanio.com/view/subject/l/public/s6769055.jpg,[美]W.理查德.斯科特,高俊山,管理,中国人民大学出版社,《组织理论:理性、自然与开放系统的视角》被公认为介绍组织研究领域文献最为详尽和最具权威的著作之一。作者充分运用社会学和管理学的组织研究成果，广泛吸收其他社会科学对组织理论做出的贡献，不仅从研究者的角度，而且从组织管理者以及各种参与者乃至普通大众的视角来阐释组织理论问题，对我国组织研究学者和管理实践人员具有重要的借鉴意义。《组织理论:理性、自然与开放系统的视角》共分14章，第1章为导论，引入了三种不同的组织定义和三个组织研究的视角：理性、自然和开放系统观。第2～4章分别以三个视角为主线，梳理了组织研究的历史，包括对各个主要学派及其代表人物的简介和评论。第5章讨论了三个视角的融合与渗透，指出它们曾经以不同的组合方式出现，分别适用于不同层面的分析，提出了整合三种视角的分层模型。第6～12章从组织结构、组织内部机制与过程、组织与环境的关系以及组织的绩效等方...,2021-12-23 18:50:39,2021-12-23 18:50:39
9787111188445,管理：使命、责任、实务（实务篇）,https://img2.doubanio.com/view/subject/l/public/s1946592.jpg,彼得·德鲁克,王永贵,管理,机械工业出版社,《管理使命责任实务(实务篇)》围绕经营绩效、服务机构的绩效、卓有成效的工作和有所成就的员工、社会影响和社会责任、管理者的工作、管理技能与组织管理、高层管理者的任务与组织、战略与结构等，系统探讨和揭示了企业使命、企业责任、员工责任、员工资产、知识工作者、目标管理、管理分权、组织设计、规模、多国公司、成长和创新型组织等方面的问题。,2021-12-23 18:50:45,2021-12-23 18:50:45
9780812993011,"Creativity, Inc.",https://img1.doubanio.com/view/subject/l/public/s27565758.jpg,EdCatmull,,管理,RandomHouse,"Creativity, Inc. is a book for managers who want to lead their employees to new heights, a manual for anyone who strives for originality, and the first-ever, all-access trip into the nerve center of Pixar Animation Studios—into the story meetings, the postmortems, and the “Braintrust” sessions where art is born. It is, at heart, a book about how to build and sustain a creative ...",2021-12-23 18:50:52,2021-12-23 18:50:52
9787115569943,华为学习之法,https://img3.doubanio.com/view/subject/l/public/s33977950.jpg,邓斌,,管理,人民邮电出版社·智元微库,华为逆势成长的“硬核”成绩单，让业界掀起向华为学习的热潮；但许多人都无意识地忽略掉了一个关键点：学习华为如何学习别人。华为30余年的成长史，就是一个不断寻找巨人肩膀、青出于蓝而胜于蓝的“学习史”。《华为学习之法》是“学习华为三部曲”的收官之作，聚焦“华为如何学习别人”的独特视角，系统解析赋能华为的8个关键思维，透视华为持续成长的底层逻辑。全书分为上、下两篇：上篇“华为向谁学”全面解析了华为的学习对象和学习内容，讲述华为向西方学习、向军队学习、向市场学习、向客户学习、向自然万物学习五个方面的学习进化之旅，呈现了华为学习的广度和深度；下篇“华为怎么学”围绕华为30余年向别人学习的方法论，以鲜活的案例解读靶向思维、求渔思维、迭代思维三大学习原则，深度还原华为学习思维的本质。本书结构饱满、逻辑清晰、案例鲜活、故事生动、可读性强，值得有志于学习与变革的企...,2021-12-23 18:50:58,2021-12-23 18:50:58
9787222035188,战略与结构,https://img1.doubanio.com/view/subject/l/public/s1944419.jpg,[美]艾尔弗雷德·D.钱德勒,孟昕,管理,云南人民出版社,"艾尔弗雷德·D·钱德勒（Alfred D.Chandler,Jr.）管理学权威、哈佛大学商学院著名教授、美国企业史权威。他一生中有三部公认为经典的著作。《战略与结构》是其中最重要的作品，中译本现在首次与中国读者见面。他的研究成果，撼动了主流经济学的根基。他的成就，是一座任何一个经济学家都绕不过去的高山！",2021-12-23 18:51:04,2021-12-23 18:51:04
