9787111434740,22条商规,https://img1.doubanio.com/view/subject/l/public/s26968847.jpg,（美）艾•里斯（AlRies）,寿雯,管理,机械工业出版社,1972年，里斯和特劳特在《广告时代》上发表《定位新纪元》系列文章，将“定位”一词带入人们的视野，1980年《定位》出版，迅速风靡欧美，成为营销领域的“工业标准”，并被评为“有史以来对美国营销影响最大的观念”。1993年，两位大师联手推出《22条商规》，将定位理论的精要总结为22条简单、明晰的定律，作为两位大师25年合作的落幕之作，此书甫一出版，便受到各国企业家的追捧，长期占踞畅销书榜前列。,2021-12-23 19:45:22,2021-12-23 19:45:22
9787115244888,项目百态,https://img2.doubanio.com/view/subject/l/public/s4616951.jpg,[美]TomDemarco,金明,管理,人民邮电出版社,本书介绍了软件项目行为的86 个模式，基本上概括了软件项目生命周期的方方面面，揭示了软件项目最常遇到的困境，反省了行业内种种不良习惯和做法。六位作者均来自一个开发咨询的管理团队Atlantic Systems Guild，长期以来为众多软件公司的经理人提供专业的咨询服务。他们浓缩了成百上千个项目管理的案例，通过本书中一个个模式展现出来。每个模式都以生动形象的插图开始，另外还加上一些趣闻和真实事件。本书适合所有软件项目的管理者阅读，也适合有志于成为软件管理者的人参考。,2021-12-23 19:45:29,2021-12-23 19:45:29
9787508690254,行为设计学(零成本改变),https://img2.doubanio.com/view/subject/l/public/s29865512.jpg,[美]奇普·希思,,管理,中信出版社,希思兄弟简介奇普•希思（Chip Heath）：斯坦福大学商学院组织行为学教授。丹•希思（Dan Heath）：杜克大学社会企业发展中心高级研究员，前哈佛商学院研究员，Thinkwell（思睿）新媒体教育公司创办人之一。希思兄弟在中信已出版作品《瞬变》《让创意更有粘性》《决断力》,2021-12-23 19:45:35,2021-12-23 19:45:35
9787549634415,市场推手,https://img1.doubanio.com/view/subject/l/public/s33864817.jpg,【美】罗伯特·格雷菲尔德,闾佳,管理,文汇出版社,人人都在说纳斯达克，但人人都不了解纳斯达克。作为全球品牌影响力巨大的证券交易市场董事长兼首席执行官，罗伯特·格雷菲尔德在书中回顾了自己14年的CEO生涯，分享了带领纳斯达克走出绝境的传奇故事，记录了Facebook灾难性的IPO，分析了并购极讯、北欧交易所集团OMX、费城证券交易所的前因后果，发起了竞标纽交所、伦敦证交所的战略计划。通过跌宕起伏的故事，格雷菲尔德探究了成功背后的原因，将管理者必备的领导特质娓娓道来。本书涉及技术、市场、转型、收购、公关、创新和危机管理等众多领域，将世界金融中心华尔街的交易、套路和战争一网打尽。纳斯达克不断地固守自己的生存法则，却又不断的冲破传统的束缚，每天都在上演资本的游戏。翻开本书，了解资本市场的终极游戏！,2021-12-23 19:45:41,2021-12-23 19:45:41
9789571380551,深度數位大掃除,https://img1.doubanio.com/view/subject/l/public/s33599597.jpg,[美]卡尔·纽坡特,洪慧芳,管理,時報出版,如果無法長時間聊天而不瞄手機，這本書就是為你而寫。15個實作法，打造連線與離線的黃金比例。取回數位生活的自主權，重拾你對人事物的專注力。◎亞馬遜年度最佳商業／領導書《Deep Work深度工作力》作者最新力作。◎甫上市，旋即登上《紐約時報》、亞馬遜等各大暢銷榜。◎被譽為科技界的《怦然心動的人生整理魔法》，足以為生活帶來奇蹟式轉變。＼許多科技造成的果，早已背離發明的初衷／為什麼需要進行數位大掃除？在選擇數位產品時，我們往往著眼於便利性，而忽略了它們造成的危害，例如iPhone原意是要作為結合iPod（聽音樂）和手機功能的新裝置，如今卻成了app商人綁架用戶的平台。在數位科技令人上癮的特質中，少部分是偶然產生，絕大部分是商人刻意為之（許多科技企劃案皆是以「讓人忍不住想用」為起點）。我們為了追求些許便利，把新科技盲目地添加到生活中，回過...,2021-12-23 19:45:53,2021-12-23 19:45:53
9787521700800,大运营：房地产运营管理体系3.0,https://img2.doubanio.com/view/subject/l/public/s31946093.jpg,赛普管理咨询,,管理,中信出版社,"版本: 第1版, 平装, 中信出版集团股份有限公司",2021-12-23 19:45:58,2021-12-23 19:45:58
9787111651666,肖星的财务思维课,https://img3.doubanio.com/view/subject/l/public/s33640080.jpg,肖星,,管理,机械工业出版社,懂财务不只是会计的事儿。财务，不只是管钱，最重要的是让你透过数据，洞察经营的本质、管理的真相，实现人、事、资源的效益最大化。财务无小事，从成本、采购、资产管理，到薪酬激励、并购、投融资、财务报表，都能牵一发而动全身，哪一样都考验你的工作智慧。小到普通员工的项目审核评估，大到公司IPO上市，不管你是不是老板，都不可避免和财务打交道，是不是具备财务思维，决定了你的天花板有多高，决定了你的商业格局有多大。在作者看来，财务是职场的通用语，财务数据妙趣横生，浅显易懂，本书将让你具备“大财务思维”，读懂数据，透析经营的秘密，更好地创业、工作。,2021-12-23 19:46:04,2021-12-23 19:46:04
9787545463347,阿里局,https://img1.doubanio.com/view/subject/l/public/s29997189.jpg,和阳,,管理,广州经济出版社,这是一部鲜为人知的阿壁巴巴旱期创业史。作者凭一人之力，前后采写了数十人，历经两年多的调研、防谈(速记文字量近两百万)、资料收集，历时一年多的写作，全景式揭开了奠定阿嬖巴巴帝国的基石——中供铁军的神秘面纱。作者的写作初心是厘清“阿里灵魂”的四个内涵：理想主义和现实主义的协同术；价值观在一个创业公司的落地过程；人力与机器，时间的赛跑；828地推江湖沉浮录。这本书包含了那些临危受命、挽救困局于危难之间的英雄与草根，描述了他们的理想与现实、荣光与失落、坚守与离别、情义与铁血、利他与利己……书中细腻地再现了“中供系”各路英豪如何随着公司的成长而蜕变、进化、裂变和重生的全过程。他们的共同特点是骨子里有一种无法解释且隐约可见的阿里因子，这些构成了阿里的基因和血脉，蔓延至大竽个互联网江湖，改变了一个大时代。,2021-12-23 19:46:09,2021-12-23 19:46:09
9787553411217,你要如何衡量你的人生,https://img9.doubanio.com/view/subject/l/public/s24561045.jpg,[美]克莱顿·克里斯坦森,丁晓辉,管理,吉林出版集团有限责任公司,"2010年春，哈佛大学邀请克里斯坦森为毕业班的学生做演讲，请他向全体学生阐述如何把他的管理学创见运用于生活中。当时，他已被诊断出患有癌症，因此，在演讲中，他的很多观点都来自面对死亡时对“生命的价值”的感悟。他的演讲取得了极大的成功，不仅深深感动了现场的学生，也在新闻媒体和出版商中引起广泛讨论。由此，这本脱胎于哈佛演讲的书诞生了。这是一本面向大众读者的励志书籍，不过它并不普通，它不是那种道听途说的常识的汇编，而是作者把多年企业管理实践和研究中用到的缜密分析运用于对个人成功和幸福的研究，总结出了可以解释我们的选择与个人成功和幸福之间因果关系的理论。除了幸福,我们似乎拥有一切。可是幸福在哪里？这已是当下中国从个人到社会的大问题。这本书不提供答案，但却提供了寻找答案的方法。——中央电视台著名主持人 白岩松哈佛管理思想家克莱顿•克里斯坦森在书中提到的理...",2021-12-23 19:46:17,2021-12-23 19:46:17
9787544224383,给你自己一分钟,https://img1.doubanio.com/view/subject/l/public/s1326808.jpg,[美国]斯宾塞·约翰逊,周晶,管理,南海出版公司,本书通过生动的寓言，斯宾塞·约翰逊博士向我们说明：关心他人从关心自己开始，爱自己就是爱他人！仅仅用一分钟，斯宾塞博士引导我们找到内心的平和与宁静，改善人际关系，促进事业成功，并减轻来自工作与家庭中的压力，使我们的人生找到动力与意义。　　生活是由无数个一分钟组成的。了解这一点将使你的人生更加美好。在本书中，约翰逊博士以其一贯的实用智慧向我们展示：给自己一分钟，将会使你的一生走向完满与成功。　　　　　　　　　　　　　　　　　　　　－－《出版家周刊》,2021-12-23 19:46:23,2021-12-23 19:46:23
9787508668727,日本制造,https://img1.doubanio.com/view/subject/l/public/s29110527.jpg,[日]盛田昭夫,周征文,管理,中信出版集团,1946年，日本大型综合性跨国企业索尼公司由盛田昭夫和井深大先生共同创立，经过数十年的经营发展，成为全球知名的跨国企业集团，是世界视听、电子游戏、通讯产品和信息技术等领域的先导者与开创者之一。而盛田昭夫先生作为企业的灵魂，一直致力于将日本特有的企业精神及文化与自我的天赋与创新思维完美融合，并在实践中取得了巨大成功。那么，在如此优秀的日本式代表企业长期崛起在世界之巅背后，究竟蕴藏着什么不为人知的故事呢？《日本制造》 作为索尼创始者之一盛田昭夫先生唯一一部自传体商业战略论，结合盛田昭夫先生从童年起的亲身经历，以及成立索尼公司前后的创业故事——重逢井深先生、苦心所得的公司名“SONY”、走向世界、横跨地球村、进军海外市场等记叙，将索尼公司与盛田昭夫的成功秘笈、经营管理战略、创新思维方式及杰出的日本式企业如何在世界经济浪潮中安身立命并取得非凡成就的原因悉数...,2021-12-23 19:46:29,2021-12-23 19:46:29
9787111439684,奢侈品战略,https://img1.doubanio.com/view/subject/l/public/s27123457.jpg,（法）VincentBastien,谢绮红,管理,机械工业出版社,奢侈品不是完美，而是动人，视顾客的梦想为永恒追求。这部阐述奢侈品品牌的经典之作，与奢侈品本身一样，是一件世间稀缺的珍品。它出自两位奢侈品界的世界级专家之手，一位曾担任数家著名的顶级奢侈品公司的首席执行官和首席运营官，另一位是奢侈品学术研究的前沿学者和顶级品牌的战略顾问。这两位专家都拥有奢侈品行业丰富的从业经验，他们专长互补，为读者揭橥奢侈品风靡全球的所有秘密，为什么奢侈品让你如此着迷？读完本书你自有答案。透过专业的视角，你可以在书中自如追溯奢侈品的本源，体会奢侈品在历史积淀后留存的艺术与工艺价值。作者在书中总结欧洲奢侈品先驱们的成败得失，为读者提供了一个严格的蓝图，揭秘最高水平的奢侈品牌和企业管理的各个细节——奢侈品品牌对产品品质的至高追求、品牌价值的极致开发、经销商的严格把控、颠覆市场营销策略的营销手法、销售人员高明的沟通技巧，这是迄今为止你...,2021-12-23 19:46:35,2021-12-23 19:46:35
9787210076766,黑匣子思维,https://img2.doubanio.com/view/subject/l/public/s29507802.jpg,[英]马修·萨伊德,孙鹏,管理,后浪丨江西人民出版社,教你与失败化敌为友的创新指南与其糊涂地成功，不如聪明地失败......................※编辑推荐※☆ 一本得到英国卫生大臣推荐，引发英国上下反思其医疗制度与文化的振聋发聩之作。☆ 制度的缺陷、人性的弱点和对数据的偏见等因素，让失败成为现实中不可避免的一部分。如何正视失败并从中学习，是决定一项事业能否成功和持续成功的永恒论题。☆ 怎样的失败是好的？怎样的成功是坏的？作者集结丰富的事例进行发酵，从心理、经济、管理、文化等角度入手，探寻对失败和犯错的态度对商业、司法、医疗、体育以及我们日常生活和工作的方方面面造成了多么大的影响。......................※内容简介※“黑匣子思维”是一种记录和审视失败并从中吸取经验的积极态度。无论是开发新产品、提高运动技能还是做出正确决策，黑匣子思想者们从不惧怕面对失败，反...,2021-12-23 19:46:43,2021-12-23 19:46:43
9787300080666,管理工作的本质,https://img9.doubanio.com/view/subject/l/public/s2619226.jpg,亨利·明茨伯格,方海萍,管理,中国人民大学出版社,《管理工作的本质》是作者最知名的著作，奠定了其极具影响力的管理大师地位。他对管理工作的观察与研究，迄今无人能超越。明茨伯格的主要著作《管理工作的本质》，是经理角色管理学派最早出版的经典著作。很多人至今仍乐此不疲地回忆着当年明茨伯格《管理工作的本质》一书的命运。据说当年亨利 ·明茨伯格曾经把自己这篇博士论文的手稿寄给了15家出版社，但是都被一一退回了，亨利·明茨伯格修改了一次之后又寄了出去，才最终得到了一家出版社老板的青睐。然而，能够凭借此书一举奠定亨利·明茨伯格“经理人角色理论巨匠”的地位，恐怕不仅是这个出版商，也是亨利·明茨伯格自己没有想到的。在这本奠定其管理大师地位的著作中，他指出了4个对管理者的工作产生影响的变量，并将管理者的管理活动分为3个大类，在这3个大类中又细分管理者的工作角色为10种。于是，4个影响管理者工作的变量+3个类别的管理活...,2021-12-23 19:46:49,2021-12-23 19:46:49
9787111430667,HR转型突破,https://img3.doubanio.com/view/subject/l/public/s26817600.jpg,康至军,,管理,机械工业出版社,HR不断追逐专业时尚，以试图摆脱传统定位，进而转型扮演更重要的角色，但却往往又走入新的误区，甚至在组织中产生很多“副作用”。转型多年，HR为何依然招人憎恨，被业务主管视为需要智取的“敌人”？本书以德鲁克先生的人力资源理念为主线，通过对大师思想的解读和优秀企业实践的剖析，提出了中国企业HR转型的杠杆解：回归正确的角色定位、从客户需求而非职能专业出发、从目标成果而非专业活动出发、从假设而非最佳实践出发。作者跳出人力资源的专业局限，从更为宽广的视角采撷素材，通过大量的经典案例，对德鲁克近乎常识的理念进行了深入浅出的阐释，脉络分明、层层递进、一气呵成。德鲁克告诫说：“思考是很艰苦的工作，而管理时尚刚好是思考的完美替代品。”与热衷于介绍流行概念的书籍不同，本书试图厘清中国企业HR转型之道，强调回归管理常识，启发读者的思考。,2021-12-23 19:46:55,2021-12-23 19:46:55
9787111241478,刀锋上的舞蹈,https://img1.doubanio.com/view/subject/l/public/s5950587.jpg,姆斯M.基尔茨,姜文波,管理,机械工业出版社,他穿着浆过的衬衫，海军蓝的领带一丝不苟。詹姆斯·基尔茨正在为他吉列的演讲进行第4次彩排。詹姆斯·基尔茨非常注重细节；詹姆斯·基尔茨从来不打无准备之仗。而他的工作就是：拯救濒于崩溃的企业。詹姆斯·基尔茨堪称世界上最神奇的CEO，他历任三家跨国消费品巨头公司：卡夫、纳贝斯克、吉列。在这三家企业濒于危难之际，他临危受命，成功使它们从谷底跨越巅峰。在他 30 多年的职业生涯中，基尔茨设计出了一个拯救“问题”企业的“蓝图”。这不是尖端的火箭科学，但却是一个一丝不苟和步步到位的过程。他没有梦想吉列宏伟的远景，而是晚上工作到深夜，考虑卖电池应该使用6只还是8只包装；他没有集结全体员工大讲吉列如何改变世界，而是放幻灯片，与竞争对手比较费用的高低。这并不引人入胜，但他抓住了关键，这的确奏效了。·基尔茨上任前的吉列：零增长，连续15个季度没实现盈利预期，市场...,2021-12-23 19:47:01,2021-12-23 19:47:01
9787550270701,做出好决定,https://img3.doubanio.com/view/subject/l/public/s28661180.jpg,[美]斯蒂芬·P·罗宾斯（StephenP.Robbins）,包云波,管理,北京联合出版公司·后浪出版公司,管理学、组织行为学巨擘畅销书作者罗宾斯新作...................※编辑推荐※我们的人生是由一个个决定所构成的，所以“做决定”可以称得上是生存的必备技能。作者用轻松易懂的语言分析日常生活中的常见案例，告诉我们如何避开雷区、做出决定。本书总结了千余篇决策学的相关研究，针对不同读者的个性特点给出12条建议；此外，书中也分析了大家普遍存在的17个心理陷阱，帮助读者反思自身，不再因错误的决策而后悔。作者罗宾斯为管理学、组织行为学大家，亦长期研究从事决策学研究。其著作曾被以为20种语言、畅销600多万册。...................※内容简介※决定塑造未来：重大的决策能够影响我们的人生轨道，而小决定也会改变我们的生活。因此，如何改善决策质量、做出好决定，是我们最重要的生存技能。作者总结千余篇行为决策领域的相关研究，用...,2021-12-23 19:47:09,2021-12-23 19:47:09
9787521713664,光环效应,https://img2.doubanio.com/view/subject/l/public/s33613652.jpg,[美]罗森维,李丹丹,管理,中信出版社,正如股市上涨，我们会分析出一堆上涨的理由一般，对于一家成功的公司，分析师们也会认为它的管理是优秀的、企业文化是有凝聚力的、战略是有前瞻性的；而一旦业绩急转直下，当初前瞻性的战略就会变成鲁莽，有凝聚力的文化会被说成一言堂，不然，那些成功的故事，怎么讲得顺口呢？我们总是希望对商业的成功有一些合理的、确定的解释，进而提供一些明确的行为指示，迅速简单，逻辑合理。成功是结果，却常常被当成原因。它也往往不像我们想象的那样持久，大部分情况下，长盛不衰只是事后按结果选择产生的假象。那么，是什么让我们对商业世界产生了错误的理解？导致我们误解公司业绩本质的种种认知花招是什么?瑞士洛桑管理学院的教授罗森维通过多年的企业调研和教学指出，实际上，我们的商业思维落入了一系列认知陷阱，包括光环效应、因果联系、单一解释、专注胜者、缜密研究、长盛不衰、绝对业绩、本末倒置、组织物理学...,2021-12-23 19:47:15,2021-12-23 19:47:15
9787500653400,要事第一,https://img1.doubanio.com/view/subject/l/public/s26601718.jpg,[美]史蒂芬·柯维,刘宗亚等,管理,中国青年出版社,《要事第一》是《高效能人士的七个习惯》的延伸与加强版，柯维思想的核心精髓之一。不是给你提供另外一个时钟，而是给你一个罗盘——因为比速度更重要的是前进方向。全书更多地强调一个人自我意识的觉醒，并以此为发端，唤醒良知；并以想象力勾画蓝图，以自由意志完成实践。打破了我们原有的时间管理观念，提出了以原则为中心的方法，它超越了推崇更快捷、更努力、更机灵的传统方法。世界500强企业都在运用这一全新的时间管理方法，鼓舞每一个人追求诚信、勇敢和乐于奉献的生活。《要事第一》诠释了“为要事安排日程”的关键思维：第一，什么是重要的事情，如何才能让自己快乐，提高效率。第二，如何制定周计划，也就是以“重要性”作为决策思维，提出全新的时间管理方法。我们相信，《要事第一》的灿烂光芒照亮了时间管理技巧那一半尚不为人所知的黑暗部分。我们看到的不是我们生活的零星碎片，而是完整的画面...,2021-12-23 19:47:22,2021-12-23 19:47:22
9787121141225,跟司马懿学管理,https://img9.doubanio.com/view/subject/l/public/s8471175.jpg,赵玉平,,管理,电子工业出版社,《跟司马懿学管理》是中央电视台《百家讲坛》赵玉平“麻辣说三国”系列节目同名图书之一。司马懿是三国时期魏国杰出的政治家、军事家，西晋王朝的奠基人，是辅佐了魏国三代的托孤辅政之重臣，后期成为全权掌控魏国朝政的权臣，平生最显著的功绩是多次亲率大军成功对抗诸葛亮的北伐。《跟司马懿学管理》通过描述司马懿一生中遇到的众多历史事件，分析他的应对策略和处事技巧，着重对司马懿的管理才能进行详尽的分析，并与今天的职场生活相结合，把东方智慧与现代理念相结合，语言生动幽默，点评到位，妙趣横生。,2021-12-23 19:47:28,2021-12-23 19:47:28
9787501234493,大思想的神奇,https://img1.doubanio.com/view/subject/l/public/s8952157.jpg,大卫·舒瓦茨,赖伟雄,管理,,《大思想的神奇:成就事业的秘密(全新翻译版本)》是一本在欧美畅销多年的书，这是一本与《人性的弱点》和《思考致富》齐名的书。从《大思想的神奇:成就事业的秘密》出版以来，已经有数百万人通过学习和阅读《大思想的神奇:成就事业的秘密》以及参加相关培训，极大地改善了自己的生活。《大思想的神奇:成就事业的秘密(全新翻译版本)》的作者大卫·舒瓦茨博士已经被公认为世界上最伟大的励志和成功学大师。《大思想的神奇:成就事业的秘密(全新翻译版本)》能帮助你销售得更多，管理得更好，赚得更多……帮助你在各方面取得彻底成功！《大思想的神奇:成就事业的秘密(全新翻译版本)》没有空洞的许诺——只为你提供切实可行的方法。大卫·舒瓦茨博士为你精心设计了让你的工作、婚姻、家庭、态度、社区彻底改观的“实践程序”，关键是能让你事半功倍。他告诉你成功不一定要靠你的天赋或者智慧，普普通通的人只...,2021-12-23 19:47:33,2021-12-23 19:47:33
9787532716395,钱商,https://img1.doubanio.com/view/subject/l/public/s2878738.jpg,阿瑟黑利,陆谷孙,管理,上海译文出版社,有1996年5月2印本。兩次累計印3萬冊。,2021-12-23 19:47:40,2021-12-23 19:47:40
9787516222065,黑金世界,https://img1.doubanio.com/view/subject/l/public/s33660507.jpg,[英]汤姆·温莱特,黄嘉天,管理,中国民主法制出版社,☆ 亚马逊2016年度图书 （Amazon Best Book of 2016），美版豆瓣Goodreads 7000+好评。☆ 读者惊呼：“根本停不下来，这本书实在太有趣了！”☆ 屡禁不绝的毒品产业背后，遵循着哪些经济学规律？如果用商业逻辑来分析毒品产业，会产生怎样的效果？☆  2500万买家、年利润高达3000亿美元的黑金帝国，究竟如何运转？☆《经济学人》记者汤姆·温莱特深入中美洲卧底调查三年，全方位破解非法毒品产业的商业根基。本书作者汤姆·温莱特曾任《经济学人》杂志驻墨西哥城记者，他潜入拉丁美洲，在毒品产业前端深入调查三年，掌握了大量的第一手资料，接触到了令人触目惊心的现实。随着研究的深入，他逐渐发现：即使是邪恶又神秘的毒品产业，也面临着与世界500强公司相同的战略问题，贩毒集团也在不断向大型跨国企业借鉴商业运营的手段。当贩毒集团开...,2021-12-23 19:47:45,2021-12-23 19:47:45
9787549580842,美术馆的秩序,https://img3.doubanio.com/view/subject/l/public/s28789640.jpg,蓝庆伟,,管理,广西师范大学出版社,近年来，政府对市民的文化和休闲需求越来越重视，加大了相关文化服务设施和场馆的建设力度，也带动民间掀起了文化场馆的建设风潮。中国美术馆建设进入“高潮”期的同时，也带来了诸多问题。蓝庆伟的《美术馆的秩序》一书，是美术馆建设热潮下的冷思考。作者分别从美术馆文化、美术馆意识、美术馆的场馆设计、美术馆的功能以及美术馆的文创经济等多个方面来展开，基于对国际上著名美术馆的考察和思考，指出了目前国内不少美术馆管理者的认识误区，从文化和系统的高度来解读美术馆在设计、收藏、运营和研发等诸多环节。书中不仅有理论深度和前瞻性见解，而且不乏典型的案例分析，为中国的美术馆发展提出了许多建议。,2021-12-23 19:47:50,2021-12-23 19:47:50
