9781604659368,Criterion Designs,https://img1.doubanio.com/view/subject/l/public/s28291899.jpg,TheCriterionCollection,,设计,TheCriterionCollection,"The most exciting names in design and illustration today apply their talents to some of the most important and influential films of all time. This volume gathers highlights from designs commissioned by the Criterion Collection, featuring covers, supplemental art, and never-before-seen sketches and concept art plus a gallery of every Criterion cover since the collection's first ...",2021-12-24 18:54:34,2021-12-24 18:54:34
9787800008030,印谱 （第二版）,https://img9.doubanio.com/view/subject/l/public/s4389284.jpg,刘积英主编,,设计,印刷工业出版社,"印刷工艺的集合.156种,够让人眼花缭乱的,够让人惊叹不已的!",2021-12-24 18:54:40,2021-12-24 18:54:40
9787559609441,杨占家电影美术设计作品集,https://img9.doubanio.com/view/subject/l/public/s29669014.jpg,霍廷霄,,设计,后浪丨北京联合出版公司,他是电影界国宝级美术巨匠，绘图功底堪称一绝曾与陈凯歌、张艺谋、李安、王家卫合作了《霸王别姬》《卧虎藏龙》《东邪西毒》等传世经典从其3000多张手绘稿中精选600余幅汇编而成北京电影学院美术教学临摹范本...................※编辑推荐※从《红楼梦》的怡红院到《霸王别姬》的梨园戏班从《夜半歌声》的西洋建筑到《西楚霸王》的阿房宫他规划每秒24格电影胶片的空间氛围，以利落线条设计想象画面的建筑实景从李安《卧虎藏龙》到徐克《七剑》从吴宇森《赤壁》到张艺谋《满城尽带黄金甲》他用最专业的建筑设计手稿，为每一个造梦的电影导演绘就最坚实的蓝图他就是中国电影界的美术巨匠——杨占家先生这是一部横跨中外制作、纵览杨占家先生近40年电影美术创作生涯的专业图集。手绘可贵，因初心不改。在这厚厚的图集中，看不到枯燥呆板的计算机标准线条，瞧不...,2021-12-24 18:54:46,2021-12-24 18:54:46
9787541086748,Mondo电影海报艺术典藏,https://img2.doubanio.com/view/subject/l/public/s33546871.jpg,[美]Mondo公司,江汇,设计,四川美术出版社,全世界导演都想请Mondo公司做海报一秒售罄，绝不重印，高概念设计迪士尼、吉卜力、漫威、DC、乐高争相合作昆汀倒贴官方盖章的「同人厂牌」让《水形物语》导演、甲方德尔托罗惊呼OMG「买它」震撼！超值！美晕了！300张绝版海报大公开收藏级画册，中文世界首发！完美复刻，颜值炸裂，钜惠上市特8大尺寸全画幅开本+长幅宽银幕拉页，展现动人细节高精度真实色彩还原，每一页皆享有护色防磨光油的精心保护📖 编辑推荐什么！？传说中的Mondo限量海报，出！书！了？这家“靠海报成名”的文创公司，是迪士尼、吉卜力、漫威、DC、乐高争相“倒贴”合作的对象。Mondo出品的艺术海报，令奥斯卡金奖导演德尔托罗兴奋惊呼OMG，国会图书馆、奥斯卡学院竟然也破天荒收藏存档！随便哪一张Mondo海报，都太上头了。每有新款海报上架，一秒就能售罄。影迷抹泪哭诉——...,2021-12-24 18:54:53,2021-12-24 18:54:53
9787559644565,贝聿铭全集,https://img2.doubanio.com/view/subject/l/public/s33823301.jpg,[美]菲利普·朱迪狄欧,黄萌,设计,北京联合出版公司,贝聿铭工作室同事撰文，图文并茂展现其各时期代表作和思想唯一得到贝聿铭生前认可并亲自作序的作品全集贝氏同事兼学生林兵审校并作序推荐全新译本，增添多幅照片，成就更加完善的版本◎ 编辑推荐☆ 全新译本，遴选贝聿铭的50个建筑项目，以权威视角全面展示其超越时代的建筑思想以时间顺序选择了贝聿铭各个时期担任负责人或建筑设计师的50个建筑项目，图文并茂地介绍了贝氏接受委托的项目，从具体建筑项目中展现贝聿铭的内在建筑思想。书中图片包括建筑实拍图、设计平面图、剖面图、建筑过程图等等；与贝聿铭共事近20年的同事撰写文章，从独到的视角到我们理解贝聿铭和他的建筑作品。全新版本邀请新译者重新翻译，译文力求专业而流畅，不仅订正了外版原稿中的错误，还将此前译本中未译的参考文献、贝聿铭作品名录等，悉数译出，提供给读者更全面翔实的资料信息。☆ 贝聿铭的同事、学生林兵为...,2021-12-24 18:54:59,2021-12-24 18:54:59
9787535673312,亚历山大·麦昆：野性之美,https://img9.doubanio.com/view/subject/l/public/s29483695.jpg,[英]安德鲁·博尔顿,邓悦现,设计,后浪丨湖南美术出版社,2011年美国大都会艺术博物馆轰动业内的时尚大展同名图录精美大图呈现时尚“鬼才”麦昆的百余件标志性设计作品...................※编辑推荐※♦ 以跨越近20年的百余件时尚单品，串联起时尚“鬼才”麦昆与团队打造的30多个  时装系列，再现2011年轰动业内的时尚盛会。♦ 著名时尚摄影师为本书拍摄精美大图。扎实精湛的裁缝手艺、令人眼花缭乱的科技手段、代表着高级定制的创意裁剪与精细工艺在这些优美的时装照片中尽数展现。♦ 来自本书作者的研究、麦昆的自我宣言和其合作伙伴及继任者的追忆，揭示了麦昆的精妙设计所包裹的灵魂——民族情怀、故事传说、丰富的艺术源头和对未来的惊艳想象。...................※内容简介※他是伦敦东区的穷小子，十六岁辍学后成为萨维尔街的裁缝学徒，继而其名字——亚历山大·麦昆（Alexander...,2021-12-24 18:55:04,2021-12-24 18:55:04
9787208029644,毁烬蓝图,https://img1.doubanio.com/view/subject/l/public/s4614347.jpg,阮千瑞,,设计,SubJam,18 X 24厘米，260页，四色印刷实验音乐海报和唱片设计。阮千瑞，2006年加入撒把芥末。海报涉及水陆观音，Mini Midi音乐节，王凡，颜峻，FM3，李劲松，巫娜，小河，林其蔚，车前子，李剑鸿，Zbigniew Karkowski，C.C.C.C.，William Basinski，Justice Yeldham，Carl Stone，大友良英，Sachiko M，Fred Frith……唱片封套：万晓利，宋雨哲，万能青年旅店，折磨护士，李增辉……,2021-12-24 18:55:09,2021-12-24 18:55:09
9781781166864,How to Draw Drawing and Sketching Objects and Environments from Your Imagination,https://img9.doubanio.com/view/subject/l/public/s27064775.jpg,"Robertson,Scott",,设计,DesignStudioPress,,2021-12-24 18:55:15,2021-12-24 18:55:15
9780060976255,Understanding Comics,https://img1.doubanio.com/view/subject/l/public/s29611527.jpg,ScottMcCloud,云中漫步,设计,WilliamMorrowPaperbacks,内容简介：系统的介绍了漫画的发展沿革、艺术语言、表现手法，是一本向大众普及漫画艺术的入门作品——它用简单的画面告诉人们，漫画不是宅男的读物，而是一种拥有强烈表现力的艺术形式。,2021-12-24 18:55:21,2021-12-24 18:55:21
9784579111701,パタンマジック vol.2,https://img2.doubanio.com/view/subject/l/public/s3407543.jpg,中道友子,,设计,文化出版局,,2021-12-24 18:55:27,2021-12-24 18:55:27
9787550224278,暴雪的艺术,https://img9.doubanio.com/view/subject/l/public/s27996186.jpg,美国暴雪娱乐股份有限公司,,设计,北京联合出版公司,《暴雪的艺术》是暴雪公司在成立20周年之际推出的暴雪艺术特辑，综合介绍暴雪20年间的发展历程和鲜为人知的游戏原画设定资料，这本书将成为史上第一本直接以暴雪公司命名的游戏艺术图鉴。《暴雪的艺术》共350页，包含近800份——涉及《魔兽世界》、《星际争霸》、《暗黑破坏神》的概念设计图、 插画和素描等，其中还包括许多未实施的游戏方案。 同时还由暴雪高级副董事——ChrisMetzen；高级创作主任——Sam Didier；和艺术及动画开发副总裁——Nick Carpenter亲自附加的内容标注，讲述有关各个游戏系列的开发历程，其中暗黑派艺术大师Brom为此书篡写了前言。该书可谓是“群星云集”。暴雪娱乐彻底改变了游戏世界。从1991年最初只有三个人的街机游戏开发工作室，到后来推出轰动全球的魔兽争霸、星际争霸和暗黑破坏神系列，暴雪在二十多年的时间里创造了...,2021-12-24 18:55:32,2021-12-24 18:55:32
9780881792065,The Elements of Typographic Style,https://img9.doubanio.com/view/subject/l/public/s4230265.jpg,RobertBringhurst,,设计,HartleyandMarksPublishers,"Renowned typographer and poet Robert Bringhurst brings clarity to the art of typography with this masterful style guide. Combining the practical, theoretical, and historical, this edition is completely updated, with a thorough exploration of the newest innovations in intelligent font technology, and is a must-have for graphic artists, editors, or anyone working with the printed...",2021-12-24 18:55:39,2021-12-24 18:55:39
9787208147454,经典企鹅：从封面到封面,https://img1.doubanio.com/view/subject/l/public/s29902279.jpg,[美]保罗·巴克利编著,邹欢,设计,上海人民出版社,我们的设计师总能直面挑战，拒绝平淡无奇、只求新颖巧妙，可能会有些颠覆，但始终很企鹅。——艾尔达·鲁特，企鹅经典副总裁成立于1935年的企鹅图书是一家被全世界读者和出版业同行敬重的出版机构，其装帧设计更是引领出版业多年。作为其几十年设计风格的沉淀，企鹅的创意总监保罗·巴克利曾于2010年企鹅图书成立75周年之际出版了《企鹅75》，书中精心挑选了在过去数十年间最能代表企鹅风格的75款图书封面。作者更是在书中讲述了未被外界知晓的封面设计幕后故事，让读者得以一窥图书封面从最初的创意到最终确定的复杂历程。大受欢迎的《企鹅75》如今迎来了续作，《经典企鹅：从封面到封面》。结合艺术家和作家娓娓道来的评论，保罗·巴克利精心策划并展示了十多年来那些令人惊艳的封面设计及其背后的故事。如果你喜欢文学经典、书籍设计和一切企鹅的东西，《经典企鹅》不容错过。,2021-12-24 18:55:44,2021-12-24 18:55:44
9787800007842,印谱,https://img3.doubanio.com/view/subject/l/public/s3509610.jpg,左右尚,,设计,印刷工业出版社,《印谱》由印刷工业出版社出版。,2021-12-24 18:55:49,2021-12-24 18:55:49
9787508652962,运动中的视觉,https://img9.doubanio.com/view/subject/l/public/s28766906.jpg,[匈]拉兹洛·莫霍利·纳吉,周博,设计,中信出版社,1947年，《运动中的影响》出版后，如今已经是第8版。全书有440幅配图，其中11幅是彩色图片。本书是对1947年前后现代设计运动的一个详尽的视觉汇编。包括包豪斯和新包豪斯时期很多设计大师的作品，包括马歇?布劳耶（Marcel Breuer）、格罗皮乌斯（Walter Gropius）、奥斯卡?史莱姆（Oskar Schlemmer）和赫伯特?拜耶（Herbert Bayer）等。出现在本书里的艺术家、建筑家、设计师和摄影家都是20世纪现代运动中里程碑式的人物。如阿尔瓦?阿尔托、赫伯特?拜耶、德里弗斯、柯布西耶、格罗皮乌斯、保罗?兰德、怀特等。格罗皮乌斯评价：“本书是将会是设计教育里的先锋。”,2021-12-24 18:55:56,2021-12-24 18:55:56
9787106123451,iOS Human Interface Guidelines,https://img1.doubanio.com/view/subject/l/public/s27290288.jpg,Apple,,设计,,http://developer.apple.com/library/ios/#documentation/UserExperience/Conceptual/MobileHIG/Introduction/Introduction.html,2021-12-24 18:56:01,2021-12-24 18:56:01
9787549597147,风·落·之·光--ECM唱片的视觉语言,https://img9.doubanio.com/view/subject/l/public/s29811695.jpg,[瑞士]拉尔斯·穆勒,张璐诗,设计,广西师范大学出版社,1969年成立的德国独立唱片厂牌 ECM，在爵士乐与当代古典音乐领域建立了纯粹的音乐帝国，其极具辨识度的封套设计也成为ECM审美体系的重要组成部分。克制、简约，神秘而富有诗意。50年来，ECM 一直与商业保持距离，却在唱片界始终夺目，对全世界的音乐家和乐迷充满吸引力。《风·落·之·光——ECM唱片的视觉语言》由知名出版人拉斯·缪勒主编，邀请了包括艺评家托马斯· 施泰因费尔德、禅学艺术研究者卡塔琳娜· 艾普莱西特、电影学者杰夫· 安德鲁、音乐家克提尔· 毕昂施塔德在内的多位作者，从不同角度探索 ECM 在1996-2010年间的视觉设计与音乐的关系。书中收录1200余幅图片，读者可从中了解这一伟大唱片厂牌的美学理念及幕后故事。,2021-12-24 18:56:07,2021-12-24 18:56:07
9780997513813,Designed by Apple in California,https://img1.doubanio.com/view/subject/l/public/s29153187.jpg,Apple,,设计,Apple,"“Designed by Apple in California” chronicles 20 years of Apple design through 450 photographs of our products and the processes used to make them. A visual history spanning iMac to Apple Pencil, complete with descriptions of innovative materials and techniques, it captures every detail with honesty and intention. Printed on specially milled German paper with gilded matte silver...",2021-12-24 18:56:12,2021-12-24 18:56:12
9780141044668,Postcards from Penguin,https://img9.doubanio.com/view/subject/l/public/s4136896.jpg,Penguin,,设计,Penguin(Non-Classics),,2021-12-24 18:56:18,2021-12-24 18:56:18
9783721201451,Grid Systems in Graphic Design,https://img9.doubanio.com/view/subject/l/public/s28807735.jpg,JosefMüller-Brockmann,,设计,"BraunPublish,Csi",瑞士平面设计先驱约瑟夫·米勒–布罗克曼 (Josef Müller-Brockmann) (1914.5.9 - 1996.8.30) 是瑞士的一位平面设计师和教师，曾于苏黎世的大学与艺术工商学校修习建筑、设计与艺术史专业。1936年，他在苏黎世开了一家专门从事 平面设计、展会 设计与摄影的工作室。1951年起，他开始为苏黎世的音乐厅设计音乐会海报。1958年，他成为了《新平面设计》(New Graphic Design) 的主编，与 R.P. Lohse、C. Vivarelli、H. Neuburg 共事。1966年，他被任命为IBM的欧洲设计顾问。布罗克曼因他的极简主义设计与简洁的排版、图形和色彩而闻名，他的设计对21世纪的众多平面设计师都产生了重大影响。他还出版了多本视觉传达与设计类书籍。监修 杨林青，1999年毕业于清华大学美术学院视觉传...,2021-12-24 18:56:23,2021-12-24 18:56:23
9789862355336,Design by wangzhihong.com,https://img9.doubanio.com/view/subject/l/public/s28982624.jpg,王志弘,,设计,臉譜,從不公開演說的王志弘，第一次親筆寫下100本書的發想原點與構思過程，他想說的話、想做的事大都藏在這本書裡。「我在書籍設計中磨練技巧、尋找到方向，更重要的是建立起ㄧ個屬於自己的設計觀，展示在大眾面前。設計師時常會將名字標註在折口，我同樣也在折口的ㄧ角留下屬於自己的記號：Design by wangzhihong.com。Design by wangzhihong是圖錄的部分，收錄2001年至2016年中的部分作品，Text by wangzhihong則是針對其中100本書，以隨筆的形式記錄下當時的一些想法，兩者完全依照年份安排，讀者可以從中完整瀏覽ㄧ位設計師的發展歷程，以及在出版設計上的各種試探與衝撞的成果。」全書504頁，蒐錄200本書、542個圖像、32000字，是台灣最具分量的平面設計師作品選，探見一個現代主義平設計師風格的誕生與成長軌跡。以...,2021-12-24 18:56:34,2021-12-24 18:56:34
9787112116027,园林景观设计：从概念到形式,https://img3.doubanio.com/view/subject/l/public/s6177370.jpg,[美]格兰特·W.里德,郑淮兵,设计,中国建筑工业出版社,对于设计师来说，一个很令人头痛的事就是把概念转化为特定的、详细的空间组织形式。《园林景观设计》(从概念到形式)提供的一些生动、实用的技巧，能把这一转化过程变得更加容易，使之更富有成效。《园林景观设计:从概念到形式(原著第2版)》中提供的方法在传统的和非传统的景观设计中得以印证，为设计思路和方案图提供了概念和哲学方面的基础。里德利用几何图形和自然图形色画出最终的设计方案。,2021-12-24 18:56:40,2021-12-24 18:56:40
9787313169952,我是怎么设计航空发动机的,https://img9.doubanio.com/view/subject/l/public/s32311964.jpg,斯坦利·胡克StanleyHooke,王岭,设计,上海交通大学出版社,斯坦利.胡克先生的这本自传，用带有英式幽默的生动的语言，讲述了他生命中与航空发动机有关的种种故事。以他从一个数学专业学生，成长为世界知名航空发动机公司工程掌门人的成功职业生涯为主线，详细描绘了其亲身经历的一系列航空发动机的研制过程和诸多细节，其中有着丰富的、真实的工程技术问题的讨论和经验教训的总结。这些内容涵盖了影响航空发动机发展的工程技术、项目管理、企业运营，甚至国家战略的各个方面，是在大学课本和一般技术文献上无法学到的知识，也是今天的航空发动机行业可遇而不可求的宝贵经验。同时，作者用简单易懂的方式，清晰介绍了航空发动机的基本原理和技术演进历程，让普通读者也能够建立起航空发动机的完整认识。从事制造业、尤其是航空发动机和燃气轮机行业的技术和管理人员，有志于成为优秀工程师的年轻学子，以及航空航天爱好者和关心航空发动机事业的读者，都能从书中找到对自己的工...,2021-12-24 18:56:45,2021-12-24 18:56:45
9781861542748,Sagmeister,https://img1.doubanio.com/view/subject/l/public/s1629627.jpg,PeterHall,,设计,Thames&amp;Hudson,,2021-12-24 18:56:50,2021-12-24 18:56:50
9783037781050,Designing Design,https://img1.doubanio.com/view/subject/l/public/s4245989.jpg,KenyaHara,,设计,LarsMullerPublishers,日本平面设计大师原研哉先生，日本设计中心代表，武藏野美术大学教授，无印良品咨询委员会委员他以一双无视外部世界飞速发展变化的眼睛面对“日常生活”，以谦虚但同时尖锐的目光寻找其设计被需要的所在，并将自己精确地安置在他的意图能够被赋予生命的地方。当我们的日常生活正在越来越陷入自身窠臼之时，他敏锐地感知到了设计的征候和迹象，并且自觉自主地挑战其中的未知领域。他的设计作品显现出来的不落陈规的清新，在于他找到了设计被需求的空间并在其中进行设计。在这样的态度下，他拓展了设计的视野和范畴，在他所经历之处，崭新的地平线不停地被发现和拓展。,2021-12-24 18:56:57,2021-12-24 18:56:57
9789578548244,艺术.设计的平面构成,https://img9.doubanio.com/view/subject/l/public/s3142865.jpg,朝倉直巳,呂清夫,设计,北星圖書,主要内容:本书因系“平面构成”的著作，所以各造型专业共同基础的形态、色彩、材料、构图、构思法等当中的平面关系为对象。对涉及色彩的内容，除在论述中特别需要外，予以省略。用节省下来的篇幅，对“形态”、“构图”、“构思法”及其他有关平面造型的技法、材料效果等的篇章予以充实，以期扩充与深化“平面构成”的范围。因此，有可能会遇到对部分相当深入的问题的解释，及对初学者来说出现稍感困难的专门主题。本书从第一章起始到第45页，选登了20世纪初以来对构成有深入研究的艺术家的作品，并在其后的正文中，也选收了一些活跃于第一线的艺术家的作品。本书目录:1 平面构成的目的；2 造型的要素；3 造型文法A——构图：离心的构图；向心的构图；构图的平衡感觉；4 造型文法B——幻像的创造：错视与无理图形（A）；错视与无理图形（B）；三维的幻像（A）；三维的幻像（B）；四维的幻像...,2021-12-24 18:57:02,2021-12-24 18:57:02
9787517027720,毫无PS痕迹,https://img1.doubanio.com/view/subject/l/public/s29053299.jpg,赵鹏,,设计,中国水利水电出版社,《毫无PS痕迹-你的第一本Photoshop书》是一本完全为初学者自学而著写的PS教程。配有高清视频实操讲解DVD一张，包含200多个精彩案例。全书分为四大部分：（一）第1、2章讲解色彩和图像的原理与基础知识要点。（二）第3至11章全面讲解了使用Photoshop进行各种设计创作的方法与技巧。这包括色彩调整工具的使用、极其重要的选区、蒙版与图层的运用及巧妙的图像合成操作，各类工具、图层样式与滤镜的运用，以及学习如何绘制矢量路径和各种文字处理技巧。（三）第12章讲解了随着数码单反的普及而变得日益重要的数码摄影后期处理的各种技巧，完成对Camera RAW（即内置版LightRoom）的学习。（四）第13章为综合实例。通过多个精心设计的实例的制作过程，让你看到前面12章所学习的各种知识与技术在实际设计与创作过程中是如何结合起来运用的。,2021-12-24 18:57:07,2021-12-24 18:57:07
9787560954486,形式综合论,https://img9.doubanio.com/view/subject/l/public/s4205156.jpg,克里斯托弗·亚历山大,王蔚,设计,华中科技大学出版社,"《形式综合论》(Notes On The Synthesis of Form)是亚历山大最重要且最常被引用的著作之一,该书奠定了亚历山大一生学术工作的基础,同时也是之后兴起的寻求设计方法运动的基本读本之一。在书的第一部分，亚历山大讨论了形式因背景而生，而环境背景的出现根本是为了满足人类的需要这一过程。他表明，这种自适应的过程只有在逐步推进的情况下才能成功实现，而不是一蹴而就。因为，形式产生于传统的非自我意识的文化，不是由设计师创造的，而是经由传统格局的缓慢变化成型，其形成和适应过程非常优美。而在我们自我意识的文化中，一个设计师应背景需要去创造一种形式，是失败的，因为，先入为主的概念导致他为解决问题而构建的图像与实际问题的内在组成并不相符，因此只会导致随意性、任意性、缺乏实际了解，困扰现代建筑和现代城市的设计。在第二部分中，亚历山大提出的方法是，设...",2021-12-24 18:57:14,2021-12-24 18:57:14
9784861522475,配色事典―大正・昭和の色彩ノート,https://img9.doubanio.com/view/subject/l/public/s4449984.jpg,和田三造,,设计,青幻舎,大正~昭和初期のモダンな色づかい348パターンを収録。現代によみがえるコンパクトな配色見本帖！「配色」という概念が一般に認識されていなかった大正~昭和初期において、いち早く色彩の必要性に着目 し、『配色總鑑』（全6巻・1933年~）を編纂した和田三造。それは、わが国の色彩文化のさきがけとも言うべ きもので、具体的な配色パターンを表した画期的な「配色見本帖」でした。本書は名著「配色總鑑」を新装・改訂版 として復刻。収録された配色は、大正・昭和の資料のみならず、現代においても活用できる普遍的な感性が読み取ら れます。■348通りの配色見本を収録■すべての色表にCMYK値、カラーチップ 付■カラーコーディネーター、インテリアコーディネーターほかあらゆる分野の研究、実用に最適で す和田三造（わだ・さんぞう）昭和初期、色彩の重要性...,2021-12-24 18:57:19,2021-12-24 18:57:19
9787531408758,黑白画理,https://img1.doubanio.com/view/subject/l/public/s6112968.jpg,王弘力,,设计,辽宁美术出版社,《黑白画理》无疑是一部囊括绘画规律和原则的学术力作。它始于从远古迈入，终于向未来走去。深刻、透彻，深入浅出的精练文字，进行理论概述。并在每一段文字之后又精选有说服力的，形象鲜明的，生动完美的图画为范例加以配合。,2021-12-24 18:57:24,2021-12-24 18:57:24
9789063691714,Sketching,https://img2.doubanio.com/view/subject/l/public/s26716123.jpg,KoosEissen,,设计,BisPublishers,"Are designers still making drawings by hand? Isn’t it more advanced to use a computer in this computer era? Some may think sketching is a disappearing skill, but if you ever enter a design studio, you will find out differently. Studios still make sketches and drawings by hand • and in most cases, quite a lot of them. They are an integral part of the decision-making process, use...",2021-12-24 18:57:30,2021-12-24 18:57:30
