9787562470632,字体传奇,https://img2.doubanio.com/view/subject/l/public/s24231011.jpg,拉斯·缪勒,李德庚,设计,重庆大学出版社/楚尘文化,●首次披露Helvetica字体创作的原始手稿●291幅未公开的珍贵图稿，50年代以来席卷全球的字体设计风尚，为您一一呈现！●一款字体背后的惊世传奇，一部图文并茂的西文无衬线字体简史●苹果、微软、英特尔、宝马、丰田、无印良品……百家世界跨国企业LOGO和公务用字的 首选字体！●吕敬人、王序、朱志伟、王绍强、陈嵘、赵清、广煜、蒋华、李少波、袁由敏、卢涛、何明 联名推荐！这是一本关于传奇字体Helvetica的图文书。本书通过大量从未出版过的珍贵资料，以开阔的视野呈现了字体Helvetica所历经的社会、文化甚至于跨时代的演变过程，还普及了关于字体的通俗知识，以及世界范围内广为流传的字体特征。此书非但是专业设计师们的必备读物，对大众读者也同样具可读性。名家评价吕敬人(清华大学美术学院):一种文字在国际上广为认同、广泛使用，展现着一种优秀文化...,2021-12-24 20:13:27,2021-12-24 20:13:27
9787550318687,10公分,https://img1.doubanio.com/view/subject/l/public/s32304009.jpg,[日]三谷龙二,王彤,设计,中国美术学院出版社,本书是一本店长日记。记录日本木艺家三谷龙二在远离东京的小城镇——松本开设艺廊“10公分”的整个过程。书中真切记录他开店前后细微的心理活动，包括为什么租用废弃的房屋、为什么选择这样的店名。除此之外，还从实用性的角度展示了整间店铺整修装饰的细节，包括地板的选择、涂料与自己作品的配合、窗周的设计等等。而这些文字都在告诉我们，设计的每一个具体决定背后，都有作者对自身、对这座城市最充实的思考。,2021-12-24 20:13:32,2021-12-24 20:13:32
9787562448396,雷人的玩意儿,https://img9.doubanio.com/view/subject/l/public/s3754354.jpg,糖和尚,,设计,,像地球一样的沙发、泰迪熊玩偶的骨骼解剖、用钉子做的床、售价30000元人民币的台灯、没有时间标志的钟表……在这个创意层出不穷的年代，各种各样的极端设计以其奇妙卓绝的构思对我们的固有观念形成了强大的冲击——同时也在为我们的创意思维增添新的养分。你也许一辈子又不会购买《雷人的玩意儿：极端设计TOP80》里所介绍的产品，可作为一个生活在新时代的年轻人，你又怎能错过尽情领略世界顶级极端设计的机会呢？《雷人的玩意儿：极端设计TOP80》不仅给你提供了这样一个大开眼界的机会，更重要的是，它所具有的轻松、跳跃充满现代幽默感的语句，会让你在吸收知识养分的同时，乐在其中。,2021-12-24 20:13:38,2021-12-24 20:13:38
9787115418814,术与道 移动应用UI设计必修课,https://img9.doubanio.com/view/subject/l/public/s28638865.jpg,余振华,,设计,人民邮电出版社,这是一本系统介绍移动设计知识的书籍， 全书分为上下两篇。上篇为术之篇，主要讲解了移动应用设计相关的基础知识。通过基础知识的学习，使大家了解手机屏幕显示的原理及各种手机硬件的传感器使用方法。通过讲解基本的设计规范及图标设计方法，使读者初步掌握移动应用设计知识。下篇为道之篇，是进阶应用设计知识，详细讲解了从如何组建设计规范，到各种组件的功能介绍及应用设计方法，使读者完整掌握移动应用的设计方法和流程。本书通过大量的案例演示，使读者可以灵活运用设计方法理论。本书适合想要从事和已经从事UI设计行业相关工作的读者学习使用，也可以作为高校平面设计、网页设计等相关专业和相关培训机构的教学参考书。,2021-12-24 20:13:43,2021-12-24 20:13:43
9787550251403,当我们阅读时，我们看到了什么,https://img3.doubanio.com/view/subject/l/public/s28098000.jpg,[美]彼得·门德尔桑德,应宁,设计,未读·文艺家·北京联合出版公司,当我们阅读时，我们看到了什么？你能精确地描绘出某个文学人物的形象吗？安娜·卡列尼娜的头发是什么样的？她的鼻子？她的眼睛？读者常认为，他们是通过作者的细致描摹来想象文学形象的，但事实上，我们很少去具体地构想某个人物的样子。尽管如此，读者依然能够在脑海中勾勒出鲜活生动的人物与情节。恰恰是那些语言的留白、词汇的交叠、更换不定的语境，给了读者遐想、脑补、再度诠释、共同创作的空间。作为一个文学名著发烧友和世界顶级书籍装帧设计师，门德尔桑德对阅读时产生的阅读心理展开了挑战性的探索。本书写作方式极为独特，作者充分利用了自己的职业特长，用大量图片作为另一种“语言”，或嫁接或还原了读者在阅读时所产生的心理图像，让读者用一种前所未有的视角思考“阅读”这件事。,2021-12-24 20:13:51,2021-12-24 20:13:51
9787209050852,一周12小时的手作生活,https://img9.doubanio.com/view/subject/l/public/s6459884.jpg,,,设计,,《一周12小时的手作生活》包含了50款省钱省力的手作小物。生活中随手可得的材料：保特瓶、牛奶盒、竹筷、饼干盒……只需运用一点巧思，即可做出充满生活感的居家杂货！,2021-12-24 20:13:56,2021-12-24 20:13:56
9787508624341,美学的经济,https://img2.doubanio.com/view/subject/l/public/s9070563.jpg,詹伟雄,,设计,中信出版社,白色iPod为何热卖？郭台铭与尼采有什么关系？如何理解美学和风格的经济价值？什么是全球城市？设计为何是21世纪国家的国力指标？台湾的经济、企业、工作者，正面对众多的关键选择──如何由制造业经济，进化到知识经济或创意经济？如何由专精代工，过渡到附加价值更高的品牌或设计？如何由纪律的个人，变身成美感的个人；由勤奋生产者，转化成自由消费者？《美学的经济》这本小书，不是财经论文，而是财经散文，它无法提供标准答案，但它有60个不同思考的方法、新鲜的观察角度、跨国采访经验的冲击，帮助你面对变迁的台湾与自己的人生之时，能激荡出更多的想象力。,2021-12-24 20:14:01,2021-12-24 20:14:01
9787532234530,英国平面设计基础教程,https://img2.doubanio.com/view/subject/l/public/s1940723.jpg,艾伦・斯旺,张锡九,设计,上海人民美术出版社,完善细致的平面设计指导课程，有20年实践经验的资深设计师编写。重新修订并增补了计算机辅助设计和各种商业设计领域应用软件的使用。对杂志、书籍、包装、广告和企业设计给予实际的指导。为设计者创作专业作品提供特别技巧。从学生独立完成项目到实际问题的解决方案，全彩图例说明。,2021-12-24 20:14:06,2021-12-24 20:14:06
9787562491101,古怪的身体,https://img9.doubanio.com/view/subject/l/public/s28299024.jpg,[日]鷲田清一,吴俊伸,设计,重庆大学出版社,每个人的身体都有着这样那样不同的特征，每个人对待自己的身体也都抱着又爱又恨的心情。穿衣打扮更是是我们现代人每天都无法回避的话题。而时尚到底是怎么一回事呢？看似奇葩的街头潮流，其背后隐藏的信息是什么？像川久保玲、山本耀司、三宅一生这样的设计师们试图通过服装表达的又是什么？说到底人为什么会通过穿衣服来隐藏自己的身体？而真正想隐藏的到底又是什么？哲学教授鹫田清一希望通过一种简单易懂的方式向人们讲述他关于时尚的“身体论”。,2021-12-24 20:14:13,2021-12-24 20:14:13
9787805017280,世界最美的书店,https://img9.doubanio.com/view/subject/l/public/s28096465.jpg,[日]清水玲奈著,匡匡,设计,北京美术摄影出版社,带您感受全球20家最美书店的魅力所在日本设计界泰斗、国际平面设计大师原研哉唯一一次为图书设计20家书店由美国知名网站Flavorwire编辑跑遍全球评选而出旅日女作家匡匡翻译，优质译文让阅读更加顺畅日本年度畅销书《全世界梦想中的书店》完美升级版,2021-12-24 20:14:19,2021-12-24 20:14:19
9787508647340,鲸鱼在喷水,https://img9.doubanio.com/view/subject/l/public/s27721324.jpg,[日]佐藤卓,蔡青雯,设计,中信出版社,日本中生代最具分量的设计师佐藤卓分享了30余年来，73个重要设计案例决策过程中的思考。书中记录了佐藤卓在设计当下的时刻，脑中思考的事情，有成功的经验，也有失败的经验。但每个案例都能感受到他通过对日常生活的观察，不断反思与质疑既有的设计，从而提出具有颠覆性的设计提案，将产品价值与消费者联系起来，这就是佐藤卓最为人称道的“日常设计”！,2021-12-24 20:14:25,2021-12-24 20:14:25
9787209055017,时尚设计师的言语·心·梦想,https://img1.doubanio.com/view/subject/l/public/s4603477.jpg,[日]福田春美,陈华樱,设计,山东人民出版社,不进入企业就职，要如何维持生计并找到自己真正想投入的工作？日本超人气服装品牌WR与Triptych的创立者，设计师福田春美要告诉读者结合现实生活与梦想的故事。,2021-12-24 20:14:31,2021-12-24 20:14:31
9787534426629,创意城市·布鲁塞尔,https://img1.doubanio.com/view/subject/l/public/s3546699.jpg,果果,,设计,江苏美术出版社,《创意城市》系列是一套视觉艺术和时尚领域的前沿性图书。它提供了一种从视觉艺术角度读解城市品性的新视角。《创意城市》系列图书关注的是生活在欧洲的欧美当代视觉艺术和时尚领域的著名艺术家、设计师以及他们的艺术思想和艺术活动。现代欧美的城市发展史是一部现代欧美艺术的艺术发展史。绘画、工艺、时尚品设计、摄影、景观、装置、雕塑、橱窗等艺术是现代城市之所以成为“现代”的不可或缺的元素。艺术不仅有效地丰富了作为政治、经济、文化、教育中心的城市多样化生态，而且艺术也是一座城市最富有活力、激情和创造力的部分。,2021-12-24 20:14:36,2021-12-24 20:14:36
9787500661467,王受之讲述产品的故事,https://img2.doubanio.com/view/subject/l/public/s5723762.jpg,[美国]王受之,,设计,中国青年出版社,精彩摘要：    大凡讲到意大利设计，人们脸上都会流露出一抹轻松的微笑来。如果看到巴托里设计公司（Bartoli Desing)的作品．那微笑就会更加灿烂了。我在学院开的一门课是”娱乐设计概论”。课堂上有学生问道：“日本动漫画和美国动漫画最本质的区别是什么？”“最大的区别可能在于美国的动漫画是大军团，大公司合作的结果，目标是利润巨大的市场：而日本的动漫画是很个人化的创作。因此更加具有创作上的个人色彩，更加具有强烈的个体风格，也更加具有市场的弹性。”我说。我想这一说法。也可以应用在美国产品设计与意大利产品设计之间的区别上。意大利设计公司都不大。往往是三两个人的组合，他们设计的作品也往往没有采用美国那种大规模企业生产的方式，而有点作坊生产的意思，批量不大．但是却讲究设计细节。巴托里的设计，走的是一条很雅致的风格路线。在某种程度上更接近斯堪的纳维亚...,2021-12-24 20:14:42,2021-12-24 20:14:42
9787115294616,众妙之门,https://img2.doubanio.com/view/subject/l/public/s23139051.jpg,SmashingMagazine,贾云龙,设计,人民邮电出版社,《众妙之门——网站UI设计之道(修订版)》是知名设计网站Smashing Magazine上线以来的精华总结，来自全球的知名设计师无私地分享了他们多年积累的宝贵经验。全书共分10章，前8章讨论了和网站UI设计相关的八个不同的领域，覆盖面非常广，具有很强的操作性和专业性，全书逻辑严密、言简意赅，设计人员可以快速地找到自己想要的东西。第9章以访谈的形式介绍了多位专家对一系列重要问题的看法，入木三分，极富启发性。第10章以讲故事的方式，把Smashing Magazine的创办和发展过程娓娓道来，同时毫不保留地分享了两位创始人的成功秘诀和价值观，让人受益匪浅。其最大的价值在于它在传授具体经验的同时，也对设计思想和设计理念进行了深入的探讨，在“授人以鱼”的同时，不忘“授人以渔”。,2021-12-24 20:14:54,2021-12-24 20:14:54
9787532280551,做个风格插画家,https://img9.doubanio.com/view/subject/l/public/s24965264.jpg,李青莳等,,设计,上海人民美术出版社,《做个风格插画家》共有三个单元，第一单元采访5位国际顶尖时尚的插画家，在剖析一位成功插画家的过程经历之余，也可以看见他们如何建构与国际知名品牌合作的桥梁。第二单元共收录来自世界各地30位精彩的插画家的作品，依照每一位插画家的创作概念做出七大风格分类，每位插画家都真诚地与读者分享他们的创作，以及在生活中遇见了什么细微感动，又如何激发他们的创作灵感。最后一个单元介绍了5位中国台湾插画家，绘本是他们共同的创作心得，藉此他们分享了生活中某个特殊片刻、某段难忘的生命历程，同时也谈及对于中国台湾插画市场的了解和参与国际插画比赛的经验分享。,2021-12-24 20:14:59,2021-12-24 20:14:59
9787500686439,怪设计,https://img2.doubanio.com/view/subject/l/public/s9354911.jpg,香港Newwebpick编辑小组,,设计,第1版(2009年3月1日),《怪设计》由中国青年出版社出版。,2021-12-24 20:15:04,2021-12-24 20:15:04
9780262026307,Siteless,https://img1.doubanio.com/view/subject/l/public/s3163167.jpg,FrançoisBlanciak,,设计,TheMITPress,"Some may call it the first manifesto of the twenty-first century, for it lays down a new way to think about architecture. Others may think of it as the last architectural treatise, for it provides a discursive container for ideas that would otherwise be lost. Whatever genre it belongs to, SITELESS is a new kind of architecture book that seems to have come out of nowhere. Its au...",2021-12-24 20:15:09,2021-12-24 20:15:09
9787508686677,d设计之旅：京都,https://img1.doubanio.com/view/subject/l/public/s29750779.jpg,[日]长冈贤明编著,陈淑婧,设计,中信出版集团,《d设计之旅》是京都深度游、人文游、风物游的旅行美学书，李宗盛、蔡康永、深泽直人真诚推荐！美食、民艺、匠人、名园、老铺、街路、祭典、风俗人情……缓缓展开千年古都的精致和诗意，细腻呈现有生活况味的京都风情。隐匿在小巷的匠人店和风景人情，才是真正的京都范儿！《d设计之旅》是一部视角别致的京都风物志，由日本人气编辑团队驻地采风，精选地道的京都特色，探寻千年古都的美好日常，让我们像当地人一样感受并融入京都的节奏和风格：在清水寺旁的河井宽次郎纪念馆，能真切理解日式美学和匠人精神的本源；自行车百年老店辻森商会，如同京都版的“解忧杂货铺”，不懂日语也能感受到店主待人处事的温暖真诚；在匠人店“有次”，30年前购买的厨具仍可到店维修好，并享受温馨细致的服务；在黑泽明导演所钟爱的“石原”日式小旅馆，你可以共赏庭院中天光云影的变化，享受时间的流逝与永恒；比起华丽精致的...,2021-12-24 20:15:15,2021-12-24 20:15:15
9787802303669,想.做.设计,https://img1.doubanio.com/view/subject/l/public/s2330047.jpg,吴学夫,,设计,社会科学文献,如何“想”？怎么“做”？全球创意产业发展正如火如茶，中国的文化创意产业概念也已深入人心。创意如何“想”？怎么“做”？这里介绍了一种迅速提升创意设计能力的训练方法——“动脑”+“动手”的拓展训练，来帮助你解决“想”和“做”的问题。本书通过中国传媒大学艺术设计专业学生的创意思维训练实录，再现教学实战情境，展示创意思维流程，解析现代艺术如何影响着创意设计。编者以感觉训练、创造性思维训练、“超级组合”训练以及“1/10法则”等训练方式，揭示了艺术院校里创意教学的秘密，证明了创意是一种每个人都可以学会的思维能力。该书献给广大艺术类学生、设计师、广告人、文化创意产业人士以及一切希望激发自己创造潜能的人们。,2021-12-24 20:15:20,2021-12-24 20:15:20
9787535680907,关于设计的思考,https://img2.doubanio.com/view/subject/l/public/s29496572.jpg,[美]保罗·兰德,吴梦妍,设计,后浪丨湖南美术出版社,这是一部平面设计的重要著作，于1970年问世。本书在保罗·兰德事业巅峰时期写就，明确表达了他的先驱性观点，即所有设计广告、印刷或者工业设计应该无缝结合“美和实用”。好的设计，兰德主张是通过视觉形式简明地表达概念——在最好的情况下，升华寻常之物。这一版本逐字逐句保留了兰德1947 年的最初发表的文章以及他在1970 年对文字和图片及意象做出的修订，文本按照最初始的字体，版式风格，资料来源和脚注、图注和前言也使用原版的形式。唯一现代性的让步，是一个新的版权页、目录、知名的设计师兼批评家麦克·贝鲁特撰写了前言，以及基于可读性考虑的微小风格改动。在今天看来这本经典著作一如从前，是卓越设计价值永恒性的确实证明。,2021-12-24 20:15:26,2021-12-24 20:15:26
9787530499672,社区设计,https://img1.doubanio.com/view/subject/l/public/s29938797.jpg,[日]山崎亮,胡珊,设计,北京科学技术出版社,不是设计只让一百万人来访一次的岛屿 ，而是规划能让一万人重访一百次的岛屿.设计(de-sign)是从信息（sign）中提炼精髓（de），圆满解决根本问题的一种行为.凝聚社群的力量解决社会问题 ，这个世界还有变得更好的可能.【内容特色】日本社区设计界第一人— —山崎亮◎12年工作轨迹 + 1 6个代表性社区设计方案 + 200张珍贵照片◎荣获GDA、SD Review、Kids Design赏等多项社会创新设计大奖◎日本、台湾好评如潮，热销多年，台湾版上市半年重印7次◎两岸20多位学者专家（城规、建筑、景观、社会学等领域）联袂推荐带你看见回归以人为本的设计所能发挥的巨大力量.【学者推荐】山崎亮先生的《社区设计》让我们见证了人人可以参与的设计，链接无限可能的设计。这“设计”立足空间又超越了空间，是真正回归我们日常生活的设计，...,2021-12-24 20:15:32,2021-12-24 20:15:32
9787508621586,学设计，非去不可,https://img2.doubanio.com/view/subject/l/public/s4565051.jpg,三采文化编著,,设计,中信出版社,"《学设计,非去不可》收录了王千睿、胡佑宗、周育如、施令红、甘泰来、高弘树、赖雨农、黄怡儒、林国基、林怡芬、史明辉、庞铫13位台湾创意人，在德国、法国、美国、英国、日本这些国家的不同城市、不同学校，学习不同专业的创意人的留学故事，以及具有启发性的有趣课程和创意学习！《学设计,非去不可》中还包括13位创意人申请学校的作品集，留学时期的照片、作品，以及回国后的代表作，看知名设计师如何将留学经验化为每一个精彩的作品。 《学设计,非去不可》针对申请学校、挑选科系——甚至是挑选城市！以及如何把握留学机会学到最多经验，13位创意人都不吝分享他们的秘技与心得。每位创意人推荐了相关科系的10大名校，范围遍及欧、美、日、澳等地的创意集散地，是参考的桥梁之一。《学设计,非去不可》简述13位创意人回国后的跨界、创新，或是勇于挑战的创业故事，以及对于年轻创意人的工作态度提...",2021-12-24 20:15:39,2021-12-24 20:15:39
9787544272841,住宅格局解剖图鉴,https://img2.doubanio.com/view/subject/l/public/s27615331.jpg,[日]铃木信弘,郑敏,设计,南海出版公司,格局设计是住宅设计不可或缺的一部分，也是打造好房子的关键。大到空间格局的划分，如厨房、客厅、卧室等空间的功能分区，小到壁柜、晾衣杆的细部设置，不同的格局设计会带来不同的居住体验。只有合理规划不同空间的格局，才能打造出真正舒适宜居的家。日本著名建筑设计师铃木信弘的格局设计私家秘技大公开。在不改变住宅面积的前提下，以满足人的需求为中心，兼顾实用性和美观，优化格局，提升住宅宜居度，就能打造出真正舒适宜居的理想住宅。,2021-12-24 20:15:45,2021-12-24 20:15:45
9787508633879,请偷走海报！+3,https://img9.doubanio.com/view/subject/l/public/s22707896.jpg,[日]原研哉,竺家荣,设计,中信出版社,《谁偷走海报!+3》收录了53篇原研哉难得一见的设计散文，其中包括他从1991年到1995年在《小说新潮》杂志上的连载，以及出版前新补的三篇文章。书中内容多取材自原研哉刚出道时的设计工作，每一篇文章就代表了一个设计故事，娓娓诉说出原研哉对于设计美学的思维概念，以及他所遭遇的困难转折和工作历程。原研哉幽默风趣的笔触，浅显易懂的解说，让「设计」这样略为严肃的主题更为亲切易读，同时也让读者有机会一窥大师早年在设计工作上的趣闻轶事，让人读来不觉频频莞尔。,2021-12-24 20:15:52,2021-12-24 20:15:52
,设计的精神,https://img1.doubanio.com/view/subject/l/public/s2968057.jpg,,,设计,艺术与设计杂志社,有机会请到来自全世界各领域的顶尖设计师与我们面对面地分享他们的故事和观念。设计的各种领域在21世纪越来越交汇融合，设计的思想与精神却贯穿着这些纷繁的领域。讲故事是人类传承历史的一中充满乐趣的方式，因为有乐趣，也使故事中的观念和精神更容易被大空接受和传承。于是我们选择了本书里来自这些设计师演讲中的故事片段，并记录了编者与他们的对话，以期听故事的人能选择自己喜爱的观念，领悟设计的精神。,2021-12-24 20:15:59,2021-12-24 20:15:59
9787550256354,家的模样,https://img2.doubanio.com/view/subject/l/public/s28262143.jpg,叶怡兰,,设计,北京联合出版公司,“设计师能否满足房主的需求，设计出好住有好看的家？”“如何运用家居设计，让日常生活更方便？”“照片里那种好看的家，真的可以实现吗？真的好用吗？”这些装修与生活中的疑问，台湾名作家叶怡兰都在这本书中做出了回答。台湾美食旅游作家叶怡兰，首度敞开自家私宅，以文字与照片，与读者分享长达一年的改造“理想之家”圆梦全纪录，细述“设计”如何让生活过得更好。从生活的需求与体悟出发，一步步打造实用舒心，兼具审美功能的理想家宅。,2021-12-24 20:16:06,2021-12-24 20:16:06
9787807681618,理想家：2025,https://img9.doubanio.com/view/subject/l/public/s29015084.jpg,[日]原研哉,,设计,生活•读书•新知三联书店生活书店出版有限公司,2025年，你会住在哪里？以怎样的方式与这个世界保持联系？看见吗？这个未来并不遥远，它是可以触摸的。这是一个以建筑设计的方式，发自未来的邀请——来这里，和我们一起探讨中国未来居住方式变化的趋势与可能，一同窥见改变。我们关注城乡变迁、关注空气质量、关注蚁居、关注人与人之间的天然联系、关注对自然的保护、关注科技与智能模式、关注原初生活形态、关注超老龄社会背景下的人居状态……关注“家”的意义。在《理想家：2025》一书中，日本中生代设计师原研哉，联合国际级建筑师/建筑事务所：张永和、张轲、马岩松、张雷、梁井宇、岛田阳、华黎、大舍、Crossboundaries、王昀、NEXT Architects、青山周平、王辉，以及建筑学界研究者史建、周燕珉，探索未来十年场景下，建筑与居住的种种可能。“我们与具备优秀创造力的建筑师一起合作，把潜在的未来社会发...,2021-12-24 20:16:13,2021-12-24 20:16:13
