9787112099788,如何成为创意人,https://img2.doubanio.com/view/subject/l/public/s8828913.jpg,成锐,,设计,中国建筑工业,《如何成为4A创意人》收集编撰了部分业内流传的工具和方法、常识。其中有些是各知名4A公司内部培训资料，有些是作者长期收集、提炼的专业技巧和方法。第一章，详细解读和创意部相关的流程，提醒工作程序交接中需要注意的地方；第二章，认识什么是策阴，有什么实际作用，并将创意策略大卸13块，从分析和创新两个架构阶段来阐明每一块是什么、又如何得到它和需要注意的地方；第三章，比较全面地将创意的真正后幕——“创意三层次论”作了阐述，并以图例引导读者的理解；第四章：重新认识Photoshop的重要功能划分，以朗最大限度地发挥软件用途，为后期执行解决技术上的难题；第五章：比较全面地认识常用汉、英字体的基本性格和风格倾向；提供实际设计方法让读者理解厂告编排的本质——信息秩序化。另外，《如何成为4A创意人》还提出了新的观点和方法集合。该书可供各大专院校作为教材使用，也可供从事相...,2021-12-24 19:47:12,2021-12-24 19:47:12
9787500675310,书籍设计,https://img2.doubanio.com/view/subject/l/public/s25138781.jpg,安德鲁·哈斯拉姆,钟晓楠,设计,中国青年出版社,本书由英国著名的出版社Laurence King提供版权，中国青年出版社翻译出版。无论您是尚处于书籍设计学习阶段的初学者，还是有实际经验的设计师，本书所提供的实用易懂的方法和指导，都将是您开展书籍设计工作必不可少的资源。本书首先对书籍设计作出整体性介绍，在此基础上，作者针对风格构建、版式、封面设计以及包括复制、印刷、装订的生产流程进行了详实的分析和讲解。本书附带240余幅精美插图和图表，更加有助于读者们全面的了解和领会书籍设计的要领。目录第一部分：书是什么第一章　书籍的过去、现状及未来书的起源定义探寻：什么是书出版业：图书的商业价值新科技：书的未来印刷的力量：书籍的影响力第二章　图书出版出版业内的主要角色图书组成部分书从何处开始第三章　书籍设计方法文献法分析法表现主义手法概念法设计简介第二部分：书籍设计师的调色...,2021-12-24 19:47:18,2021-12-24 19:47:18
9787108031051,以土地的名义,https://img9.doubanio.com/view/subject/l/public/s6949195.jpg,俞孔坚,孔祥伟,设计,生活·读书·新知三联书店,《以土地的名义:俞孔坚与“土人景观”》内容简介：俞孔坚，哈佛大学设计学博士。1997年回国创办北京大学景观设计学研究院；次年创办北京土人景观与建筑规划设计研究院。他将城市和景观规划作为“生存的艺术”，提出“天、地、人、神”和谐的设计理念，与“反规划”的理论和方法。其主持的规划设计作品以鲜明的现代性和中国特色，以及生态和人文的精神，五度获美国景观设计师协会荣誉设计和规划奖，一项世界滨水设计最高奖，两次获得国际青年建筑师奖，并获中国第十届美展金奖。七次被国际景观设计师联盟、美国景观设计师协会邀请为年会的主旨演讲人。《以土地的名义:俞孔坚与“土人景观”》精选了俞孔坚和“土人景观”近十多年的七个代表作品进行阐释和评论，每个作品对其设计思想都有不同侧重的体现，不仅对国内外业界造成观念和视觉上的冲击，屡获大奖；而且也改进和提升了城市管理者和普通民众对自己所置身...,2021-12-24 19:47:24,2021-12-24 19:47:24
9787532252411,艺态4,https://img2.doubanio.com/view/subject/l/public/s2932641.jpg,邱孟瑜,吴维妍,设计,上海人民美术出版社,《艺态》本辑关注的图像主题，其实问题的指向正是平面设计的内涵。所以，《艺态》说，平面设计只会垂青于那些能够把握其内涵的人。设计师的创作与工作方式，如今已经延伸到了感官领域。它是另一种缔造视觉美好的途径。同样，富有感官特征的品牌设计即将诞生，并延续了它充满愉悦感的超现实主义理念。当设计将通过嗅觉，以及调动我们其他所有的感官，把想象力放大到极至再来完成创作并引领我们时，这样的生活将变得如何后现代，你们说呢？,2021-12-24 19:47:29,2021-12-24 19:47:29
9787121021626,交互设计之路,https://img9.doubanio.com/view/subject/l/public/s1517284.jpg,库帕,ChrisDing,设计,电子工业出版社,本书是基于众多商务案例，讲述如何创建更好的、高客户忠诚度的软件产品和基于软件的高科技产品的书。本书列举了很多真实可信的实际例子，说明目前在软件产品和基于软件的高科技产品中，普遍存在着“难用”的问题。作者认为，“难用”问题是由这些产品中存在着的高度“认知摩擦”引起的，而产生这个问题的根源在于现今软件开发过程中欠缺了一个为用户利益着想的前期“交互设计”阶段。“难用”的产品不仅损害了用户的利益，最终也将导致企业的失败。本书通过一些生动的实例，让人信服地讲述了由作者倡导的“目标导向”交互设计方法在解决“难用”问题方面的有效性，证实了只有改变现有观念，才能有效地在开发过程中引入交互设计，将产品的设计引向成功。　　本书虽然是一本面向商务人员而编写的书，但也适合于所有参与软件产品和基于软件的高科技产品开发的专业人士，以及关心软件行业和高科技行业现状与发展的人士阅...,2021-12-24 19:47:38,2021-12-24 19:47:38
9787209050876,设计东京2.0,https://img2.doubanio.com/view/subject/l/public/s6105891.jpg,吴东龙,,设计,山东人民出版社,设计达人吴东龙睽违两年最新力作，《设计东京2.0》带给你更不一样、更新颖的东京观点。“2.0”是什么？它可以代表良好的视力，也可以代表一个版本的升级。《设计东京2.0》传达的是视野的扩张，以及一种立足在原有基础上再充电、再进步的意义。无论在“观察”、“设计”、“视野”与“论述”无疑都要再度升级。所以用“2.0”来形容东京，可以说是一个城市的再生，设计的再进化！《设计东京2.0》依然有令人叹为观止的文字观察记录与图片编排，内容丰富多样却不让人却步，不仅是美学经济、也是书籍设计的又一新示范。跟这本书再次走一趟东京，你会经历更多设计风格的洗礼，触发你对美感经验的深层思考。在《设计东京2.0》里，透过设计，分享的是一座“纸上DESIGN MALL”。你可以上顶楼眺望建筑构成的天空线，可以到美食楼层落脚歇腿，可以在文化楼层血拼创意，可以窝在图书楼层阅读...,2021-12-24 19:47:50,2021-12-24 19:47:50
9787508827483,亲爱的詹姆斯,https://img1.doubanio.com/view/subject/l/public/s4587828.jpg,R.O.布莱克曼,焦乐群,设计,龙门书局,一个可爱的老头儿，作品屡登《纽约客》封面，在他七八十岁的时候，突然希望将自己半生的心得、故事，讲给一个年轻人听，让他们能更从容地面对这个动物凶猛的世界。他讲了自己初入行时遭遇的惨不忍睹的错误和失败，念叨了生活和职业的艰难，分享了成功给他带来的大房子，甚至连无奈卖掉大房子时的黯然神伤也没有放过。他希望为刚刚站到人生起点的年轻朋友们点一盏不太壳的灯，微微的光照亮必经的路途。他希望在年轻人灵感枯竭、呕心沥血的作品被无情退回时，能够拍拍他们的肩膀，告诉他们别忙着愤怒、哀叹、自怨自怜，甚至从此抛却梦想。他还希望年轻人成就在身、偶尔找不着北的时候，能够给他们来点儿冷风吹，告诉他们要再三反求诸己，深刻检讨自己的作品，追求自己的最大潜质。,2021-12-24 19:47:57,2021-12-24 19:47:57
9787115236678,众妙之门,https://img2.doubanio.com/view/subject/l/public/s4539433.jpg,SmashingMagazine,贾云龙,设计,人民邮电出版社,《众妙之门:网站UI设计之道》不包含链接列表或聚合的内容。《众妙之门:网站UI设计之道》包含了知名设计网站Smashing Magazine精心准备、精心编写以及精心编辑的内容，这些都基于Smashing Magazine读者的建议和意愿。全书共分十章，前八章讨论了和网站UI设计相关的八个不同的领域，覆盖面非常广，具有很强的操作性和专业性，全书逻辑严密、言简意赅，设计人员可以快速地找到自己想要的东西。第九章以访谈的形式介绍了多位专家对一系列重要问题的看法，入木三分，很有启发性。第十章以讲故事的方式，把Smashing Magazine杂志的创办和发展过程娓娓道来，同时毫不保留地分享了两位创始人的成功秘诀和价值观，让人受益匪浅。,2021-12-24 19:48:03,2021-12-24 19:48:03
9787559834669,幸福的都市栖居,https://img1.doubanio.com/view/subject/l/public/s33815877.jpg,[加]查尔斯·蒙哥马利,王帆,设计,理想国|广西师范大学出版社,编辑看点：★ 科学的“风水”观提升幸福我们不再相信炼丹术，但须臾离不开化学和医药。“风水”需求同样重要，但要依靠现代的环境规划和环境心理知识来重新理解。城市中很多表面的高大上，广场、商厦、停车坪、高架桥……其实都犯了大忌，勒·柯布西耶、密斯·凡德罗等建筑学大家也有系统性失误，而一些看似微小的调整也可能让生活改天换地。快跟随本书来纠正偏见，获得安居乐行方面的科学指导，有效提高幸福指数！★ 全球城市兴衰得失总览作者及团队在相关领域已研究十余年，他们遍访全球，纵览现代城市的百年发展史，通过本书不但呈现了迪拜、纽约、伦敦、巴黎、温哥华、哥本哈根等大都市的风貌和变迁，也有南太平洋和南美边陲的小村落如何在村民的古老智慧下生机盎然的例子，对无论规划决策者，还是寻找、营造安家宝地的个人，甚至只是希望领略异域风情的读者而言，都是重要的启示和参考。★ 自身的幸...,2021-12-24 19:48:09,2021-12-24 19:48:09
9787115239952,写给大家看的色彩书1,https://img2.doubanio.com/view/subject/l/public/s4606451.jpg,梁景红,,设计,人民邮电出版社,配色真的有那么难吗？其实它有规律、有方法、有诀窍，本书就来逐一讲解。书中通过作者的原创示例和精选的代表性作品，详细讲解了色彩设计的五大原则和两大关键词选色法，并在此基础上，介绍了如何突破已有的形式和惯有的配色思路，实现自我能力的提升。书中提出的配色理念简单易行，带你梳理色彩创作的切入点，正确判断和思考色彩集合、色彩参照等配色概念，迅速理解色彩与图像的关系、色彩关键词等设计重点，将优秀作品的色彩运用到自己的作品中。本书内文的装帧设计运用了书中所讲的用色技巧，每一页都是配色学习的参考作品。,2021-12-24 19:48:15,2021-12-24 19:48:15
9787500648314,世界现代设计史,https://img2.doubanio.com/view/subject/l/public/s2358103.jpg,[美国]王受之,,设计,中国青年出版社,《世界现代设计史》共分九章，对世界现代设计史的源流、发展及现状进行通论式的阐述，描述世界现代设计史上的各个时期重要流派、重要人物、重要作品，展现世界现代设计史的基本轮廓、构建基本框架。,2021-12-24 19:48:23,2021-12-24 19:48:23
9787553679747,我是怎样设计飞机的,https://img9.doubanio.com/view/subject/l/public/s32276015.jpg,[美]克拉伦斯·伦纳德·凯利·约翰逊,杨松,设计,后浪丨浙江教育出版社,“教父”级飞机设计大师的励志成长故事洛克希德公司与美国航空的发展史真实记录各种飞机的设计细节揭秘“臭鼬工厂”的由来及“14条凯利原则”重新定义企业管理模式◎ 编辑推荐☆再现美国飞机设计的各种细节——从发动机到小零部件，凯利﹒约翰逊娓娓道来“流星”F-80、“星战士”F-104、U-2侦察机和“黑鸟”SR-71的设计意图、遇到的问题和解决方案，便于读者掌握飞机设计的第一手资料。☆揭秘科技巨头纷纷效仿的“臭鼬工厂”的由来及“14条凯利原则”——获得绝对授权和小型精英团队是“臭鼬工厂”高效运转的秘密。凯利•约翰逊的理念是用更简单、更经济的方法解决所有问题。今天，“臭鼬工厂”的管理模式已经拓展到航空航天领域之外，深深地影响着全世界科技产业的创新管理。☆讲述凯利•约翰逊对美国国防和未来科技发展的真知灼见——为何至今仍无液态氢飞机、核动力飞机？凯...,2021-12-24 19:48:28,2021-12-24 19:48:28
9787500648307,世界平面设计史,https://img2.doubanio.com/view/subject/l/public/s1238582.jpg,[美国]王受之,,设计,中国青年出版社,介绍了工业时代的版面设计、维多利亚时期的大众化平面设计、现代艺术对平面设计发展的影响、国际主义平面设计风格的形成等内容。,2021-12-24 19:48:34,2021-12-24 19:48:34
9787532265381,设计随笔79,https://img3.doubanio.com/view/subject/l/public/s4151940.jpg,MichaelBierut,李慧娟,设计,上海人民美术出版社,《设计随笔79》内容简介：我认为自己是设计师，而不是作家。十多年前，在鲜有证据证明我有写作才能的情况下，三名优秀的编辑史蒂夫·海勒、奇·珀尔曼和里克·波伊诺就纷纷开始给我一些简单的撰稿任务。他们的鼓励和建议让我学会了如何从作者的角度思考。大约在四年前，里奇、比尔·德兰特尔、杰希卡·海尔凡德和我决定创建一个博客，不过当时心中并无明确的目标计划。《设计随笔79》的成功编纂也在很大程度上得益于当初的那个决定，以及我们之间的友谊。在每天的工作中，我都能从世界上最优秀的设计师们那里获得灵感和激励，他们是：吉姆·拜伯、迈克尔·杰瑞克、卢克·海曼、艾伯特·米勒、丽萨·施特劳费德，尤其是宝拉·谢尔，文笔优美的她为我树立了一个重要榜样。艾伯特则创造了《设计随笔79》优雅（且诙谐）的设计风格。萨什·菲尔南多则以无比的勇气和热情，负责了该项设计的实施，直至最后完成。对于以...,2021-12-24 19:48:40,2021-12-24 19:48:40
9789868875562,不妥,https://img2.doubanio.com/view/subject/l/public/s27111491.jpg,聂永真,,设计,自轉星球文化,生活中節奏順暢的事件處理，不多不少的適切狀態，才是真正好的設計。50個在設計完成品上看不到的掙扎、衝突、不好意思、疼痛與焦慮。從外圍開始掃射入裡，直視他人，也直視自己。it doesn't make sense。已經存在的東西，不必然定義成正確。究竟在這一切不妥的對面，會否有一種妥的存在？視線表紙說明：「Format煞有介事，卻無以名狀、cover訊息、不讓外界看透。像看某一本不需要被其他人知道的讀物；或故意製造一種理解與形式表象的誤導、捉弄的誤會。」書衣對褶，正面兩面皆可使用。書寫「UNTITLED XX」並壓上不規則燙金色塊。表紙包覆住書的本體，遮住旁人的目光，於是我們得以私密地，透過閱讀悄悄進入聶永真的視線裡。,2021-12-24 19:48:46,2021-12-24 19:48:46
9789861750873,創意@東京,https://img1.doubanio.com/view/subject/l/public/s2795919.jpg,蒼井夏樹,,设计,方智,俯拾即是的芬芳，不期而遇的風景。沒有咖啡因，不含膽固醇。一個轉角，一處驚喜，一段旅程，一段記憶。整個東京就像是一座超大美術館，每個人都可以找到屬於自己的創意靈感與私密角落。跟著專攻感性工學的早稻田大學博士候選人──蒼井夏樹，學習如何學習、學習如何感受，種下你的創意系統樹。人性化的設計與專注細節的意匠精神，美的競爭力，讓日本設計在國際社會具有舉足輕重的地位。他們如何保存、研究、再發現？他們如何學習、應用、再創造？本書帶領你從創意出發，透過觀察任天堂感性工學、文化系女子等趨勢潮流；活用廣告蒙太奇、電視知惠袋等資訊情報；親臨村上隆藝祭、Good Design等設計現場；探訪安藤忠雄、伊東豐雄等當代建築大師的最新建築作品，學習如何看、如何聽、如何感受、如何觸摸、如何呼吸，奇想採集，甜美發酵，五感甦醒，切切磋磋，探索日...,2021-12-24 19:48:52,2021-12-24 19:48:52
9787806862094,东京,https://img3.doubanio.com/view/subject/l/public/s1310840.jpg,陈逸飞,,设计,浙江摄影出版社,作为中国当代最著名的艺术家之一，陈逸飞先生在大视觉领域不断开拓：他在绘画、电影、服装设计、期刊、环艺等多方面不断创新，自成一格；他站在国际艺术的潮头，在艺术语言上树立了东西融合的典范。　　陈逸飞先生以一位艺术家的眼光和品位，引领读者从时尚设计、现代艺术和人文角度，对这四座最具时代潮流感的国际大都市，进行了一次非同寻常的寻找和发现之旅。　　《逸飞视觉》丛书第一套“视觉都市”共分四册，即《伦敦》、《米兰》、《布鲁塞尔》和《东京》，陈逸飞先生以一位艺术家的眼光和品位，引领读者从时尚设计、现代艺术和人文角度，对这四座最具时代潮流感的国际大都市，进行了一次非同寻常的寻找和发现之旅。　　这里不乏让人惊奇的视角和让人惊喜的发现，也有极为实用的旅游和艺术资讯。这套书既可作为让人大开眼界的珍藏，也可以当作独一无二的时尚旅行手册。这套书的装帧设计堪称别出心裁，前卫...,2021-12-24 19:48:57,2021-12-24 19:48:57
9787121259456,"PPT,要你好看",https://img9.doubanio.com/view/subject/l/public/s29605245.jpg,杨臻,,设计,电子工业出版社,它专为非设计专业的你准备，须任何设计基础即可阅读；它既能让你的PPT倍儿有面子，又能为你的PPT制作节约大量时间；它注重操作，即学即用；它融合了大量的优秀PPT实例，不?唆；它基础、全面、系统、深入，新手可用于入门，老手可依之精进；你既可以把它当作PPT设计的学习指南，又可以把它作为工具书放在案头随手查阅；它不是五花肉，它是牛排。,2021-12-24 19:49:02,2021-12-24 19:49:02
9787559428844,抽象城市,https://img9.doubanio.com/view/subject/l/public/s32320444.jpg,克里斯托夫•尼曼,,设计,江苏凤凰文艺出版社,◎金牌设计师的都市奇异幻想曲一本超乎你想象的脑洞书，随手一翻，轻松解压，激活创意，嗨翻每一天。◎当代备受瞩目的设计师、插画家、作家，被誉为设计界的鲁本斯《纽约客》首位AR封面设计者，也是NETFLIX最高分纪录片《Abstract》首集主人公，几乎获得过欧洲所有的设计类国际奖项，年仅40岁即入驻“纽约艺术指导协会荣誉殿堂”。◎酷到让人颅内出血的插图，治愈现代社会病的幽默文字全新脑系放松，摆脱工作没干劲、生活不规律、精神不振奋的状态，得到全身心治愈和解压，放飞自我。◎开放式阅读，多角度挖掘生活中的创意灵感书中所有创意都源自生活，通过同一空间的不同身份表达，无论从那页翻开，都可定位属于自己的时尚生活。◎装帧独具匠心，极好诠释设计的无限种可能全书装帧采用“虚实结合”的设计理念。双封精装，内文使用时尚质感的保艺画纸，让读者体验殿堂级藏品享受...,2021-12-24 19:49:08,2021-12-24 19:49:08
9787531815501,白夜北欧,https://img3.doubanio.com/view/subject/l/public/s1765090.jpg,[美国]王受之,,设计,黑龙江美术出版社,北欧文化有种很特殊的味道。美国洛杉矶艺术设计学院终身教授王受之用独特的见解和宽阔的视野角度、深入浅出的笔触，将北欧本身的设计及其文化品味从赞叹近乎于崇拜。 当今世界文化最具影响力的地方之——北欧，这本书将从它独特的设计、生活、建设及历史等各方面去深度解读它的魅力所在，阐述它影响着世界文化潮流的焦点所在。在我们外人来看，北欧设计都非常好，但是要很费力才能分辨它们之间的差异。北欧设计评论家安尼·斯滕罗斯曾经说：在北欧国家中，丹麦人比较“南部”化一点，芬兰人则有点“东方味道”，挪威人是“北派”，而瑞典人则基本是中坚。冰岛人自有一套，谁也不属。这本书将从北欧独特的设计、生活、建设及历史等各方面去深度解读它的魅力所在，从而阐述一个将德国严谨的功能主义与本土手工艺传统中的人文主义融会在一起的斯堪迪纳维亚设计。,2021-12-24 19:49:14,2021-12-24 19:49:14
9787508628530,设计心理学2,https://img1.doubanio.com/view/subject/l/public/s6860869.jpg,[美国]唐纳德·A·诺曼,张磊,设计,中信出版社,在本书中，诺曼博士探讨了为什么我们的生活需要复杂，而不是简单，而设计促成了复杂生活的实现。作者以清晰而又轻松的行文，为读者讲解了为什么我们渴望的不是简单。当物品的设计是可以被理解的、易于管理的、令人愉悦的，在适度的情况下，在适合的时间里，我们渴望的是复杂。实际上，通过基于良好沟通的设计，复杂是可以被管理的，从而生产出最实用的产品，导致理想的、以人为中心的设计。这种善于交际的设计，诺曼博士告诉我们，需要我们着眼于自然中的、现实中的、以及在日常生活中整个人类活动的全景，从而观察到在真实、自然环境中做实际工作的真实的人。最终，本书是一个人的宣言，即希望通过设计获得一个更美好的世界。,2021-12-24 19:49:21,2021-12-24 19:49:21
9787536671928,北欧新锐设计,https://img2.doubanio.com/view/subject/l/public/s6503021.jpg,殷紫,,设计,重庆出版社,北欧大牌新锐设计师最具有代表性的设计作品，带给你丰富广泛的最前沿设计信息，满足现代人的美丽家居梦想！　　当设计成为一种时尚的潮流，当人们不再钟情于粗糙的原始环境，当创意与舒适成为人们休闲的主旋律，寻找新锐、独特的设计作品成为现代人生活方式的首选。　　本书全面真实地展现了新北欧设计。　　一个一个才华横溢、年轻新锐的设计师名字后面，是他们享誉国际的设计作品。,2021-12-24 19:49:26,2021-12-24 19:49:26
9787535689368,海海人生,https://img3.doubanio.com/view/subject/l/public/s33537390.jpg,[日]横尾忠则,郑衍伟,设计,湖南美术出版社,日本前卫艺术圈最躁动的时代记录——呈现大师间的交往图谱国宝级设计师激荡人心的青春故事——从默默无闻到功成名就1.疯狂而意外的个人创作之路横尾忠则代表着日本设计的另外一支脉络，他绚烂而多彩，站在传统日式极简风格的背面，但又深深影响着日本设计。这种独特的风格不仅源自日本庶民阶级的审美也来自对西方艺术的吸收。在本书中，横尾记录了自我风格逐渐形成的过程。其中充满了疯狂、意外，以及惊喜。2.激荡而丰富的时代精神呈现1960年代到1980年代是日本文化领域最风起云涌的时代，本书近乎跟随作者的目光，观看了当时丰富的文化事件。通过与各个领域创作者的邂逅，立体的艺术图谱也被作者搭建起来。通过与他人的邂逅，一个人逐渐扩散到了一整个时代，展示出有趣的交往轶闻。3.首刷赠送纪念海报在诸多创作形式中，海报一直是横尾设计作品的原点，也是他1960至1980年代最广...,2021-12-24 19:49:32,2021-12-24 19:49:32
9787508630830,巴黎风格小屋,https://img3.doubanio.com/view/subject/l/public/s7654730.jpg,（法）莱斯特曼尼尔,吴乐寅,设计,中信出版社,《巴黎风格小屋:23个创意家居表情》内容简介：巴黎小屋的装饰灵魂在于不拘一格，在于主人们自由的天性和丰富的感性。在这里，出自设计师之手的家具和DIY的简单家具可以共居一室，古典油画和现代艺术也可以平起平坐。巴黎女人看似天马行空的搭配，却总能带出协调又时髦的气氛，令人赞叹不已。希望《巴黎风格小屋:23个创意家居表情》能将我们在巴黎各式小屋中所触碰到的所有新鲜感传递给大家，让每一个爱家爱生活的都市人都会由衷地发出“原来还有这样的创意”的赞叹，并能从中找到自己家居装饰的灵感，我们将无比荣幸。,2021-12-24 19:49:38,2021-12-24 19:49:38
